index,url,valid,domain,title,description,image,published,archive,content,quote,language,keyword
https://www.zeit.de/news/2025-02/14/temperaturen-unter-4-grad-und-teilweise-schnee-in-hessen,https://www.zeit.de/news/2025-02/14/temperaturen-unter-4-grad-und-teilweise-schnee-in-hessen,0,www.zeit.de,Wettervorhersage: Temperaturen unter 4 Grad und teilweise Schnee in Hessen,Hier finden Sie Informationen zu dem Thema „Wettervorhersage“. Lesen Sie jetzt „Temperaturen unter 4 Grad und teilweise Schnee in Hessen“.,https://img.zeit.de/news/2025-02/14/temperaturen-unter-4-grad-und-teilweise-schnee-in-hessen-image-group/wide__1300x731,2025-02-14T08:36:39Z,https://web.archive.org/web/20250215125215/https://www.zeit.de/news/2025-02/14/temperaturen-unter-4-grad-und-teilweise-schnee-in-hessen,"In Hessen bleiben die Temperaturen niedrig und mancherorts kann auch Schnee fallen. Am Freitag gebe es viele Wolken und lokal einige Schneeflocken, gab der Deutsche Wetterdienst (DWD) am Vormittag be… [+658 chars]",,de,'Schnee'
https://www.zeit.de/news/2025-02/14/verkehrsunfaelle-bei-schnee-und-eis-auf-den-strassen,https://www.zeit.de/news/2025-02/14/verkehrsunfaelle-bei-schnee-und-eis-auf-den-strassen,0,www.zeit.de,Verkehr: Verkehrsunfälle bei Schnee und Eis auf den Straßen,Hier finden Sie Informationen zu dem Thema „Verkehr“. Lesen Sie jetzt „Verkehrsunfälle bei Schnee und Eis auf den Straßen“.,https://img.zeit.de/news/2025-02/14/verkehrsunfaelle-bei-schnee-und-eis-auf-den-strassen-image-group/wide__1300x731,2025-02-14T09:21:01Z,https://web.archive.org/web/20250216071610/https://www.zeit.de/news/2025-02/14/verkehrsunfaelle-bei-schnee-und-eis-auf-den-strassen,Auf verschneiten und vereisten Straßen ist es in Berlin zu einer ganzen Reihe von Verkehrsunfällen gekommen. Die Feuerwehr sprach zunächst von 25 Unfällen in der Nacht zu Freitag. Zwei Menschen wurde… [+673 chars],,de,'Schnee'
https://www.zeit.de/sport/2025-02/fitnessuebung-gleichgewicht-balance-standwaage-ausfallschritt-personal-trainer,https://www.zeit.de/sport/2025-02/fitnessuebung-gleichgewicht-balance-standwaage-ausfallschritt-personal-trainer,0,www.zeit.de,"Unser Personal Trainer: Fünf Übungen, um nicht auf die Nase zu fallen","Vorsicht, Glatteis? Na und? Mit diesen Übungen schulen Sie Ihr Gleichgewicht und verlieren hoffentlich auch im Winter nicht den Boden unter den Füßen.",https://img.zeit.de/sport/2022-07/fitnessuebung-standwaage-personal-trainer-bild2/wide__1300x731,2025-02-14T13:01:21Z,http://archive.md/20250214131922/https://www.zeit.de/sport/2025-02/fitnessuebung-gleichgewicht-balance-standwaage-ausfallschritt-personal-trainer,"In der Serie ""Unser Personal
Trainer"" hilft
uns der Berliner Fitnesscoach Sebastian Grüner, stärker, gesünder und schöner
zu werden. Dieser Artikel ist Teil von ZEIT am Wochenende, Ausgabe 07/2025… [+339 chars]",,de,'Glatteis'
https://www.bild.de/leben-wissen/achtung-glatteis-so-laufen-sie-richtig-67af4fda1aeb2534badccd11,https://www.bild.de/leben-wissen/achtung-glatteis-so-laufen-sie-richtig-67af4fda1aeb2534badccd11,0,www.bild.de,ACHTUNG: Glatteis - So laufen sie richtig,"Pinguin-Gang oder doch lieber nach vorn beugen. Übers Glatteis laufe, ohne hinzufallen. So geht es.","https://images.bild.de/67af4fda1aeb2534badccd11/f54946566eca131cb0fd39ebecef80a6,6b1851ef?w=1280",2025-02-14T15:00:31Z,,"Mehr zum Video anzeigen 
Pinguin-Gang oder doch lieber nach vorn beugen. Übers Glatteis laufe, ohne hinzufallen. So geht es.
Quelle: BILD14.02.2025 - 16:00 Uhr",,de,'Glatteis'
https://www.stern.de/kultur/tv/wahl-o-mat---boomt-er-gerade-dank-des-rappers-ski-aggu---35468876.html,https://www.stern.de/kultur/tv/wahl-o-mat---boomt-er-gerade-dank-des-rappers-ski-aggu---35468876.html,0,www.stern.de,Rapstar: Der Wahl-O-Mat boomt – dank Rapper Ski Aggu?,"Der Wahl-O-Mat verzeichnet dieses Jahr Rekordwerte. Der Rapper Ski Aggu hat ein Video gepostet, in dem er für das Politik-Tool wirbt – mit einem überraschenden Gast.",https://image.stern.de/35469020/t/Fb/v2/w1440/r1.7778/-/wahl-o-mat-ski-aggu.jpg,2025-02-14T17:34:00Z,https://web.archive.org/web/20250214174555/https://www.stern.de/kultur/tv/wahl-o-mat---boomt-er-gerade-dank-des-rappers-ski-aggu---35468876.html,"Kopiere den aktuellen Link
Zur Merkliste hinzufügen
Der Wahl-O-Mat verzeichnet dieses Jahr Rekordwerte. Der Rapper Ski Aggu hat ein Video gepostet, in dem er für das Politik-Tool wirbt mit einem üb… [+9444 chars]",,de,'Rekordwerte'
https://www.zeit.de/news/2025-02/15/temperaturen-um-gefrierpunkt-in-rheinland-pfalz-und-saarland,https://www.zeit.de/news/2025-02/15/temperaturen-um-gefrierpunkt-in-rheinland-pfalz-und-saarland,0,www.zeit.de,Wetter: Temperaturen um Gefrierpunkt in Rheinland-Pfalz und Saarland,Hier finden Sie Informationen zu dem Thema „Wetter“. Lesen Sie jetzt „Temperaturen um Gefrierpunkt in Rheinland-Pfalz und Saarland“.,https://img.zeit.de/news/2025-02/15/temperaturen-um-gefrierpunkt-in-rheinland-pfalz-und-saarland-image-group/wide__1300x731,2025-02-15T09:28:27Z,https://web.archive.org/web/20250216180114/https://www.zeit.de/news/2025-02/15/temperaturen-um-gefrierpunkt-in-rheinland-pfalz-und-saarland,"Teils frostiges, aber niederschlagsfreies Wetter gibt es am Samstag in Rheinland-Pfalz und im Saarland. Die Höchsttemperatur liegen nach Angaben des Deutschen Wetterdienstes (DWD) zwischen ein und vi… [+389 chars]",,de,'Temperaturen'
https://www.zeit.de/news/2025-02/15/skifahrer-und-rodler-freuen-sich-ueber-schnee-im-harz,https://www.zeit.de/news/2025-02/15/skifahrer-und-rodler-freuen-sich-ueber-schnee-im-harz,0,www.zeit.de,Wetter: Skifahrer und Rodler freuen sich über Schnee im Harz,Hier finden Sie Informationen zu dem Thema „Wetter“. Lesen Sie jetzt „Skifahrer und Rodler freuen sich über Schnee im Harz“.,https://img.zeit.de/news/2025-02/15/skifahrer-und-rodler-freuen-sich-ueber-schnee-im-harz-image-group/wide__1300x731,2025-02-15T12:19:48Z,https://web.archive.org/web/20250216071217/https://www.zeit.de/news/2025-02/15/skifahrer-und-rodler-freuen-sich-ueber-schnee-im-harz,"Die kalten Temperaturen locken auch an diesem Wochenende viele Wintersportbegeisterte in den Harz. Tagsüber soll es am Samstag maximal ein Grad Celsius warm werden, am Sonntag liegen die Temperaturen… [+1585 chars]",,de,'Schnee'
https://www.faz.net/aktuell/gesellschaft/wetter-in-der-nacht-zu-montag-bis-zu-minus-15-grad-erwartet-110299185.html,https://www.faz.net/aktuell/gesellschaft/wetter-in-der-nacht-zu-montag-bis-zu-minus-15-grad-erwartet-110299185.html,0,www.faz.net,Wetter: In der Nacht zu Montag bis zu minus 15 Grad erwartet,In der Nacht zum Sonntag gibt es in vielen Regionen Schneeschauer. Am Wochenanfang kann die Temperatur über Nacht heftige Minusgrade erreichen.,https://media0.faz.net/ppmedia/aktuell/gesellschaft/3028518979/1.10299214/facebook_teaser/schnee-im-thueringer-wald.jpg,2025-02-15T12:46:16Z,https://web.archive.org/web/20250215153311/https://www.faz.net/aktuell/gesellschaft/wetter-in-der-nacht-zu-montag-bis-zu-minus-15-grad-erwartet-110299185.html,"Mit vereinzelten Schneeschauern im Norden und Osten, sonst aber meist trocken präsentiert sich das Wetter am Samstag. Im Osten und Süden sowie in den Mittelgebirgen muss nach Angaben des Deutschen We… [+1204 chars]",,de,'Schnee'
https://www.n-tv.de/panorama/Frostige-Finja-bringt-erst-Bibbernaechte-bei-minus-15-Grad-und-dann-den-Fruehling-article25566385.html,https://www.n-tv.de/panorama/Frostige-Finja-bringt-erst-Bibbernaechte-bei-minus-15-Grad-und-dann-den-Fruehling-article25566385.html,0,www.n-tv.de,Die Wetterwoche im Schnellcheck: Nach eiskaltem Wochenstart setzt Frühlingswetter ein,Der Winter macht sich diese Woche noch einmal deutlich bemerkbar: im Osten kommt es zu Minusgraden im zweistelligen Bereich. Tagsüber ist mit viel Sonne zu rechnen. Vor allem Südwestdeutschland kann sich zum Wochenende hin über frühlingshaftes Wetter freuen.,https://www.n-tv.de/img/incoming/crop25566409/2241328663-cImg_16_9-w1200/b5b90481571eee35b4731265a45d6b71.jpg,2025-02-16T10:47:56Z,https://web.archive.org/web/20250217064718/https://www.n-tv.de/panorama/Frostige-Finja-bringt-erst-Bibbernaechte-bei-minus-15-Grad-und-dann-den-Fruehling-article25566385.html,Der Winter macht sich diese Woche noch einmal deutlich bemerkbar: im Osten kommt es zu Minusgraden im zweistelligen Bereich. Tagsüber ist mit viel Sonne zu rechnen. Vor allem Südwestdeutschland kann … [+3399 chars],,de,'Sonne'
https://www.zeit.de/news/2025-02/16/nach-eiskaltem-wochenstart-steigen-die-temperaturen,https://www.zeit.de/news/2025-02/16/nach-eiskaltem-wochenstart-steigen-die-temperaturen,0,www.zeit.de,Wetteränderung in Sicht: Nach eiskaltem Wochenstart steigen die Temperaturen,Hier finden Sie Informationen zu dem Thema „Wetteränderung in Sicht“. Lesen Sie jetzt „Nach eiskaltem Wochenstart steigen die Temperaturen“.,https://img.zeit.de/news/2025-02/16/nach-eiskaltem-wochenstart-steigen-die-temperaturen-image-group/wide__1300x731,2025-02-16T12:13:55Z,https://web.archive.org/web/20250217030225/https://www.zeit.de/news/2025-02/16/nach-eiskaltem-wochenstart-steigen-die-temperaturen,"Zum Wochenstart wird es sehr kalt in Niedersachsen und Bremen, in den kommenden Nächten gibt es Frost bis teilweise minus zehn Grad. Doch bereits zur Wochenmitte sollen die Temperaturen steigen. «Von… [+1409 chars]",,de,'Sonne'
https://t3n.de/news/weniger-kohlendioxid-mehr-nachhaltige-kraftstoffe-das-soll-dieses-kuenstliche-blatt-koennen-1673358/,https://t3n.de/news/weniger-kohlendioxid-mehr-nachhaltige-kraftstoffe-das-soll-dieses-kuenstliche-blatt-koennen-1673358/,0,t3n.de,"Weniger Kohlendioxid, mehr nachhaltige Kraftstoffe: Das soll dieses künstliche Blatt können","Wissenschaftler:innen haben ein neues „künstliches Blatt“ entwickelt, das CO₂ aus der Luft entfernt und in nachhaltige Kraftstoffe verwandelt. Dazu verwendet es eine Methode, die an die Fotosynthese natürlicher Blätter angelehnt ist.weiterlesen auf t3n.de",https://t3n.de/news/wp-content/uploads/2025/02/perowskit-blatt-cambridge.png,2025-02-16T14:23:40Z,,"Um eine Technologie zum Abbau von CO aus der Luft zu entwickeln, experimentieren Forscher:innen weltweit mit künstlichen Blättern. Das erscheint naheliegend, denn ihre natürlichen Vorbilder entziehen… [+5577 chars]",,de,'Blätter'
https://www.zeit.de/news/2025-02/16/spuren-im-schnee-fuehren-zu-tatverdaechtigem,https://www.zeit.de/news/2025-02/16/spuren-im-schnee-fuehren-zu-tatverdaechtigem,0,www.zeit.de,Kriminalität: Spuren im Schnee führen zu Tatverdächtigem,Hier finden Sie Informationen zu dem Thema „Kriminalität“. Lesen Sie jetzt „Spuren im Schnee führen zu Tatverdächtigem“.,https://img.zeit.de/news/2025-02/16/spuren-im-schnee-fuehren-zu-tatverdaechtigem-image-group/wide__1300x731,2025-02-16T16:05:56Z,https://web.archive.org/web/20250217084430/https://www.zeit.de/news/2025-02/16/spuren-im-schnee-fuehren-zu-tatverdaechtigem,"Perfekte Spurenlage: Im sächsischen Altenberg hat ein Jugendlicher der Polizei bei ihren Ermittlungen zu einer Straftat einen raschen Erfolg beschert. Wie die Polizeidirektion Dresden mitteilte, soll… [+310 chars]",,de,'Schnee'
https://www.stern.de/gesellschaft/regional/sachsen-anhalt/verkehr--glaette-loest-mehrere-unfaelle-auf-a2-und-a36-aus-35472232.html,https://www.stern.de/gesellschaft/regional/sachsen-anhalt/verkehr--glaette-loest-mehrere-unfaelle-auf-a2-und-a36-aus-35472232.html,0,www.stern.de,Verkehr: Glätte löst mehrere Unfälle auf A2 und A36 aus,"Magdeburg (sa) - Schnee und Glätte haben in der Nacht auf Montag zu mehreren Verkehrsunfällen im Umkreis von Magdeburg geführt. Wie die Polizei mitteilte,",https://image.stern.de/35472234/t/vA/v1/w1440/r1.7778/-/17--4m4ewhvprzv6axs2048jpeg---ded582a3cf2e354e.jpg,2025-02-16T23:53:44Z,,"Kopiere den aktuellen Link
Zur Merkliste hinzufügen
Viele mögen die weiße Winterlandschaft, die sich derzeit vielerorts auftut. Für Autofahrer birgt diese aber Gefahren.
Schnee und Glätte haben in… [+897 chars]",,de,'Schnee'
https://www.zeit.de/news/2025-02/17/diakonie-fordert-ganztaegige-oeffnung-des-winternotprogramms,https://www.zeit.de/news/2025-02/17/diakonie-fordert-ganztaegige-oeffnung-des-winternotprogramms,0,www.zeit.de,Frost und Schnee: Diakonie fordert ganztägige Öffnung des Winternotprogramms,Hier finden Sie Informationen zu dem Thema „Frost und Schnee“. Lesen Sie jetzt „Diakonie fordert ganztägige Öffnung des Winternotprogramms“.,https://img.zeit.de/news/2025-02/17/diakonie-fordert-ganztaegige-oeffnung-des-winternotprogramms-image-group/wide__1300x731,2025-02-17T04:30:36Z,,Angesichts der eisigen Temperaturen hat die Diakonie Hamburg eine ganztägige Öffnung der Räume des Winternotprogramms gefordert. «Nachts sinken die Temperaturen weit unter null Grad. Für die obdachlo… [+954 chars],,de,'Schnee'
https://www.stern.de/gesellschaft/regional/hamburg-schleswig-holstein/frost-und-schnee--diakonie-fordert-ganztaegige-oeffnung-des-winternotprogramms-35472494.html,https://www.stern.de/gesellschaft/regional/hamburg-schleswig-holstein/frost-und-schnee--diakonie-fordert-ganztaegige-oeffnung-des-winternotprogramms-35472494.html,0,www.stern.de,Frost und Schnee: Diakonie fordert ganztägige Öffnung des Winternotprogramms,Hamburg (lno) - Angesichts der eisigen Temperaturen hat die Diakonie Hamburg eine ganztägige Öffnung der Räume des Winternotprogramms gefordert. «Nachts,https://image.stern.de/35472496/t/ZP/v1/w1440/r1.7778/-/17--hcx3iu5knav13axs2048jpeg---89999632615344a4.jpg,2025-02-17T04:30:36Z,,"Kopiere den aktuellen Link
Zur Merkliste hinzufügen
Nachts sinken die Temperaturen weit unter null Grad. Für obdachlose Menschen in Hamburg bedeutet das eine große Gefahr.
Angesichts der eisigen T… [+1089 chars]",,de,'Schnee'
https://www.autobild.de/artikel/armin-schwarz-rally-driving-experience-27876587.html,https://www.autobild.de/artikel/armin-schwarz-rally-driving-experience-27876587.html,0,www.autobild.de,Rallye-Schule im Schnee,"Die Kontrolle auf Eis und Schnee behalten, Kurven gezielt im Drift nehmen. Das können normale Autofahrer bei den Rallye- Profis Armin und Fabio Schwarz lernen. Ein Selbstversuch.",https://i.auto-bild.de/ir_img/3/8/9/8/5/3/3/Rallye-Schule-im-Schnee-2869-1800x1012-ec7fe7f9b0eaa5bd.jpg?impolicy=og_images,2025-02-17T05:00:00Z,,"Das Funkgerät in der Türablage knackt. Dann dröhnt die Stimme von Armin Schwarz (61) durch den Innenraum des Toyota GR Yaris. Jetzt GAS, GAS, GAS!, ruft mir der ehemalige Rallye-WM-Pilot und letzte d… [+4084 chars]",,de,'Schnee'
https://www.zeit.de/news/2025-02/17/hoehere-temperaturen-in-sicht-am-freitag-bis-zu-17-grad,https://www.zeit.de/news/2025-02/17/hoehere-temperaturen-in-sicht-am-freitag-bis-zu-17-grad,0,www.zeit.de,Wetter: Höhere Temperaturen in Sicht – am Freitag bis zu 17 Grad,Hier finden Sie Informationen zu dem Thema „Wetter“. Lesen Sie jetzt „Höhere Temperaturen in Sicht – am Freitag bis zu 17 Grad“.,https://img.zeit.de/news/2025-02/17/hoehere-temperaturen-in-sicht-am-freitag-bis-zu-17-grad-image-group/wide__1300x731,2025-02-17T07:20:44Z,,"Die Menschen in Baden-Württemberg können sich im Laufe der Woche auf höhere Temperaturen einstellen. Es werde freundlicher, sagte ein Meteorologe des Deutschen Wetterdienstes (DWD). Ab Mittwoch werde… [+838 chars]",,de,'Schnee'
https://www.stern.de/gesellschaft/regional/baden-wuerttemberg/wetter--hoehere-temperaturen-in-sicht---am-freitag-bis-zu-17-grad-35472682.html,https://www.stern.de/gesellschaft/regional/baden-wuerttemberg/wetter--hoehere-temperaturen-in-sicht---am-freitag-bis-zu-17-grad-35472682.html,0,www.stern.de,Wetter: Höhere Temperaturen in Sicht – am Freitag bis zu 17 Grad,Die Menschen in Baden-Württemberg können sich im Laufe der Woche auf wärmeres Wetter freuen. Trotzdem kann es in der Nacht zum Donnerstag glatt werden.,https://image.stern.de/35472684/t/aZ/v1/w1440/r1.7778/-/17--rpwywe2zyfv6axs2048jpeg---c501343edb6fe1f9.jpg,2025-02-17T07:20:44Z,,"Kopiere den aktuellen Link
Zur Merkliste hinzufügen
Die Menschen in Baden-Württemberg können sich im Laufe der Woche auf wärmeres Wetter freuen. Trotzdem kann es in der Nacht zum Donnerstag glatt w… [+1005 chars]",,de,'Schnee'
https://www.stern.de/gesellschaft/regional/hessen/wettervorhersage--sonne-am-tag-und-frost-in-der-nacht-35472726.html,https://www.stern.de/gesellschaft/regional/hessen/wettervorhersage--sonne-am-tag-und-frost-in-der-nacht-35472726.html,0,www.stern.de,Wettervorhersage: Sonne am Tag und Frost in der Nacht,"Der Frühling ist in Hessen noch fern. Die erste Hälfte der neuen Woche präsentiert sich zwar mit schönem Wetter, aber auch klirrender Kälte in den Nächten.",https://image.stern.de/35472728/t/QU/v1/w1440/r1.7778/-/17--dsb6j2wu25v12axs2048jpeg---a61d4ae749bc8a98.jpg,2025-02-17T07:49:39Z,,"Kopiere den aktuellen Link
Zur Merkliste hinzufügen
Der Frühling ist in Hessen noch fern. Die erste Hälfte der neuen Woche präsentiert sich zwar mit schönem Wetter, aber auch klirrender Kälte in de… [+880 chars]",,de,'Sonne'
https://www.zeit.de/news/2025-02/17/sonne-am-tag-und-frost-in-der-nacht,https://www.zeit.de/news/2025-02/17/sonne-am-tag-und-frost-in-der-nacht,0,www.zeit.de,Wettervorhersage: Sonne am Tag und Frost in der Nacht,Hier finden Sie Informationen zu dem Thema „Wettervorhersage“. Lesen Sie jetzt „Sonne am Tag und Frost in der Nacht“.,https://img.zeit.de/news/2025-02/17/sonne-am-tag-und-frost-in-der-nacht-image-group/wide__1300x731,2025-02-17T07:49:39Z,,"Sonne am Tag, Frost in der Nacht: Ein Winterhoch mit Schwerpunkt über Nordostdeutschland schickt trocken-kalte Festlandsluft nach Hessen. Regen oder Schnee fallen vorerst nicht in der neuen Woche, wi… [+709 chars]",,de,'Sonne'
https://www.zeit.de/news/2025-02/17/erst-sonne-und-frost-dann-wird-es-regnerisch-und-waermer,https://www.zeit.de/news/2025-02/17/erst-sonne-und-frost-dann-wird-es-regnerisch-und-waermer,0,www.zeit.de,Wetter-Mix: Erst Sonne und Frost - dann wird es regnerisch und wärmer,Hier finden Sie Informationen zu dem Thema „Wetter-Mix“. Lesen Sie jetzt „Erst Sonne und Frost - dann wird es regnerisch und wärmer“.,https://img.zeit.de/news/2025-02/17/erst-sonne-und-frost-dann-wird-es-regnerisch-und-waermer-image-group/wide__1300x731,2025-02-17T08:31:37Z,,"In der neuen Woche können sich die Menschen auf sonniges Winterwetter freuen, am Donnerstag wird es regnerisch und deutlich wärmer. Wie der Deutsche Wetterdienst (DWD) mitteilte, bleibt es nach einem… [+883 chars]",,de,'Sonne'
https://www.stern.de/gesellschaft/regional/nordrhein-westfalen/wetter-mix--erst-sonne-und-frost---dann-wird-es-regnerisch-und-waermer-35472850.html,https://www.stern.de/gesellschaft/regional/nordrhein-westfalen/wetter-mix--erst-sonne-und-frost---dann-wird-es-regnerisch-und-waermer-35472850.html,0,www.stern.de,Wetter-Mix: Erst Sonne und Frost - dann wird es regnerisch und wärmer,"Essen (lnw) - In der neuen Woche können sich die Menschen auf sonniges Winterwetter freuen, am Donnerstag wird es regnerisch und deutlich wärmer. Wie der",https://image.stern.de/35472852/t/Zk/v1/w1440/r1.7778/-/17--sap24xgawav4axs2048jpeg---446599389769d38a.jpg,2025-02-17T08:31:37Z,https://web.archive.org/web/20250217092103/https://www.stern.de/gesellschaft/regional/nordrhein-westfalen/wetter-mix--erst-sonne-und-frost---dann-wird-es-regnerisch-und-waermer-35472850.html,"Kopiere den aktuellen Link
Zur Merkliste hinzufügen
Die Woche startet kalt und frostig. Am Donnerstag steigen die Temperaturen bis zwölf Grad.
In der neuen Woche können sich die Menschen auf sonni… [+989 chars]",,de,'Sonne'
https://www.bild.de/news/wetter/wetter-minus-23-4-grad-in-sachsen-67b2e67244fb2a25b74d7b7b,https://www.bild.de/news/wetter/wetter-minus-23-4-grad-in-sachsen-67b2e67244fb2a25b74d7b7b,0,www.bild.de,"Darum ist es so bitterkalt - Frostdeutschland! Minus 23,4 Grad in Sachsen","Eisige Temperaturen von -23,4 Grad in Kühnhaide, dem kältesten Ort Deutschlands, sorgen für frostige Nächte und besondere Herausforderungen für Obdachlose.","https://images.bild.de/67b2e67244fb2a25b74d7b7b/36f390a8a6bc177199be93a5a40a5bd1,b03f3e2?w=1280",2025-02-17T10:17:50Z,http://archive.md/20250217153856/https://www.bild.de/news/wetter/wetter-minus-23-4-grad-in-sachsen-67b2e67244fb2a25b74d7b7b,"In der Nacht zum Montag rutschten die Temperaturen richtig in den Keller. Vor allem im FROsten war es bibber-kalt!
Minus 15 Grad wurden an der Oder in Brandenburg gemessen, im Thüringer Harz ähnlich… [+2806 chars]",,de,'Schnee'
https://www.faz.net/aktuell/stil/leib-seele/wie-kuenstlerin-angela-santana-frauenkoerper-von-social-media-fotos-entfremdet-110273922.html,https://www.faz.net/aktuell/stil/leib-seele/wie-kuenstlerin-angela-santana-frauenkoerper-von-social-media-fotos-entfremdet-110273922.html,0,www.faz.net,Wie Künstlerin Angela Santana Frauenkörper von Social-Media-Fotos entfremdet,"Im Sommer steht der weibliche Körper unter besonderer Beobachtung. Dann soll er sein wie in den sozialen Medien, in der Werbung, im Freibad. Die Künstlerin Angela Santana nimmt sich solche Fotos – und formt daraus etwas Neues.",https://media0.faz.net/ppmedia/aktuell/1809891672/1.10273962/facebook_teaser/fe8cfcf4-ce86-11ef-b24e.jpg,2025-02-17T10:51:35Z,,"Sommerzeit ist Körperzeit Zeit für Crop-Tops und abgeschnittene Jeans-Shorts. Zeit für Bauch, Beine, Po. Damit ist seit vergangenem Sommer kein Neunzigerjahre-Aerobic-Kurs mehr gemeint, wie damals, a… [+6426 chars]",,de,'Freibad'
https://www.spektrum.de/kolumne/insekten-winterhafte-trotzen-dem-frost-dank-frostschutzmittel/2253379,https://www.spektrum.de/kolumne/insekten-winterhafte-trotzen-dem-frost-dank-frostschutzmittel/2253379,0,www.spektrum.de,Star-Bugs - die kleine-Tiere-Kolumne: Der zauberhafte Winzling im Schnee,Winterhafte sind selbst bei frostigen Bedingungen unterwegs. Schnee dient ihnen sogar als Datingplattform.,https://static.spektrum.de/fm/912/f1920x1080/85261548_pa.jpg,2025-02-17T11:00:00Z,,"Haft möchte außerdem weniger bekannte Tiere zeigen, möchte laut in die Welt hinausrufen: »Seht her, wie krass Insekten sind.« Er freut sich, wenn auf Instagram Menschen auf sein Winterhaftbild reagie… [+1197 chars]",,de,'Schnee'
https://www.focus.de/regional/wetter/1-zentimeter-schnee-im-februar-muenchen-kaempft-mit-schwindendem-winter_c9c79886-df4e-40a8-8e39-d6dfb4e061c8.html,https://www.focus.de/regional/wetter/1-zentimeter-schnee-im-februar-muenchen-kaempft-mit-schwindendem-winter_c9c79886-df4e-40a8-8e39-d6dfb4e061c8.html,0,www.focus.de,- 1 Zentimeter Schnee im Februar – München kämpft mit schwindendem Winter,"Nur noch ein Hauch von Winter - und das schon das fünfte Jahr in Folge. Münchens Februar ist alles, nur nicht reich an Schnee.Von FOCUS-online-Experte Jan Schenk",https://quadro.burda-forward.de/ctf/856d05cf-117e-4a0c-a7be-1da9e2b4842a.3a4d8cb6-6bc5-4240-abb6-d002a1cf99f3.jpg?im=RegionOfInterestCrop%3D%281200%2C630%29%2CregionOfInterest%3D%28671%2C440%29&hash=c7a789ca08ae404cd57254c9c4ac8d337a7272b5176f3cdaeba98fa43b893c1c,2025-02-17T11:09:00Z,,"Schnee wird in München im Februar immer seltener. Gab es früher regelmäßig Schnee, so herrscht nun schon seit fünf Jahren Schneearmut im Februar in der bayerischen Landeshauptstadt. Zwar ist es in de… [+2094 chars]",,de,'Schnee'
https://www.focus.de/regional/wetter/winter-wetter-seit-fuenf-jahren-herrscht-eklatante-schneearmut-in-muenchen_c9c79886-df4e-40a8-8e39-d6dfb4e061c8.html,https://www.focus.de/regional/wetter/winter-wetter-seit-fuenf-jahren-herrscht-eklatante-schneearmut-in-muenchen_c9c79886-df4e-40a8-8e39-d6dfb4e061c8.html,0,www.focus.de,Winter-Wetter - Seit fünf Jahren herrscht eklatante Schneearmut in München,"Nur noch ein Hauch von Winter - und das schon das fünfte Jahr in Folge. Münchens Februar ist alles, nur nicht reich an Schnee.Von FOCUS-online-Experte Jan Schenk",https://quadro.burda-forward.de/ctf/856d05cf-117e-4a0c-a7be-1da9e2b4842a.3a4d8cb6-6bc5-4240-abb6-d002a1cf99f3.jpg?im=RegionOfInterestCrop%3D%281200%2C630%29%2CregionOfInterest%3D%28671%2C440%29&hash=c7a789ca08ae404cd57254c9c4ac8d337a7272b5176f3cdaeba98fa43b893c1c,2025-02-17T11:09:00Z,,"Schnee wird in München im Februar immer seltener. Gab es früher regelmäßig Schnee, so herrscht nun schon seit fünf Jahren Schneearmut im Februar in der bayerischen Landeshauptstadt. Zwar ist es in de… [+2094 chars]",,de,'Schnee'
https://www.tagesspiegel.de/berlin/bezirke/kritik-an-erhohung-um-5000-prozent-pankows-politik-will-strandbad-weissensee-nach-steuer-schock-retten-13218049.html,https://www.tagesspiegel.de/berlin/bezirke/kritik-an-erhohung-um-5000-prozent-pankows-politik-will-strandbad-weissensee-nach-steuer-schock-retten-13218049.html,0,www.tagesspiegel.de,Kritik an Erhöhung um 5000 Prozent: Pankows Politik will Strandbad Weißensee nach Steuer-Schock retten,Das beliebte Berliner Freibad soll statt 800 nun 37.000 Euro Grundsteuer zahlen. Pankows Parteien sehen eine fehlerhafte Berechnung und fürchten drastische Folgen - wie geht es jetzt weiter?,https://www.tagesspiegel.de/images/6750331/alternates/BASE_16_9_W1400/1658766401000/schwimmbad-dpa-8842.jpeg,2025-02-17T11:44:25Z,http://archive.md/20250217114844/https://www.tagesspiegel.de/berlin/bezirke/kritik-an-erhohung-um-5000-prozent-pankows-politik-will-strandbad-weissensee-nach-steuer-schock-retten-13218049.html,Das Strandbad Weißensee in Berlin kämpft offenbar nach einer Grundsteuer-Erhöhung von fast 5000 Prozent ums Überleben. Nun wollen Bezirksamt und Bezirksverordnetenversammlung (BVV) in Pankow darüber … [+180 chars],,de,'Freibad'
