index,published,keyword,domain,language,valid,title,description,url,image,archive,content,quote
d00567cdaed0e51f7b73aab176202220,2025-10-10T18:00:01Z,'heat climate change',phys.org,en,0,Microwave technique allows energy-efficient chemical reactions,"Some industrial processes used to create useful chemicals require heat, but heating methods are often inefficient, partly because they heat a greater volume of space than they really need to. Researchers, including those from the University of Tokyo, devised …",https://phys.org/news/2025-10-microwave-technique-energy-efficient-chemical.html,https://scx2.b-cdn.net/gfx/news/hires/2025/microwaves-for-energy.jpg,http://web.archive.org/web/20251010185143/https://phys.org/news/2025-10-microwave-technique-energy-efficient-chemical.html,"Some industrial processes used to create useful chemicals require heat, but heating methods are often inefficient, partly because they heat a greater volume of space than they really need to. Researc… [+5565 chars]",
4e64f3008139a5aeb9d4e54c04bef2e5,2025-10-12T20:27:19Z,'warm spell',www.abc.net.au,en,0,Isolated storms forecast for Queensland after weekend hail storm,The Bureau of Meteorology is also predicting a return to regular spring temperatures after a spell of warmer days.,https://www.abc.net.au/news/2025-10-13/isolated-storms-forecast-for-queensland-this-week/105882378,https://live-production.wcms.abc-cdn.net.au/6e83495d691d2b65b83197a9444817c4?impolicy=wcms_watermark_news&cropH=2268&cropW=4032&xPos=0&yPos=378&width=862&height=485&imformat=generic,,"Queensland is in for more sunny weather with the possibility of some thunderstorms this week. 
The Bureau of Meteorology is also forecasting a return to regular spring temperatures after a spell of … [+2238 chars]",
d5e844ef44d84d4499af7eade6c7392f,2025-10-16T21:00:21Z,'heat wave',www.abc.net.au,en,0,"Bat boxes can become deadly roosts when the weather heats up, study finds","Artificial roosts, or “bat boxes”, have become a popular home conservation tool. But a new study raises concerns about the danger these boxes pose during heatwaves.",https://www.abc.net.au/news/science/2025-10-17/bat-boxes-can-become-fatally-warm-during-heatwaves/105898564,https://live-production.wcms.abc-cdn.net.au/09cd812d445f4d0f00696b778c503d3d?impolicy=wcms_watermark_news&cropH=1152&cropW=2048&xPos=0&yPos=76&width=862&height=485&imformat=generic,,"Artificial roosts for bats or bat boxes are a popular way to conserve native species when their natural habitat has been depleted.
They are often used in urban areas to provide shelter where large t… [+6796 chars]",
4d3ac8c6a30309ef0805e31b152592b3,2025-10-24T12:13:48Z,'heat climate change',abcnews.go.com,en,0,"In a California farming region, researchers are mapping rural heat to protect farmworkers","In some of the most agriculturally rich regions in the U.S., researchers from San Diego State University are working to understand how climate change is impacting heat in rural areas and the farmworkers who toil in them",https://abcnews.go.com/Technology/wireStory/california-farming-region-researchers-mapping-rural-heat-protect-126827868,https://i.abcnewsfe.com/a/335f04de-24f6-4cce-bded-0814f26b9d3e/wirestory_7dbd91789dfe19322a7a928d4d560908_16x9.jpg?w=1600,,"In the summers, the sky is jet black when Raul Cruz arrives at this Imperial Valley sugarcane field to start his day. He chops, cleans and bundles the crop, taking heed as the sun rises. It's hard wo… [+5971 chars]",
4e6ff91736450a8e77521058ec2b8f50,2025-10-24T19:06:04Z,'heat wave',www.abc.net.au,en,0,Northern Australia urged to prepare for severe heatwave,"As a ""silent killer"" blankets large parts of Australia's north this weekend, medical professionals urge people to plan ahead and stay hydrated.",https://www.abc.net.au/news/2025-10-25/heatwave-longreach-mt-isa-northern-australia-weather-deaths/105932230,https://live-production.wcms.abc-cdn.net.au/15009d2cbb77e915c8b4a55b5ea81098?impolicy=wcms_watermark_news&cropH=2813&cropW=5000&xPos=0&yPos=935&width=862&height=485&imformat=generic,,"Sam Cronin's phone is ringing every 10 minutes at the moment.
As large swathes of Australia's north sweat through severe heatwave conditions that are expected to peak this weekend, the Longreach ref… [+5272 chars]",
5cb00a7d7eeb71550fbe52b50dcc6a6e,2025-10-26T20:38:09Z,'heat wave',rollingout.com,en,0,Southern California braces for dangerous Tuesday heat wave,Southern California residents must prepare for potentially dangerous heat conditions as the National Weather Service issued an official heat advisory covering multiple inland counties for Tuesday. The warning affects millions of people across San Bernardino C…,https://rollingout.com/2025/10/26/california-braces-for-tuesday-heat-wave/,https://rollingout.com/wp-content/uploads/2024/08/shutterstock_1992587213.jpg,,Southern California residents must prepare for potentially dangerous heat conditions as the National Weather Service issued an official heat advisory covering multiple inland counties for Tuesday. Th… [+4898 chars],
524d95431e1da23b815334d4d4a8427d,2025-10-31T09:32:47Z,'warm spell',www.hurriyetdailynews.com,en,0,Türkiye set to see brief return of warm weather,"Türkiye is expected to experience a brief spell of warmer weather, with temperatures rising by 3 to 5 degrees Celsius across much of the country, according to the country’s weather bureau.",https://www.hurriyetdailynews.com/turkiye-set-to-see-brief-return-of-warm-weather-215227,https://image.hurimg.com/i/hurriyet/75/200x200/6904823c565ce91c6c2966ec.jpg,,"ISTANBUL
Türkiye is expected to experience a brief spell of warmer weather, with temperatures rising by 3 to 5 degrees Celsius across much of the country, according to the countrys weather bureau.
… [+1400 chars]",
264a84d8d45ef0ce4e5e1f81121cbe7f,2025-10-31T21:31:54Z,'heat climate change',grist.org,en,0,‘A devastating global audit’ shows how climate change is undermining the health of millions,"Extreme heat now kills one person every minute, according to a sweeping new report by the British medical journal The Lancet.",https://grist.org/health/lancet-2025-countdown-health-climate-change-report/,https://grist.org/wp-content/uploads/2025/10/GettyImages-2228681461-1.jpg?quality=75&strip=all,,"This story is part of the Grist series Vital Signs, exploring the ways climate change affects your health. This reporting initiative is made possible thanks to support from the Wellcome Trust.
As wo… [+4655 chars]",
