index,url,valid,domain,title,description,image,published,archive,content,quote,language,keyword
https://www.stern.de/gesellschaft/regional/sachsen/glatte-strassen--wetterdienst-warnt-vor-glatteis-35455808.html,https://www.stern.de/gesellschaft/regional/sachsen/glatte-strassen--wetterdienst-warnt-vor-glatteis-35455808.html,0,www.stern.de,Glatte Straßen: Wetterdienst warnt vor Glatteis,"Dresden - Auf den Straßen in Sachsen, Sachsen-Anhalt und Thüringen kann es glatt werden. Der Deutsche Wetterdienst sprach aufgrund von Schneefall und",https://image.stern.de/35455810/t/Ch/v1/w1440/r1.7778/-/11--7tecdqnkfov6axs2048jpeg---2c4b4bd9515ea92e.jpg,2025-02-11T05:38:15Z,,"Kopiere den aktuellen Link
Autofahrer sind zur Vorsicht angehalten. Bis zum Mittwoch besteht in Sachsen, Sachsen-Anhalt und Thüringen Glättegefahr.
Auf den Straßen in Sachsen, Sachsen-Anhalt und Th… [+538 chars]",,de,'Schnee'
https://www.zeit.de/news/2025-02/11/wetterdienst-warnt-vor-glatteis,https://www.zeit.de/news/2025-02/11/wetterdienst-warnt-vor-glatteis,0,www.zeit.de,Glatte Straßen: Wetterdienst warnt vor Glatteis,Hier finden Sie Informationen zu dem Thema „Glatte Straßen“. Lesen Sie jetzt „Wetterdienst warnt vor Glatteis“.,https://img.zeit.de/news/2025-02/11/wetterdienst-warnt-vor-glatteis-image-group/wide__1300x731,2025-02-11T05:38:15Z,,"Auf den Straßen in Sachsen, Sachsen-Anhalt und Thüringen kann es glatt werden. Der Deutsche Wetterdienst sprach aufgrund von Schneefall und gefrierenden Regens für alle drei Bundesländer Warnungen au… [+428 chars]",,de,'Glatteis'
https://www.zeit.de/news/2025-02/11/schnee-und-schneeregen-in-den-naechsten-tagen,https://www.zeit.de/news/2025-02/11/schnee-und-schneeregen-in-den-naechsten-tagen,0,www.zeit.de,Wetter: Schnee und Schneeregen in den nächsten Tagen,Hier finden Sie Informationen zu dem Thema „Wetter“. Lesen Sie jetzt „Schnee und Schneeregen in den nächsten Tagen“.,https://img.zeit.de/news/2025-02/11/schnee-und-schneeregen-in-den-naechsten-tagen-image-group/wide__1300x731,2025-02-11T08:06:20Z,,"Das Wetter in Rheinland-Pfalz und im Saarland bleibt grau und ungemütlich. Am Dienstag ist es meist stark bewölkt, in der Nacht zum Mittwoch kann dann im Süden etwas Regen aufkommen, wie der Deutsche… [+410 chars]",,de,'Regen'
https://www.zeit.de/news/2025-02/12/leichter-schneefall-in-berlin-und-brandenburg,https://www.zeit.de/news/2025-02/12/leichter-schneefall-in-berlin-und-brandenburg,0,www.zeit.de,Wetter: Leichter Schneefall in Berlin und Brandenburg,Hier finden Sie Informationen zu dem Thema „Wetter“. Lesen Sie jetzt „Leichter Schneefall in Berlin und Brandenburg“.,https://img.zeit.de/news/2025-02/12/leichter-schneefall-in-berlin-und-brandenburg-image-group/wide__1300x731,2025-02-12T04:46:57Z,https://web.archive.org/web/20250212063835/https://www.zeit.de/news/2025-02/12/leichter-schneefall-in-berlin-und-brandenburg,"Kälte und gegen Abend auch leichter Schneefall erwarten die Menschen in Berlin und Brandenburg. Nach einem zunächst sonnigen Start ziehen im Verlauf des Tages zunehmend Wolken auf, wie der Deutsche W… [+714 chars]",,de,'Temperaturen'
https://www.zeit.de/news/2025-02/12/wechselhaftes-wetter-schneeregen-und-schnee-in-nrw,https://www.zeit.de/news/2025-02/12/wechselhaftes-wetter-schneeregen-und-schnee-in-nrw,0,www.zeit.de,"Wetter: Wechselhaftes Wetter, Schneeregen und Schnee in NRW","Hier finden Sie Informationen zu dem Thema „Wetter“. Lesen Sie jetzt „Wechselhaftes Wetter, Schneeregen und Schnee in NRW“.",https://img.zeit.de/news/2025-02/12/wechselhaftes-wetter-schneeregen-und-schnee-in-nrw-image-group/wide__1300x731,2025-02-12T08:13:39Z,,"In Nordrhein-Westfalen sind die nächsten Tage geprägt von wechselhaftem Wetter und Niederschlägen. Wie der Deutsche Wetterdienst (DWD) mitteilte, lockert es im Westen auf und wird teilweise sonnig. I… [+759 chars]",,de,'Regen'
https://www.kraftfuttermischwerk.de/blogg/the-birdwatchers/,https://www.kraftfuttermischwerk.de/blogg/the-birdwatchers/,0,www.kraftfuttermischwerk.de,The Birdwatchers,"Ein mehrfach preisgekrönter Naturdokumentarfilm von Thomas Winward der sich denen widmet, die Vögel beobachten. What does it mean to be a birdwatcher? Why is access…Mehr lesen ->The Birdwatchers",https://www.kraftfuttermischwerk.de/blogg/wp-content/uploads2/2025/02/maxresdefault.jpg,2025-02-12T14:28:33Z,,"Ein mehrfach preisgekrönter Naturdokumentarfilm von Thomas Winward der sich denen widmet, die Vögel beobachten. What does it mean to be a birdwatcher? Why is access to nature important? What makes so… [+638 chars]",,de,'Natur'
https://www.stern.de/gesellschaft/regional/hessen/zugvoegel-als-fruehlingssymbol--tausende-kraniche-ziehen-wieder-ueber-hessen-hinweg-35462274.html,https://www.stern.de/gesellschaft/regional/hessen/zugvoegel-als-fruehlingssymbol--tausende-kraniche-ziehen-wieder-ueber-hessen-hinweg-35462274.html,0,www.stern.de,Zugvögel als Frühlingssymbol: Tausende Kraniche ziehen wieder über Hessen hinweg,Fast meint man es noch im Ohr zu haben: Vor wenigen Wochen noch zogen Kraniche gen Süden. Nun sind viele der imposanten Vögel schon wieder zurück. Und feiern auf ganz eigene Art den Tag der Liebenden.,https://image.stern.de/35462276/t/WD/v1/w1440/r1.7778/-/13--d6k7i4bbn4v6axs2048jpeg---e389f62c3546f9f7.jpg,2025-02-13T03:00:39Z,,"Kopiere den aktuellen Link
Zur Merkliste hinzufügen
Fast meint man es noch im Ohr zu haben: Vor wenigen Wochen noch zogen Kraniche gen Süden. Nun sind viele der imposanten Vögel schon wieder zurück… [+2424 chars]",,de,'Vögel'
https://www.zeit.de/news/2025-02/13/glaette-und-schnee-in-baden-wuerttemberg-erwartet,https://www.zeit.de/news/2025-02/13/glaette-und-schnee-in-baden-wuerttemberg-erwartet,0,www.zeit.de,Wetter: Glätte und Schnee in Baden-Württemberg erwartet,Hier finden Sie Informationen zu dem Thema „Wetter“. Lesen Sie jetzt „Glätte und Schnee in Baden-Württemberg erwartet“.,https://img.zeit.de/news/2025-02/13/glaette-und-schnee-in-baden-wuerttemberg-erwartet-image-group/wide__1300x731,2025-02-13T07:48:50Z,,"Es wird glatt in Baden-Württemberg. Der Regen zieht Stück für Stück Richtung Süden ab, führt jedoch verbreitet zu überfrierender Glätte, wie der Deutsche Wetterdienst (DWD) mitteilte.
Oberhalb von 7… [+890 chars]",,de,'Regen'
https://www.zeit.de/news/2025-02/13/kleinere-verkehrsunfaelle-nach-schneefall-in-norddeutschland,https://www.zeit.de/news/2025-02/13/kleinere-verkehrsunfaelle-nach-schneefall-in-norddeutschland,0,www.zeit.de,Wetter: Kleinere Verkehrsunfälle nach Schneefall in Norddeutschland,Hier finden Sie Informationen zu dem Thema „Wetter“. Lesen Sie jetzt „Kleinere Verkehrsunfälle nach Schneefall in Norddeutschland“.,https://img.zeit.de/news/2025-02/13/kleinere-verkehrsunfaelle-nach-schneefall-in-norddeutschland-image-group/wide__1300x731,2025-02-13T08:48:53Z,,"Trotz des Schneefalls im Norden hat es am Morgen zunächst keine größeren Unfälle gegeben. Vermehrte Glätteunfälle seien zunächst ausgeblieben, hieß es aus den Lagezentren der Polizei in Hamburg und S… [+1438 chars]",,de,'Schnee'
https://www.zeit.de/news/2025-02/13/schwerverletzte-bei-unfaellen-nach-schneefall-auf-a6,https://www.zeit.de/news/2025-02/13/schwerverletzte-bei-unfaellen-nach-schneefall-auf-a6,0,www.zeit.de,Schwäbisch Hall: Schwerverletzte bei Unfällen nach Schneefall auf A6,Hier finden Sie Informationen zu dem Thema „Schwäbisch Hall“. Lesen Sie jetzt „Schwerverletzte bei Unfällen nach Schneefall auf A6“.,https://img.zeit.de/news/2025-02/13/schwerverletzte-bei-unfaellen-nach-schneefall-auf-a6-image-group/wide__1300x731,2025-02-13T15:03:47Z,https://web.archive.org/web/20250214202818/https://www.zeit.de/news/2025-02/13/schwerverletzte-bei-unfaellen-nach-schneefall-auf-a6,"Plötzlich einsetzender Schneefall hat zu zwei Unfällen mit mehreren Schwerverletzten auf der Autobahn 6 im Landkreis Schwäbisch Hall geführt. 
Bei Crailsheim fuhr ein 32-Jähriger trotz der schlechte… [+1088 chars]",,de,'Schnee'
https://www.zeit.de/news/2025-02/14/verspaetungen-wegen-schneemassen-am-flughafen,https://www.zeit.de/news/2025-02/14/verspaetungen-wegen-schneemassen-am-flughafen,0,www.zeit.de,Störungen im Flugverkehr: Verspätungen wegen Schneemassen am Flughafen,Hier finden Sie Informationen zu dem Thema „Störungen im Flugverkehr“. Lesen Sie jetzt „Verspätungen wegen Schneemassen am Flughafen“.,https://img.zeit.de/news/2025-02/14/verspaetungen-wegen-schneemassen-am-flughafen-image-group/wide__1300x731,2025-02-14T07:54:59Z,,"Nach kräftigen Schneefällen in der Nacht ist es am Hauptstadtflughafen BER zu erheblichen Verzögerungen im Flugverkehr gekommen.
Wegen der großen Mengen an Schnee sei auf den Start- und Landebahnen … [+645 chars]",,de,'Schnee'
