index,url,valid,domain,title,description,image,published,archive,content,quote,language,keyword
https://www.stern.de/gesellschaft/regional/sachsen/wochenendwetter--viele-wolken-und-etwas-sonne-am-wochenende-in-sachsen-35447524.html,https://www.stern.de/gesellschaft/regional/sachsen/wochenendwetter--viele-wolken-und-etwas-sonne-am-wochenende-in-sachsen-35447524.html,0,www.stern.de,Wochenendwetter: Viele Wolken und etwas Sonne am Wochenende in Sachsen,"Leipzig (sn) - Mit vielen Wolken, wenig Sonne und zumeist niederschlagsfrei zeigt sich der Winter am Wochenende in Sachsen. Wie der Deutsche Wetterdienst",https://image.stern.de/35447526/t/NL/v1/w1440/r1.7778/-/07--2pw5st523rv11axs2048jpeg---9ec635aeb26ea39f.jpg,2025-02-07T09:06:30Z,https://web.archive.org/web/20250209175822/https://www.stern.de/gesellschaft/regional/sachsen/wochenendwetter--viele-wolken-und-etwas-sonne-am-wochenende-in-sachsen-35447524.html,"Kopiere den aktuellen Link
Meist bewölkt und grau zeigt sich der Winter am Wochenende in Sachsen. Die Temperaturen bewegen sich um den Gefrierpunkt.
Mit vielen Wolken, wenig Sonne und zumeist niede… [+640 chars]",,de,'Sonne'
https://www.spektrum.de/news/wetterextreme-seltener-schmetterling-profitiert-von-hurrikanen/2252462,https://www.spektrum.de/news/wetterextreme-seltener-schmetterling-profitiert-von-hurrikanen/2252462,0,www.spektrum.de,Wetterextreme: Seltener Schmetterling profitiert von Hurrikanen,Wirbelstürme sind für uns Menschen verheerend. Ein fragiler Schmetterling hingegen profitiert von der Naturkatastrophe – zumindest mittelfristig.,https://static.spektrum.de/fm/912/f1920x1080/Swallowtail.jpg,2025-02-07T10:30:00Z,,Der Schaus-Schwalbenschwanz (Heraclides ponceana) gehört zu den am stärksten bedrohten Schmetterlingsarten der Vereinigten Staaten und überlebt heute nur noch an wenigen Stellen auf den Florida Keys.… [+1758 chars],,de,'Blätter'
https://www.zeit.de/news/2025-02/08/neue-woche-bringt-regen-schneeregen-und-schnee,https://www.zeit.de/news/2025-02/08/neue-woche-bringt-regen-schneeregen-und-schnee,0,www.zeit.de,"Wetterwechsel: Neue Woche bringt Regen, Schneeregen und Schnee","Hier finden Sie Informationen zu dem Thema „Wetterwechsel“. Lesen Sie jetzt „Neue Woche bringt Regen, Schneeregen und Schnee“.",https://img.zeit.de/news/2025-02/08/neue-woche-bringt-regen-schneeregen-und-schnee-image-group/wide__1300x731,2025-02-08T10:41:51Z,,"Nach einem teils sonnigen Wochenende ziehen zu Beginn der neuen Woche in Rheinland-Pfalz und im Saarland vermehrt Wolken auf und es gibt teilweise Regen und Schnee. 
Wie der Deutsche Wetterdienst (D… [+802 chars]",,de,'Regen'
https://www.zeit.de/news/2025-02/08/nach-sonne-am-wochenende-gibt-es-wolken-regen-und-schnee,https://www.zeit.de/news/2025-02/08/nach-sonne-am-wochenende-gibt-es-wolken-regen-und-schnee,0,www.zeit.de,"Wetterwechsel: Nach Sonne am Wochenende gibt es Wolken, Regen und Schnee","Hier finden Sie Informationen zu dem Thema „Wetterwechsel“. Lesen Sie jetzt „Nach Sonne am Wochenende gibt es Wolken, Regen und Schnee“.",https://img.zeit.de/news/2025-02/08/nach-sonne-am-wochenende-gibt-es-wolken-regen-und-schnee-image-group/wide__1300x731,2025-02-08T10:48:48Z,https://web.archive.org/web/20250209092852/https://www.zeit.de/news/2025-02/08/nach-sonne-am-wochenende-gibt-es-wolken-regen-und-schnee,"Nach einem teils sonnigen Wochenende gibt es zu Beginn der neuen Woche in Hessen dichte Wolken sowie Regen und Schnee. 
Wie der Deutsche Wetterdienst (DWD) mitteilte, gibt es am Sonntag nach Nebelau… [+788 chars]",,de,'Schnee'
https://www.zeit.de/news/2025-02/08/fruehling-schickt-kurzen-vorboten-nach-nrw,https://www.zeit.de/news/2025-02/08/fruehling-schickt-kurzen-vorboten-nach-nrw,0,www.zeit.de,Natur erwacht: Frühling schickt kurzen Vorboten nach NRW,Hier finden Sie Informationen zu dem Thema „Natur erwacht“. Lesen Sie jetzt „Frühling schickt kurzen Vorboten nach NRW“.,https://img.zeit.de/news/2025-02/08/fruehling-schickt-kurzen-vorboten-nach-nrw-image-group/wide__1300x731,2025-02-08T14:43:21Z,,Teils sehr milde Luft hat am Samstag NRW erreicht und ein kurzes Gastspiel des nahenden Frühlings zugelassen. Mit Temperaturen bis zu zehn Grad und viel Sonnenschein erlebten die Menschen vielerorts … [+364 chars],,de,'Schnee'
https://www.stern.de/gesellschaft/regional/niedersachsen-bremen/open-air-musik-im-sommer--an-der-kueste--auf-der-wiese--festivals-im-norden-gefragt-35451466.html,https://www.stern.de/gesellschaft/regional/niedersachsen-bremen/open-air-musik-im-sommer--an-der-kueste--auf-der-wiese--festivals-im-norden-gefragt-35451466.html,0,www.stern.de,"Open-Air-Musik im Sommer: An der Küste, auf der Wiese: Festivals im Norden gefragt","Musikfestivals gehören zum Sommer wie Freibad, Eis und Gewitter. Die Veranstalter von Hurricane, Deichbrand und anderen Events berichten von einem Run auf die Tickets.",https://image.stern.de/35451468/t/86/v1/w1440/r1.7778/-/09--yqfssy3wj2v6axs2048jpeg---75811b9bda630c7b.jpg,2025-02-09T05:00:37Z,,"Kopiere den aktuellen Link
Musikfestivals gehören zum Sommer wie Freibad, Eis und Gewitter. Die Veranstalter von Hurricane, Deichbrand und anderen Events berichten von einem Run auf die Tickets.
An… [+5277 chars]",,de,'Freibad'
https://www.faz.net/aktuell/wissen/ab-in-die-botanik/worauf-sie-bei-vogelfuetterung-achten-sollten-futter-jahreszeit-und-ratten-110198456.html,https://www.faz.net/aktuell/wissen/ab-in-die-botanik/worauf-sie-bei-vogelfuetterung-achten-sollten-futter-jahreszeit-und-ratten-110198456.html,0,www.faz.net,Ornithologe gibt Tipps: Worauf Sie bei Vogelfütterung achten sollten,"Welches Futter eignet sich für Vögel? Und wie hält man Ratten davon ab, sich ebenso zu bedienen? Ein Ornithologe erklärt, worauf es zu welcher Jahreszeit ankommt.",https://media0.faz.net/ppmedia/aktuell/904801890/1.10246994/facebook_teaser/eine-blaumeise-auf-futtersuche.jpg,2025-02-09T07:24:36Z,http://archive.md/20250209124631/https://www.faz.net/aktuell/wissen/ab-in-die-botanik/worauf-sie-bei-vogelfuetterung-achten-sollten-futter-jahreszeit-und-ratten-110198456.html,"Vögel im Winter zu füttern ist beliebt. Und tatsächlich brauchen Vögel unsere Unterstützung bei der Nahrungssuche. Der Verlust der Lebensräume, die Verbreitung von invasiven Tier- und Pflanzenarten u… [+5421 chars]",,de,'Vögel'
https://www.zeit.de/news/2025-02/09/leichter-regen-und-wolken-zum-wochenstart-im-suedwesten,https://www.zeit.de/news/2025-02/09/leichter-regen-und-wolken-zum-wochenstart-im-suedwesten,0,www.zeit.de,Wetter in Baden-Württemberg: Leichter Regen und Wolken zum Wochenstart im Südwesten,Hier finden Sie Informationen zu dem Thema „Wetter in Baden-Württemberg“. Lesen Sie jetzt „Leichter Regen und Wolken zum Wochenstart im Südwesten“.,https://img.zeit.de/news/2025-02/09/leichter-regen-und-wolken-zum-wochenstart-im-suedwesten-image-group/wide__1300x731,2025-02-09T08:04:12Z,https://web.archive.org/web/20250210103430/https://www.zeit.de/news/2025-02/09/leichter-regen-und-wolken-zum-wochenstart-im-suedwesten,"Am Himmel hängen Wolken, immer wieder regnet es kleine Tropfen. Vereinzelt könnten sich zum Wochenstart auch kleine Flocken unter die Regentropfen mischen, wie der Deutsche Wetterdienst (DWD) bericht… [+1060 chars]",,de,'Regen'
https://www.zeit.de/news/2025-02/09/etwas-sonnenschein-in-hamburg-und-schleswig-holstein,https://www.zeit.de/news/2025-02/09/etwas-sonnenschein-in-hamburg-und-schleswig-holstein,0,www.zeit.de,Wetter: Etwas Sonnenschein in Hamburg und Schleswig-Holstein,Hier finden Sie Informationen zu dem Thema „Wetter“. Lesen Sie jetzt „Etwas Sonnenschein in Hamburg und Schleswig-Holstein“.,https://img.zeit.de/news/2025-02/09/etwas-sonnenschein-in-hamburg-und-schleswig-holstein-image-group/wide__1300x731,2025-02-09T08:38:29Z,,"Am Sonntag können sich die Menschen in Hamburg und Schleswig-Holstein auf etwas Sonne freuen. Im Tagesverlauf ist es zunächst stark bewölkt, vor allem in der Südhälfte und in Hamburg lockert es dann … [+491 chars]",,de,'Sonne'
https://www.zeit.de/news/2025-02/09/wetterdienst-schneefall-droht-in-teilen-niedersachsens,https://www.zeit.de/news/2025-02/09/wetterdienst-schneefall-droht-in-teilen-niedersachsens,0,www.zeit.de,Wetter: Wetterdienst: Schneefall droht in Teilen Niedersachsens,Hier finden Sie Informationen zu dem Thema „Wetter“. Lesen Sie jetzt „Wetterdienst: Schneefall droht in Teilen Niedersachsens“.,https://img.zeit.de/news/2025-02/09/wetterdienst-schneefall-droht-in-teilen-niedersachsens-image-group/wide__1300x731,2025-02-09T14:33:37Z,https://web.archive.org/web/20250210031128/https://www.zeit.de/news/2025-02/09/wetterdienst-schneefall-droht-in-teilen-niedersachsens,"Der Winter droht in der neuen Woche mit Schneefall und Glätte in Teile Niedersachsens zurückzukehren. Zwar sei der Norden noch bis Montag unter Hochdruckeinfluss, in der Nacht zum Dienstag dürften si… [+1585 chars]",,de,'Schnee'
https://www.faz.net/aktuell/wirtschaft/unternehmen/thales-helsing-co-ki-veraendert-die-kriegsfuehrung-110285643.html,https://www.faz.net/aktuell/wirtschaft/unternehmen/thales-helsing-co-ki-veraendert-die-kriegsfuehrung-110285643.html,0,www.faz.net,"Thales, Helsing & Co.: So verändert künstliche Intelligenz die Kriegsführung","Vögel von Drohnen unterscheiden, Zielerkennung in Zehntelsekunden: Der KI-Boom erfasst auch die Wehrtechnik. Junge und etablierte Unternehmen kämpfen um die technische Vorherrschaft und neue Aufträge.",https://media0.faz.net/ppmedia/aktuell/3673249264/1.10285642/facebook_teaser_fplus/veraenderte-kriegsfuehrung.jpg,2025-02-09T16:51:02Z,http://archive.md/20250209172535/https://www.faz.net/aktuell/wirtschaft/unternehmen/thales-helsing-co-ki-veraendert-die-kriegsfuehrung-110285643.html,"Das Radar schlägt Alarm, aber die Gefahrenlage bleibt diffus. Nähert sich ein Drohnenschwarm oder sind es doch nur Vögel? Für die Beurteilung dieser Frage zählt jeder Moment. Dass moderne Radare imme… [+241 chars]",,de,'Vögel'
https://www.faz.net/aktuell/politik/bundestagswahl/liveticker-zur-bundestagswahl-2025-scholz-greift-an-merz-bleibt-im-tv-duell-cool-faz-110093143.html,https://www.faz.net/aktuell/politik/bundestagswahl/liveticker-zur-bundestagswahl-2025-scholz-greift-an-merz-bleibt-im-tv-duell-cool-faz-110093143.html,0,www.faz.net,"Liveblog zur Bundestagswahl: Scholz greift an, aber Merz lässt sich nicht aufs Glatteis führen",Von „doof“ bis „lächerlich“: Kanzler geht seinen Herausforderer hart an +++ Mehr Streit über Wirtschaft als in den vergangenen zwei Wochen +++ Heftiger Schlagabtausch über Asyl und AfD +++ alle Entwicklungen im Liveblog,https://media0.faz.net/ppmedia/aktuell/politik/1649112687/1.10286418/facebook_teaser/scholz-und-merz-im-tv-duell.jpg,2025-02-09T21:01:38Z,,"Frage: Wie hoch soll der Anteil für die Verteidigung am Bruttoinlandsprodukt sein? Scholz: Mindestens zwei Prozent für die nächsten vier Jahre (...), außerdem gibt es in der NATO gegenwärtig eine Dis… [+544 chars]",,de,'Glatteis'
https://www.zeit.de/news/2025-02/10/sonne-wolken-und-maessig-kalt-in-berlin-und-brandenburg,https://www.zeit.de/news/2025-02/10/sonne-wolken-und-maessig-kalt-in-berlin-und-brandenburg,0,www.zeit.de,"Wetter: Sonne, Wolken und mäßig kalt in Berlin und Brandenburg","Hier finden Sie Informationen zu dem Thema „Wetter“. Lesen Sie jetzt „Sonne, Wolken und mäßig kalt in Berlin und Brandenburg“.",https://img.zeit.de/news/2025-02/10/sonne-wolken-und-maessig-kalt-in-berlin-und-brandenburg-image-group/wide__1300x731,2025-02-10T06:24:17Z,,"Mäßig kaltes und zumeist trockenes Winterwetter bestimmt den Wochenstart in Berlin und Brandenburg. Zeitweise lässt sich auch die Sonne blicken, wie der Deutsche Wetterdienst in Potsdam mitteilte. 
… [+580 chars]",,de,'Schnee'
https://www.focus.de/panorama/wetter-im-ticker-schnee-in-deutschland-wo-es-ab-mittwoch-besonders-winterlich-wird_id_54933749.html,https://www.focus.de/panorama/wetter-im-ticker-schnee-in-deutschland-wo-es-ab-mittwoch-besonders-winterlich-wird_id_54933749.html,0,www.focus.de,+++ Wetter im Ticker +++ - Schnee in Deutschland: Wo es ab Mittwoch besonders winterlich wird,"Ab Mittwoch sorgt ein Kaltlufttropfen für winterliches Wetter in Deutschland. Während im Süden zunächst noch milde Temperaturen herrschen, bringt das Tiefdruckgebiet in der Mitte und im Norden kräftigen Schneefall. Alle Wetter-Entwicklungen im Ticker.",https://p6.focus.de/img/fotos/id_260695381/glatteis-und-gefrierender-regen-sorgen-fuer-rutschige-strassen-in-vielen-regionen..jpg?im=Crop%3D%280%2C289%2C3463%2C1731%29%3BResize%3D%281200%2C627%29&impolicy=perceptual&quality=mediumHigh&hash=36980907e93edef8e855fbdb1fbda64ea599bb4545a74ef6be2d2af73a263d28,2025-02-10T11:17:27Z,https://web.archive.org/web/20250210125703/https://www.focus.de/panorama/wetter-im-ticker-schnee-in-deutschland-wo-es-ab-mittwoch-besonders-winterlich-wird_id_54933749.html,"<ul><li>
Kommentare</li><li>
E-Mail</li><li>
Teilen</li><li>
Mehr</li><li>
Twitter</li><li>
Drucken</li><li>
Feedback</li><li>
Fehler meldenSie haben einen Fehler gefunden?
Bitte markieren S… [+10680 chars]",,de,'Schnee'
https://netzpolitik.org/2025/algospeak-was-winterschuhe-mit-politik-zu-tun-haben/,https://netzpolitik.org/2025/algospeak-was-winterschuhe-mit-politik-zu-tun-haben/,0,netzpolitik.org,Algospeak: Was Winterschuhe mit Politik zu tun haben,"Schuhe im Schnee oder Chiffre? – Alle Rechte vorbehalten IMAGO / Panthermedia
Politische Inhalte werden teilweise von Social-Media-Plattformen blockiert oder versteckt. Um den algorithmischen Filtern zu entwischen, entwickeln die Nutzer:innen eine eigene Spr…",https://cdn.netzpolitik.org/wp-upload/2025/02/imago303665616-1200x675.jpg,2025-02-10T12:34:02Z,https://web.archive.org/web/20250210190512/https://netzpolitik.org/2025/algospeak-was-winterschuhe-mit-politik-zu-tun-haben/,Politische Inhalte auf Social-Media-Plattformen wie Instagram und TikTok haben teilweise eine geringere Reichweite als andere Postings. Das kann unterschiedliche Gründe haben: Meta etwa bremst entspr… [+4848 chars],,de,'Schnee'
https://www.nzz.ch/wissenschaft/betonbloecke-im-dienst-des-naturschutzes-wie-panzersperren-bedrohten-tieren-das-wandern-ermoeglichen-ld.1868782,https://www.nzz.ch/wissenschaft/betonbloecke-im-dienst-des-naturschutzes-wie-panzersperren-bedrohten-tieren-das-wandern-ermoeglichen-ld.1868782,0,www.nzz.ch,Betonblöcke im Dienst des Naturschutzes: Wie Panzersperren bedrohten Tieren das Wandern ermöglichen,"Das Mittelland ist noch immer voller Panzerhindernisse aus dem Zweiten Weltkrieg. Das brachte die Naturschützer von Pro Natura auf eine Idee: Sie kauften der Armee ein Dutzend der Anlagen ab, um sie zu Verkehrsachsen für die Artenvielfalt auszubauen.","https://img.nzz.ch/2025/02/05/3030798a-aa99-41a2-bc44-0a021aaadfaf.jpeg?width=1200&height=675&fit=bounds&quality=75&auto=webp&crop=4767,2682,x1701,y824&wmark=nzz",2025-02-11T04:30:00Z,http://archive.md/20250211055121/https://www.nzz.ch/wissenschaft/betonbloecke-im-dienst-des-naturschutzes-wie-panzersperren-bedrohten-tieren-das-wandern-ermoeglichen-ld.1868782,"Die Natur kehrt zurück: Von Moos überwucherte Betonblöcke in Frick.
Aus der Distanz wirkt die Hecke wie viele andere. Mehrere hundert Meter weit führt sie über eine Ebene voller Wiesen und Äcker. Er… [+9333 chars]",,de,'Vögel'
https://www.stern.de/gesellschaft/regional/sachsen/glatte-strassen--wetterdienst-warnt-vor-glatteis-35455808.html,https://www.stern.de/gesellschaft/regional/sachsen/glatte-strassen--wetterdienst-warnt-vor-glatteis-35455808.html,0,www.stern.de,Glatte Straßen: Wetterdienst warnt vor Glatteis,"Dresden - Auf den Straßen in Sachsen, Sachsen-Anhalt und Thüringen kann es glatt werden. Der Deutsche Wetterdienst sprach aufgrund von Schneefall und",https://image.stern.de/35455810/t/Ch/v1/w1440/r1.7778/-/11--7tecdqnkfov6axs2048jpeg---2c4b4bd9515ea92e.jpg,2025-02-11T05:38:15Z,,"Kopiere den aktuellen Link
Autofahrer sind zur Vorsicht angehalten. Bis zum Mittwoch besteht in Sachsen, Sachsen-Anhalt und Thüringen Glättegefahr.
Auf den Straßen in Sachsen, Sachsen-Anhalt und Th… [+538 chars]",,de,'Schnee'
https://www.zeit.de/news/2025-02/11/wetterdienst-warnt-vor-glatteis,https://www.zeit.de/news/2025-02/11/wetterdienst-warnt-vor-glatteis,0,www.zeit.de,Glatte Straßen: Wetterdienst warnt vor Glatteis,Hier finden Sie Informationen zu dem Thema „Glatte Straßen“. Lesen Sie jetzt „Wetterdienst warnt vor Glatteis“.,https://img.zeit.de/news/2025-02/11/wetterdienst-warnt-vor-glatteis-image-group/wide__1300x731,2025-02-11T05:38:15Z,,"Auf den Straßen in Sachsen, Sachsen-Anhalt und Thüringen kann es glatt werden. Der Deutsche Wetterdienst sprach aufgrund von Schneefall und gefrierenden Regens für alle drei Bundesländer Warnungen au… [+428 chars]",,de,'Glatteis'
https://www.bild.de/news/wetter/wetter-schnee-und-gefrierender-regen-wetterdienst-warnt-vor-glatteis-67aaf0fe6da9a8373ed63c46,https://www.bild.de/news/wetter/wetter-schnee-und-gefrierender-regen-wetterdienst-warnt-vor-glatteis-67aaf0fe6da9a8373ed63c46,0,www.bild.de,Schnee und gefrierender Regen - Wetterdienst warnt vor Glatteis,"Achtung, es wird glatt! Gefrierender Regen und Schnee sorgen in mehreren Regionen Deutschlands für gefährlich glatte Straßen.","https://images.bild.de/67aaf0fe6da9a8373ed63c46/d52cce259d244d37a2ff1d87189a54f0,b1bb2d2e?w=1280",2025-02-11T07:41:02Z,https://web.archive.org/web/20250211184727/https://www.bild.de/news/wetter/wetter-schnee-und-gefrierender-regen-wetterdienst-warnt-vor-glatteis-67aaf0fe6da9a8373ed63c46,"Achtung, es wird glatt! Gefrierender Regen und Schnee sorgen in mehreren Regionen Deutschlands für gefährlich glatte Straßen. 
Für Niedersachsen rechnet der Deutsche Wetterdienst (DWD) mit Niedersch… [+2108 chars]",,de,'Glatteis'
https://www.zeit.de/news/2025-02/11/regen-wolken-und-schnee-in-hessen,https://www.zeit.de/news/2025-02/11/regen-wolken-und-schnee-in-hessen,0,www.zeit.de,"Winterliches Wetter: Regen, Wolken und Schnee in Hessen","Hier finden Sie Informationen zu dem Thema „Winterliches Wetter“. Lesen Sie jetzt „Regen, Wolken und Schnee in Hessen“.",https://img.zeit.de/news/2025-02/11/regen-wolken-und-schnee-in-hessen-image-group/wide__1300x731,2025-02-11T07:49:20Z,,In den nächsten Tagen können sich die Menschen in Hessen auf einen Wechsel aus Wolken und Regen und teilweise Schnee bei sinkenden Temperaturen einstellen. Wie der Deutsche Wetterdienst (DWD) mitteil… [+780 chars],,de,'Schnee'
https://www.zeit.de/news/2025-02/11/schnee-und-schneeregen-in-den-naechsten-tagen,https://www.zeit.de/news/2025-02/11/schnee-und-schneeregen-in-den-naechsten-tagen,0,www.zeit.de,Wetter: Schnee und Schneeregen in den nächsten Tagen,Hier finden Sie Informationen zu dem Thema „Wetter“. Lesen Sie jetzt „Schnee und Schneeregen in den nächsten Tagen“.,https://img.zeit.de/news/2025-02/11/schnee-und-schneeregen-in-den-naechsten-tagen-image-group/wide__1300x731,2025-02-11T08:06:20Z,,"Das Wetter in Rheinland-Pfalz und im Saarland bleibt grau und ungemütlich. Am Dienstag ist es meist stark bewölkt, in der Nacht zum Mittwoch kann dann im Süden etwas Regen aufkommen, wie der Deutsche… [+410 chars]",,de,'Regen'
https://www.stern.de/gesellschaft/regional/niedersachsen-bremen/weiter-winterwetter--schneefall-sorgt-fuer-glatte-strassen-im-nordwesten-35455782.html,https://www.stern.de/gesellschaft/regional/niedersachsen-bremen/weiter-winterwetter--schneefall-sorgt-fuer-glatte-strassen-im-nordwesten-35455782.html,0,www.stern.de,Weiter Winterwetter: Schneefall sorgt für glatte Straßen im Nordwesten,"Viele Menschen sehnen den Frühling herbei, doch in Niedersachsen und Bremen soll es auch in den nächsten Tagen schneien. Das große Verkehrschaos auf den Straßen blieb aber aus.",https://image.stern.de/35457246/t/sL/v1/w1440/r1.7778/-/11--zre7uoh2fxv1axs2048jpeg---3aee10ddeb252dc0.jpg,2025-02-11T12:21:10Z,https://web.archive.org/web/20250211182051/https://www.stern.de/gesellschaft/regional/niedersachsen-bremen/weiter-winterwetter--schneefall-sorgt-fuer-glatte-strassen-im-nordwesten-35455782.html,"Kopiere den aktuellen Link
Viele Menschen sehnen den Frühling herbei, doch in Niedersachsen und Bremen soll es auch in den nächsten Tagen schneien. Das große Verkehrschaos auf den Straßen blieb aber… [+2557 chars]",,de,'Glatteis'
https://www.tagesspiegel.de/berlin/bezirke/kombibad-in-marzahn-hellersdorf-gehort-ein-spassbad-zur-daseinsvorsorge-13184572.html,https://www.tagesspiegel.de/berlin/bezirke/kombibad-in-marzahn-hellersdorf-gehort-ein-spassbad-zur-daseinsvorsorge-13184572.html,0,www.tagesspiegel.de,Kombibad in Marzahn-Hellersdorf: Gehört ein Spaßbad zur Daseinsvorsorge?,"Um das kombinierte Hallen- und Freibad am Jelena-Šantić-Friedenspark finanzieren zu können, fordern CDU und SPD die Einbindung eines privaten Unternehmers. Doch dafür gibt es Hürden.",https://www.tagesspiegel.de/images/13031530/alternates/BASE_16_9_W1400/1737052417000/schwimmbad.jpeg,2025-02-11T15:02:24Z,http://archive.md/20250212094247/https://www.tagesspiegel.de/berlin/bezirke/kombibad-in-marzahn-hellersdorf-gehort-ein-spassbad-zur-daseinsvorsorge-13184572.html,"Um das kombinierte Hallen- und Freibad am Jelena-anti-Friedenspark finanzieren zu können, fordern CDU und SPD die Einbindung eines privaten Unternehmers. Doch dafür gibt es Hürden.",,de,'Freibad'
https://www.stern.de/gesellschaft/regional/niedersachsen-bremen/weiter-winterwetter--schnee-und-glaette-bereiten-probleme-auf-autobahnen-35455782.html,https://www.stern.de/gesellschaft/regional/niedersachsen-bremen/weiter-winterwetter--schnee-und-glaette-bereiten-probleme-auf-autobahnen-35455782.html,0,www.stern.de,Weiter Winterwetter: Schnee und Glätte bereiten Probleme auf Autobahnen,"Quergestellte Laster und Blechschäden: Schnee und Glätte haben für einige Unfälle gesorgt, besonders auf den Fernstraßen im Nordwesten. In Braunschweig hat das Winterwetter noch andere Folgen.",https://image.stern.de/35458354/t/tH/v1/w1440/r1.7778/-/11--uemoano6qev1axs2048jpeg---7b9b166ef51d45af.jpg,2025-02-11T16:19:06Z,https://web.archive.org/web/20250214052357/https://www.stern.de/gesellschaft/regional/niedersachsen-bremen/weiter-winterwetter--schnee-und-glaette-bereiten-probleme-auf-autobahnen-35455782.html,"Kopiere den aktuellen Link
Quergestellte Laster und Blechschäden: Schnee und Glätte haben für einige Unfälle gesorgt, besonders auf den Fernstraßen im Nordwesten. In Braunschweig hat das Winterwette… [+3546 chars]",,de,'Glatteis'
https://www.bild.de/news/wetter/wetter-schnee-und-blitzeis-in-deutschland-67aaf0fe6da9a8373ed63c46,https://www.bild.de/news/wetter/wetter-schnee-und-blitzeis-in-deutschland-67aaf0fe6da9a8373ed63c46,0,www.bild.de,Wetterdienst warnt - Wetter bringt Schnee und Blitzeis in Deutschland,Der Winter ist zurück. Regen und Schnee sorgen in Deutschland für Kälte und Glatteis.,"https://images.bild.de/67aaf0fe6da9a8373ed63c46/d52cce259d244d37a2ff1d87189a54f0,199c5a0d?w=1280",2025-02-11T19:30:47Z,,"Achtung, es wird glatt. Gefrierender Regen und Schnee sorgen in mehreren Regionen in Deutschland am heutigen Dienstag für gefährlich glatte Straßen und Eis-Wetter.
Gleich in mehreren Regionen ist de… [+2424 chars]",,de,'Glatteis'
https://www.zeit.de/news/2025-02/12/leichter-schneefall-in-berlin-und-brandenburg,https://www.zeit.de/news/2025-02/12/leichter-schneefall-in-berlin-und-brandenburg,0,www.zeit.de,Wetter: Leichter Schneefall in Berlin und Brandenburg,Hier finden Sie Informationen zu dem Thema „Wetter“. Lesen Sie jetzt „Leichter Schneefall in Berlin und Brandenburg“.,https://img.zeit.de/news/2025-02/12/leichter-schneefall-in-berlin-und-brandenburg-image-group/wide__1300x731,2025-02-12T04:46:57Z,https://web.archive.org/web/20250212063835/https://www.zeit.de/news/2025-02/12/leichter-schneefall-in-berlin-und-brandenburg,"Kälte und gegen Abend auch leichter Schneefall erwarten die Menschen in Berlin und Brandenburg. Nach einem zunächst sonnigen Start ziehen im Verlauf des Tages zunehmend Wolken auf, wie der Deutsche W… [+714 chars]",,de,'Temperaturen'
https://www.stern.de/gesellschaft/regional/sachsen/wettervorhersage--glatte-strassen-in-sachsen-35459234.html,https://www.stern.de/gesellschaft/regional/sachsen/wettervorhersage--glatte-strassen-in-sachsen-35459234.html,0,www.stern.de,Wettervorhersage: Glatte Straßen in Sachsen,Frostiges Winterwetter mit vielen Wolken prägt die zweite Wochenhälfte in Sachsen. Dabei kann es glatt werden. Doch mit viel Schnee ist den Aussichten nach leider nicht zu rechnen.,https://image.stern.de/35459236/t/oU/v1/w1440/r1.7778/-/12--p34ctwpsquv5axs2048jpeg---809e93d3b2ceccfe.jpg,2025-02-12T06:04:51Z,,"Kopiere den aktuellen Link
Frostiges Winterwetter mit vielen Wolken prägt die zweite Wochenhälfte in Sachsen. Dabei kann es glatt werden. Doch mit viel Schnee ist den Aussichten nach leider nicht zu… [+982 chars]",,de,'Glatteis'
https://www.zeit.de/news/2025-02/12/erst-wechselhaftes-wetter-dann-kommt-der-schnee,https://www.zeit.de/news/2025-02/12/erst-wechselhaftes-wetter-dann-kommt-der-schnee,0,www.zeit.de,"Wetter: Erst wechselhaftes Wetter, dann kommt der Schnee","Hier finden Sie Informationen zu dem Thema „Wetter“. Lesen Sie jetzt „Erst wechselhaftes Wetter, dann kommt der Schnee“.",https://img.zeit.de/news/2025-02/12/erst-wechselhaftes-wetter-dann-kommt-der-schnee-image-group/wide__1300x731,2025-02-12T06:49:54Z,,"Offenbach/Mainz/Saarbrücken - In den kommenden Tagen müssen sich die Menschen in Rheinland-Pfalz zunehmend auf Schneefall einstellen. Wie der Deutsche Wetterdienst (DWD) mitteilt, beginnt die Mitte d… [+629 chars]",,de,'Schnee'
