index,url,valid,domain,title,description,image,published,archive,content,quote,language,keyword
https://www.n-tv.de/panorama/Wanderer-sind-froh-dem-Mount-Everest-entronnen-zu-sein-article26079142.html,https://www.n-tv.de/panorama/Wanderer-sind-froh-dem-Mount-Everest-entronnen-zu-sein-article26079142.html,0,www.n-tv.de,"Schnee und eisiger Sturm: Wanderer sind froh, dem Mount Everest entronnen zu sein","Ein Wanderurlaub in der Mount Everest Region wird für Hunderte Wanderer zu einem Albtraum. Plötzlich setzt ein heftiger Schneesturm ein, sie sitzen auf der tibetischen Seite des Berges fest und selbst Retter können kaum etwas tun.",https://www.n-tv.de/img/incoming/crop26079159/5021326508-cImg_16_9-w1200/f3b76254aa6a1b8f082b9940e0ec57a6.jpg,2025-10-07T11:35:20Z,,"Ein Wanderurlaub in der Mount Everest Region wird für Hunderte Wanderer zu einem Albtraum. Plötzlich setzt ein heftiger Schneesturm ein, sie sitzen auf der tibetischen Seite des Berges fest und selbs… [+4841 chars]",,de,'Schnee'
https://www.stern.de/gesellschaft/regional/baden-wuerttemberg/natur--elch-im-schwarzwald-gesichtet---herkunft-unklar-36114762.html,https://www.stern.de/gesellschaft/regional/baden-wuerttemberg/natur--elch-im-schwarzwald-gesichtet---herkunft-unklar-36114762.html,0,www.stern.de,Natur: Elch im Schwarzwald gesichtet - Herkunft unklar,Oberwolfach (lsw) - Ein Elch unbekannter Herkunft ist in den vergangenen Tagen im Schwarzwald gesichtet worden. Spuren gab es in den Gemeinden Oberwolfach,https://image.stern.de/36114764/t/sx/v1/w1440/r1.7778/-/08--oafac7eeyov9axs2048jpeg---7e1b3e805a95d610.jpg,2025-10-08T10:45:30Z,,"Kopiere den aktuellen Link
Zur Merkliste hinzufügen
Ein Elch taucht im Schwarzwald auf - doch in Zoos und Wildparks der Region fehlt kein Tier. Was ein Experte rät, wenn man dem mächtigen Hirsch be… [+1407 chars]",,de,'Natur'
https://www.sueddeutsche.de/bayern/bayern-laubblaeser-rechen-besen-li.3323451,https://www.sueddeutsche.de/bayern/bayern-laubblaeser-rechen-besen-li.3323451,0,www.sueddeutsche.de,Umwelt und Natur: Im Garten zu Rechen und Besen greifen statt zum Laubbläser,Der Naturschutzverband LBV rät Gartenbesitzern von den lauten Geräten ab. Sie würden die Lebensräume und Nahrungsgrundlagen für viele Tiere zerstören.,https://www.sueddeutsche.de/2025/10/08/0aebd576-3a5b-44ec-8437-af88c0b776c2.jpg?q=60&fm=webp&width=1200&rect=0%2C209%2C4000%2C2250,2025-10-08T12:14:17Z,,"Der enorme Lärm von rund 100 Dezibel und der entstehende Staub schadeten auch der menschlichen Gesundheit. Gartenbesitzer sollten daher lieber zu Rechen und Besen greifen, um herabgefallenes Laub zu … [+1023 chars]",,de,'Laub'
https://www.focus.de/politik/ausland/wenn-man-will-geht-alles-leser-loben-freibad-verbot-in-schweiz_05b8c7a6-3041-4cab-aef1-d85876bfabbd.html,https://www.focus.de/politik/ausland/wenn-man-will-geht-alles-leser-loben-freibad-verbot-in-schweiz_05b8c7a6-3041-4cab-aef1-d85876bfabbd.html,0,www.focus.de,"""Wenn man will, geht alles!"" Leser loben Freibad-Verbot in Schweiz","Das Freibad-Ausländer-Verbot in Pruntrut sorgt für hitzige Leser-Diskussionen: Lob, Kritik und Sicherheit im Fokus.",https://quadro.burda-forward.de/ctf/0889709e-74fb-4c72-9333-a153ee6db96e.ae533a16-fa94-4740-811e-feed211033b5.jpeg?im=RegionOfInterestCrop%3D%281200%2C630%29%2CregionOfInterest%3D%281024%2C674%29&hash=471f401d7ef4ecad54ea6815f1bc8cfa46a9fc0dd05e40e9b9084ce0545a9908,2025-10-08T20:34:51Z,,"Das Freibad der Schweizer Gemeinde Pruntrut ließ im Sommer keine ausländischen Besucher mehr zu mit spürbarem Erfolg. Der Artikel dazu ""'Freibad zurückerobert': Schweizer Gemeinde zieht nach Auslände… [+7914 chars]",,de,'Freibad'
https://www.stern.de/gesellschaft/regional/baden-wuerttemberg/natur--vier-gruende--warum-sich-ein-elch-im-schwarzwald-wohlfuehlt-36116680.html,https://www.stern.de/gesellschaft/regional/baden-wuerttemberg/natur--vier-gruende--warum-sich-ein-elch-im-schwarzwald-wohlfuehlt-36116680.html,0,www.stern.de,"Natur: Vier Gründe, warum sich ein Elch im Schwarzwald wohlfühlt",Oberwolfach (lsw) - Ein Elch sorgt für Aufsehen im Schwarzwald. Woher er stammt? Das weiß bislang niemand. Spuren des mächtigen Tieres gab es in,https://image.stern.de/36116682/t/Lh/v1/w1440/r1.7778/-/09--qevkjgbuufv3axs2048jpeg---82cf24ca3824cc6a.jpg,2025-10-09T02:00:56Z,,"Kopiere den aktuellen Link
Zur Merkliste hinzufügen
Ein Elch stromert durch den Schwarzwald - warum das mächtige Tier hier beste Bedingungen findet und doch an einer Sache scheitern könnte.
Ein El… [+3217 chars]",,de,'Natur'
https://www.zeit.de/news/2025-10/09/vier-gruende-warum-sich-ein-elch-im-schwarzwald-wohlfuehlt,https://www.zeit.de/news/2025-10/09/vier-gruende-warum-sich-ein-elch-im-schwarzwald-wohlfuehlt,0,www.zeit.de,"Natur: Vier Gründe, warum sich ein Elch im Schwarzwald wohlfühlt","Hier finden Sie Informationen zu dem Thema „Natur“. Lesen Sie jetzt „Vier Gründe, warum sich ein Elch im Schwarzwald wohlfühlt“.",https://img.zeit.de/news/2025-10/09/vier-gruende-warum-sich-ein-elch-im-schwarzwald-wohlfuehlt-image-group/wide__1300x731,2025-10-09T02:00:56Z,,"Ein Elch sorgt für Aufsehen im Schwarzwald. Woher er stammt? Das weiß bislang niemand. Spuren des mächtigen Tieres gab es in Oberwolfach und Oberharmersbach im Ortenaukreis. 
Der Wildtierbeauftragte… [+2801 chars]",,de,'Natur'
https://www.welt.de/debatte/plus68e62a1c95122ee99c5cd801/gewalt-unter-jugendlichen-die-respektlosen.html,https://www.welt.de/debatte/plus68e62a1c95122ee99c5cd801/gewalt-unter-jugendlichen-die-respektlosen.html,0,www.welt.de,Die Respektlosen,"Ob im Freibad, vor dem Imbiss, auf dem Pausenhof oder an Haltestellen – immer mehr Jugendliche fallen im Alltag durch Aggressionen und Gewalt auf. Das ist kein ausschließlich „migrantisches“ Phänomen – hat aber viel mit der „Pyramidenlogik“ migrantischer Kult…",https://images.welt.de/68e62a1c95122ee99c5cd801/23213e2a4847af0a01ea6de073d8d5f2/ci16x9-w1200/heroes-kaempfen-gegen-homophobie-und-maennliche-ehre,2025-10-09T04:56:13Z,,"Ob im Freibad, vor dem Imbiss, auf dem Pausenhof oder an Haltestellen immer mehr Jugendliche fallen im Alltag durch Aggressionen und Gewalt auf. Das ist kein ausschließlich migrantisches Phänomen hat… [+63 chars]",,de,'Freibad'
https://www.faz.net/aktuell/gesellschaft/ungluecke/eingeschneit-am-everest-ein-bergfuehrer-berichtet-110726365.html,https://www.faz.net/aktuell/gesellschaft/ungluecke/eingeschneit-am-everest-ein-bergfuehrer-berichtet-110726365.html,0,www.faz.net,Unerwarteter Schneesturm: Sie wollten auf dem Everest wandern – und flohen am Ende vor dem Tod,Hunderte eingeschneite Bergwanderer mussten vergangene Woche am Mount Everest gerettet werden. Auch der Bergführer Wu Ji war mit einer Gruppe unterwegs – und berichtet von dramatischen Szenen.,https://media0.faz.net/ppmedia/w1200/aktuell/3332326035/1.10726360/facebook_teaser/schneesturm-statt-blick-auf.jpg.webp,2025-10-10T14:13:39Z,,"Es war zwei Uhr nachts im Himalaja, und auf fünftausend Meter Höhe wurde der Schneefall immer heftiger. Die ersten Tage unserer Tour nieselte es, aber plötzlich hatte es einen ganzen Tag und die Nach… [+6049 chars]",,de,'Schnee'
https://www.zeit.de/news/2025-10/11/viele-wolken-kaum-regen-wochenende-in-der-hauptstadtregion,https://www.zeit.de/news/2025-10/11/viele-wolken-kaum-regen-wochenende-in-der-hauptstadtregion,0,www.zeit.de,"Wetter: Viele Wolken, kaum Regen: Wochenende in der Hauptstadtregion","Hier finden Sie Informationen zu dem Thema „Wetter“. Lesen Sie jetzt „Viele Wolken, kaum Regen: Wochenende in der Hauptstadtregion“.",https://img.zeit.de/news/2025-10/11/viele-wolken-kaum-regen-wochenende-in-der-hauptstadtregion-image-group/wide__1300x731,2025-10-11T06:28:07Z,,"Nach einem oft grauen Start in das Wochenende bleibt es in Berlin und Brandenburg auch tagsüber meist dicht bewölkt. Nur vereinzelt zeigen sich Wolkenlücken, Regen fällt jedoch kaum, wie der Deutsche… [+739 chars]",,de,'Regen'
https://www.zeit.de/news/2025-10/11/mix-aus-nebel-sonne-regen-keine-wetteraenderung-in-sicht,https://www.zeit.de/news/2025-10/11/mix-aus-nebel-sonne-regen-keine-wetteraenderung-in-sicht,0,www.zeit.de,"Vorhersage: Mix aus Nebel, Sonne, Regen - keine Wetteränderung in Sicht","Hier finden Sie Informationen zu dem Thema „Vorhersage“. Lesen Sie jetzt „Mix aus Nebel, Sonne, Regen - keine Wetteränderung in Sicht“.",https://img.zeit.de/news/2025-10/11/mix-aus-nebel-sonne-regen-keine-wetteraenderung-in-sicht-image-group/wide__1300x731,2025-10-11T13:55:25Z,,"Große Wetteränderungen sind in Deutschland in den kommenden Tagen nicht zu erwarten. Ein Hoch mit dem Namen «Sieglinde» über den Britischen Inseln sei wie ein «Fels in der Brandung», teilte der Deuts… [+1223 chars]",,de,'Sonne'
https://www.zeit.de/news/2025-10/12/hitze-drama-beim-ironman-philipp-wird-wm-dritte-in-hawaii,https://www.zeit.de/news/2025-10/12/hitze-drama-beim-ironman-philipp-wird-wm-dritte-in-hawaii,0,www.zeit.de,Ironman-WM: Hitze-Drama beim Ironman: Philipp wird WM-Dritte in Hawaii,Hier finden Sie Informationen zu dem Thema „Ironman-WM“. Lesen Sie jetzt „Hitze-Drama beim Ironman: Philipp wird WM-Dritte in Hawaii“.,https://img.zeit.de/news/2025-10/12/hitze-drama-beim-ironman-philipp-wird-wm-dritte-in-hawaii-image-group/wide__1300x731,2025-10-12T01:11:33Z,,Laura Philipp hat in einem hochdramatischen Rennen den dritten Platz bei der Ironman-Weltmeisterschaft in Hawaii erreicht. Die 38 Jahre alte Profi-Triathletin aus Heidelberg verpasste damit allerding… [+1212 chars],,de,'Hitze'
https://www.stern.de/gesellschaft/regional/baden-wuerttemberg/ironman-wm--hitze-dramen-in-hawaii--philipp--durchgekocht--aufs-podium-36124076.html,https://www.stern.de/gesellschaft/regional/baden-wuerttemberg/ironman-wm--hitze-dramen-in-hawaii--philipp--durchgekocht--aufs-podium-36124076.html,0,www.stern.de,"Ironman-WM: Hitze-Dramen in Hawaii: Philipp ""durchgekocht"" aufs Podium",Kailua-Kona - Nach einer körperlichen Tortur hat Laura Philipp auf den letzten Metern eines hochdramatischen Rennens ihr Lächeln wieder gefunden. Schon,https://image.stern.de/36124286/t/K1/v1/w1440/r1.7778/-/12--cfi5zx526tv9axs2048jpeg---359f26c6250be5a1.jpg,2025-10-12T04:05:27Z,,"Kopiere den aktuellen Link
Zur Merkliste hinzufügen
Die beiden Führenden brechen fast zusammen. Die schwüle Hitze macht auch Laura Philipp zu schaffen. Sie schafft es aber wieder aufs Podest.
Nach… [+5769 chars]",,de,'Hitze'
https://www.n-tv.de/sport/Philipp-rettet-nach-Hitze-Dramen-Bronze-beim-Ironman-Hoellenritt-article26090710.html,https://www.n-tv.de/sport/Philipp-rettet-nach-Hitze-Dramen-Bronze-beim-Ironman-Hoellenritt-article26090710.html,0,www.n-tv.de,"""Der härteste Tag"": Philipp rettet nach Hitze-Dramen Bronze beim Ironman-Höllenritt","Der Ironman auf Hawaii ist für Laura Philipp ""der härteste Tag, den ich je gemacht habe"": Bei der WM sorgen zahlreiche Top-Athletinnen für besorgniserregende Bilder. Die deutsche Titelverteidigerin kämpft sich durch und holt Bronze.",https://www.n-tv.de/img/incoming/crop26090711/8011328134-cImg_16_9-w1200/imago1067580637.jpg,2025-10-12T04:48:46Z,,"Der Ironman auf Hawaii ist für Laura Philipp ""der härteste Tag, den ich je gemacht habe"": Bei der WM sorgen zahlreiche Top-Athletinnen für besorgniserregende Bilder. Die deutsche Titelverteidigerin k… [+3881 chars]",,de,'Hitze'
https://noe.orf.at/stories/3325223/,https://noe.orf.at/stories/3325223/,0,noe.orf.at,Wann Igel Hilfe brauchen,Im Tierschutzhaus in Vösendorf (Bezirk Mödling) werden derzeit rund 140 Igel betreut. Immer wieder werden die nachtaktiven Tiere tagsüber gefunden und dann in professionelle Hände übergeben – oft ist das aber gar nicht notwendig.,https://ibs.orf.at/noe?image=https%3A%2F%2Foekastatic.orf.at%2Fmims%2F2025%2F41%2F72%2Fcrops%2Fw%3D1200%2Ch%3D627%2Cq%3D75%2F2794185_master_1077972_img_4822.jpeg%3Fs%3D7b7bf2228c4650f483e97ecaedd6f00a101aebdb,2025-10-12T05:38:01Z,,Seit vergangenem Jahr steht der Igel auf der Liste der bedrohten Tierarten. Durch Bodenversiegelung und intensive Landwirtschaft verliert er seine natürlichen Lebensräume. Auch der Rückgang an Insekt… [+2690 chars],,de,'Igel'
https://www.welt.de/sport/article68eb40830bda2290ccea8630/ironman-wm-ich-wurde-so-richtig-durchgekocht-laura-philipp-kaempft-sich-in-hawaii-aufs-podium.html,https://www.welt.de/sport/article68eb40830bda2290ccea8630/ironman-wm-ich-wurde-so-richtig-durchgekocht-laura-philipp-kaempft-sich-in-hawaii-aufs-podium.html,0,www.welt.de,„Ich wurde so richtig durchgekocht“ – Laura Philipp kämpft sich in Hawaii aufs Podium,Die beiden Führenden brechen fast zusammen. Die schwüle Hitze macht auch Laura Philipp zu schaffen. Die Titelverteidigerin aus Heidelberg schafft es aber wieder aufs Podest. Danach hatte es lange Zeit nicht ausgesehen.,https://images.welt.de/68eb40830bda2290ccea8630/5fc40d862267a5b4391c53822376b432-master/ci16x9-w1200/ironman-weltmeisterschaft-in-hawaii,2025-10-12T05:56:41Z,,"Nach einer körperlichen Tortur hat Laura Philipp auf den letzten Metern eines hochdramatischen Rennens ihr Lächeln wieder gefunden. Schon weit vor dem Ziel ging der Daumen nach oben, im Zielkanal kla… [+5285 chars]",,de,'Hitze'
https://www.faz.net/aktuell/sport/mehr-sport/ironman-wm-auf-hawaii-triathletin-laura-philipp-wird-dritte-bei-hitzeschlacht-accg-110728089.html,https://www.faz.net/aktuell/sport/mehr-sport/ironman-wm-auf-hawaii-triathletin-laura-philipp-wird-dritte-bei-hitzeschlacht-accg-110728089.html,0,www.faz.net,"Ironman auf Hawaii: „Der härteste Tag, den ich je gemacht habe“","Die Ironman-WM der Frauen auf Hawaii wird zur Hitzeschlacht: Kurz vor dem Ziel bricht die mögliche Siegerin zusammen, eine weitere Triathelin muss torkelnd aufgeben. Für die Deutsche Laura Philipp reicht es am Ende für Bronze.",https://media0.faz.net/ppmedia/w1200/aktuell/sport/2061984527/1.10728092/facebook_teaser/triathletin-laura-philipp-beim.jpg.webp,2025-10-12T06:07:40Z,,Laura Philipp rang sich nach dem härtesten Triathlon-Tag ihrer Karriere auf dem legendären Ali'i Drive ein Lächeln ab und winkte ins Publikum. Der Traum von der Titelverteidigung am Sehnsuchtsort pla… [+3627 chars],,de,'Hitze'
https://sport.orf.at/stories/3146538/,https://sport.orf.at/stories/3146538/,0,sport.orf.at,Perterer auf Hawaii bei Hitzedrama Fünfte,"Lisa Perterer hat am Samstag (Ortszeit) sensationell den fünften Platz bei der Ironman-WM auf Hawaii erreicht. Nach 3,86 km Schwimmen, 180,2 km Radfahren und 42,2 km Laufen fehlten der 33-Jährigen 19:41 Minuten auf die Siegerzeit von Solveig Lövseth aus Norwe…",https://ibs.orf.at/sport?image=https%3A%2F%2Fassets.orf.at%2Fmims%2F2025%2F42%2F65%2Fcrops%2Fw%3D1200%2Ch%3D630%2Cq%3D75%2F2796488_master_1078865_triathlon_hawaii_hitze_drama_perterer_afp.jpg%3Fs%3Dc4d3a13bfb59095987cfaccaeb68fabfe7815d16,2025-10-12T07:52:53Z,,Hinter der norwegischen Überraschungssiegerin Lövseth landeten die Britin Kat Matthews und die deutsche Titelverteidigerin Laura Philipp auf den Plätzen zwei und drei. Das Trio profitierte dabei alle… [+3173 chars],,de,'Hitze'
https://www.welt.de/sport/triathlon/article68eb736974c7beddb54e5b79/ironman-hawaii-2025-in-der-13-woche-schwanger-quaelt-sich-die-deutsche-durch-die-hitze.html,https://www.welt.de/sport/triathlon/article68eb736974c7beddb54e5b79/ironman-hawaii-2025-in-der-13-woche-schwanger-quaelt-sich-die-deutsche-durch-die-hitze.html,0,www.welt.de,In der 13. Woche schwanger quält sich die deutsche Triathletin durch die Hitze,Anne Reischmann absolviert unter schwierigen Bedingungen den Ironman auf Hawaii – und das nicht allein. Denn die deutsche Triathletin wird Mutter. Ihre Schwangerschaft macht sie erst kurz vor dem Start öffentlich. Im Ziel kommt es zu emotionalen Szenen.,https://images.welt.de/68eb736974c7beddb54e5b79/ae6e7ecfddbbee651054986f411013d3/ci16x9-w1200/2025-ironman-world-championship-women-s-race,2025-10-12T10:33:29Z,,Anne Reischmann absolviert unter schwierigen Bedingungen den Ironman auf Hawaii und das nicht allein. Denn die deutsche Triathletin wird Mutter. Ihre Schwangerschaft macht sie erst kurz vor dem Start… [+2064 chars],,de,'Hitze'
https://www.welt.de/sport/article68eb40830bda2290ccea8630/drama-bei-ironman-wm-kurz-vor-ziel-verliert-die-fuehrende-dehydriert-die-orientierung.html,https://www.welt.de/sport/article68eb40830bda2290ccea8630/drama-bei-ironman-wm-kurz-vor-ziel-verliert-die-fuehrende-dehydriert-die-orientierung.html,0,www.welt.de,Drei Kilometer vor dem Ziel verliert die Führende dehydriert die Orientierung,Dramatische Bilder bei der Ironman-WM der Frauen. Die beiden Führenden brachen kurz nacheinander ein. Die Amerikanerin Taylor Knibb war nicht mehr zurechnungsfähig und musste kurz vor dem Ziel aufgeben. Die schwüle Hitze machte auch Laura Philipp zu schaffen.,https://images.welt.de/68eb40830bda2290ccea8630/eb41e6edb0a81f4ad77345a03d3b3ca7/ci16x9-w1200/bildschirmfoto-2025-10-12-um-16-38-00,2025-10-12T14:56:00Z,,"Nach einer körperlichen Tortur hat Laura Philipp auf den letzten Metern eines hochdramatischen Rennens ihr Lächeln wieder gefunden. Schon weit vor dem Ziel ging der Daumen nach oben, im Zielkanal kla… [+6825 chars]",,de,'Hitze'
https://www.zeit.de/news/2025-10/13/wetter-zu-wochenbeginn-meist-grau-vereinzelt-sonne-moeglich,https://www.zeit.de/news/2025-10/13/wetter-zu-wochenbeginn-meist-grau-vereinzelt-sonne-moeglich,0,www.zeit.de,Herbstwetter: Wetter zu Wochenbeginn meist grau - vereinzelt Sonne möglich,Hier finden Sie Informationen zu dem Thema „Herbstwetter“. Lesen Sie jetzt „Wetter zu Wochenbeginn meist grau - vereinzelt Sonne möglich“.,https://img.zeit.de/news/2025-10/13/wetter-zu-wochenbeginn-meist-grau-vereinzelt-sonne-moeglich-image-group/wide__1300x731,2025-10-13T04:10:29Z,,Die Menschen in Baden-Württemberg sollten ihren Schal zu Wochenbeginn nicht allzu weit weglegen und morgens etwas mehr Zeit einplanen. Denn nach Angaben des Deutschen Wetterdienstes (DWD) bleibt es i… [+1745 chars],,de,'Sonne'
https://www.faz.net/aktuell/sport/fussball-wm/deutsches-team/fussball-wm-2026-anstosszeiten-in-der-nacht-das-muessen-fans-wissen-accg-110729466.html,https://www.faz.net/aktuell/sport/fussball-wm/deutsches-team/fussball-wm-2026-anstosszeiten-in-der-nacht-das-muessen-fans-wissen-accg-110729466.html,0,www.faz.net,Nächtliche WM-Spiele?: „Es wird am nächsten Tag viele Schulschwänzer geben“,"Die Hitze bei der Klub-WM in den USA machte Sorgen. Nun überlegt die FIFA, Spiele der WM 2026 mit erstmals 48 Teams später beginnen zu lassen. Die Folgen für deutsche Fans könnten unangenehm sein.",https://media1.faz.net/ppmedia/w1200/aktuell/sport/3610516028/1.10729727/facebook_teaser/spielt-florian-wirtz-mit-dem.jpg.webp,2025-10-13T11:43:14Z,,"Die Fußball-WM wirft ihre Schatten voraus. Das Turnier selbst dürfte hingegen eine Hitzeschlacht in der prallen Sonne werden. Spielern und Stadionbesuchern drohen schweißtreibende Stunden in den USA,… [+4584 chars]",,de,'Hitze'
https://www.focus.de/wissen/mastjahr-darum-gibt-es-in-diesem-jahr-eine-rekordzahl-an-eicheln_2833472f-d3b3-4e87-bd2e-428393850e1c.html,https://www.focus.de/wissen/mastjahr-darum-gibt-es-in-diesem-jahr-eine-rekordzahl-an-eicheln_2833472f-d3b3-4e87-bd2e-428393850e1c.html,0,www.focus.de,"„Mastjahr"": Darum gibt es in diesem Jahr eine Rekordzahl an Eicheln","Ein ungewöhnliches Naturschauspiel erfreut Gartenliebhaber: In diesem Herbst gibt es eine Rekordzahl an Eicheln. Verantwortlich dafür ist ein „Mastjahr"".",https://quadro.burda-forward.de/ctf/a926a842-b415-4507-bcd6-0903e37c7495.70dbdac3-a541-4de1-8ef8-e87696a74212.jpg?im=RegionOfInterestCrop%3D%281200%2C630%29%2CregionOfInterest%3D%281095%2C707%29&hash=60004b7b9bfb0daf1dcd481129e856fc9125c15dc84556eae31e09e71f0d6719,2025-10-13T14:53:26Z,,"In Großbritannien herrscht derzeit ein ungewöhnlicher Überfluss an Eicheln. Verantwortlich dafür ist ein sogenanntes Mastjahr, das etwa alle vier Jahre auftritt. Dabei produzieren bestimmte Bäume ein… [+2457 chars]",,de,'Natur'
https://www.waz.de/sport/article410219371/wm-anstosszeiten-muss-dfb-team-mitten-in-der-nacht-ran.html,https://www.waz.de/sport/article410219371/wm-anstosszeiten-muss-dfb-team-mitten-in-der-nacht-ran.html,0,www.waz.de,WM-Anstoßzeiten: Muss DFB-Team mitten in der Nacht ran?,"Die Fußball-WM könnte zu einem Turnier für Schulschwänzer werden. Denn extreme Hitze zwingt die Fifa dazu, den Spielplan zu überdenken.",https://img.sparknews.funkemedien.de/410219272/410219272_1760377175_v16_9_1600.jpeg,2025-10-13T17:39:55Z,,"Die Fußball-WM wirft ihre Schatten voraus. Das Turnier selbst dürfte hingegen eine Hitzeschlacht in der prallen Sonne werden. Spielern und Stadionbesuchern drohen schweißtreibende Stunden in den USA,… [+4533 chars]",,de,'Hitze'
https://orf.at/stories/3408285/,https://orf.at/stories/3408285/,0,orf.at,Hoffnung mit kleinen Wermutstropfen,"Unabhängig von der noch nicht absehbaren Schneelage rechnet die heimische Tourismusbranche heuer wieder mit einer starken Nachfrage nach Winterurlaub in Österreich. Laut der Winterpotenzialstudie der Österreich Werbung (ÖW) ist die Hoffnung groß, es ist sogar…",https://ibs.orf.at/news?image=https%3A%2F%2Fassets.orf.at%2Fmims%2F2025%2F42%2F41%2Fcrops%2Fw%3D1200%2Ch%3D630%2Cq%3D75%2F2798129_master_1079541_tourismus_wintersaison_vorschau_coe.jpg%3Fs%3Db4b42b36ed0fcfd7cc7d7a1c692312c2aaad7d84,2025-10-13T18:53:54Z,,"Die staatliche Tourismusmarketingorganisation ÖW erwartet, dass in der kommenden Saison 20,8 Millionen Menschen Urlaub in Österreich machen. Laut der Umfrage sind das um 0,9 Prozent mehr als im Vorja… [+5618 chars]",,de,'Schnee'
"https://www.gamestar.de/artikel/schwarzes-loch-pbh-sonne-sterne-einfangen-bilden-dunkle-materie,3439288.html","https://www.gamestar.de/artikel/schwarzes-loch-pbh-sonne-sterne-einfangen-bilden-dunkle-materie,3439288.html",0,www.gamestar.de,News: Wissenschaft - Im Inneren unserer Sonne könnte sich ein schwarzes Loch verstecken – zumindest nach den Theorien Stephen Hawkings,"Das Zentrum unserer Sonne gehört ohnehin zu den skurrilsten Orten des Sonnensystems. Doch was wäre, wenn in ihrem Inneren etwas Hungriges, für uns Unsichtbares lauert. Hier sind zwei Theorien, die sie als Heimstatt einer Singularität in Raum und Zeit erlauben…",https://images.cgames.de/images/gamestar/293/sonne-schwarzes-lock-teaser-adobe-firefly_6374085.jpg,2025-10-14T08:35:00Z,,"Es mag seltsam bis geradezu abstrus anmuten: ein schwarzes Loch in der Sonne. Alldieweil mag Physik extreme Lösungen und erlaubt auch solche.
(Bildquelle: Adobe Firefly, generative KI)
Blicken wir … [+5824 chars]",,de,'Sonne'
https://www.morgenpost.de/wirtschaft/article410212442/heizoelpreise-heute-aktuell-14-oktober-2025-heizoel-kaufen-heizung.html,https://www.morgenpost.de/wirtschaft/article410212442/heizoelpreise-heute-aktuell-14-oktober-2025-heizoel-kaufen-heizung.html,0,www.morgenpost.de,Heizölpreise aktuell (14. Oktober): Das kostet ein Liter heute,In der dritten Oktoberwoche erreichen die Temperaturen einen neuen Tiefstwert. Ziehen mit dem Wetter die Heizölpreise an? Ein Überblick.,https://img.sparknews.funkemedien.de/406858449/406858449_1728458201_v16_9_1600.jpeg,2025-10-14T08:52:13Z,,In Anbetracht der sinken Temperaturen dürften in vielen deutschen Haushalten die Heizungen schon bald wieder aufgedreht werden. Demnach werfen viele Verbraucherinnen und Verbraucher nun wieder einen … [+8294 chars],,de,'Temperaturen'
https://www.stern.de/familie/winterharte-balkonpflanzen--diese-sorten-eignen-sich-fuer-den-herbst-9491084.html,https://www.stern.de/familie/winterharte-balkonpflanzen--diese-sorten-eignen-sich-fuer-den-herbst-9491084.html,0,www.stern.de,Dekorativ und pflegeleicht: Balkonpflanzen für den Herbst: Diese Gewächsen vertragen kalte Temperaturen,"Wenn die Temperaturen sinken, finden sich in vielen Blumenkübeln nur noch welke Pflanzenreste. Dabei gibt es winterharte Pflanzen, die den Balkon in der kalten Jahreszeit schmücken.",https://image.stern.de/9491086/t/iY/v6/w1440/r1.7778/-/balkonpflanzen-winterhart.jpg,2025-10-14T10:48:00Z,,"Kopiere den aktuellen Link
Zur Merkliste hinzufügen
Wenn die Temperaturen sinken, finden sich in vielen Blumenkübeln nur noch welke Pflanzenreste. Dabei gibt es winterharte Pflanzen, die den Balkon… [+5372 chars]",,de,'Temperaturen'
https://www.welt.de/regionales/nrw/article68e90d71310b2a8e3e972854/rezept-fuer-den-herbst-bunte-mini-karotten-mit-pistazienpesto.html,https://www.welt.de/regionales/nrw/article68e90d71310b2a8e3e972854/rezept-fuer-den-herbst-bunte-mini-karotten-mit-pistazienpesto.html,0,www.welt.de,Bunte Mini-Karotten mit Pistazienpesto,Walter Stemberg und sein Sohn Sascha betreiben in Velbert das Sternerestaurant „Haus Stemberg“. Hier erklären sie die Grundlagen des Kochens. In dieser Folge zaubern sie einen Regenbogen aus Karotten.,https://images.welt.de/68e90d71310b2a8e3e972854/35e4fc9498f808ea955fa76032bb35d0/ci16x9-w1200/stemberg-freisteller,2025-10-14T11:07:19Z,,"Karotten klar, die kennt man. Sie sind so ungefähr das Erste, was Babys zu essen bekommen, wenn es keine Muttermilch sein soll. Karotten sind gut für das Zellwachstum und das Knochenwachstum, und auc… [+2632 chars]",,de,'Regen'
https://www.spektrum.de/news/extreme-hitze-macht-kontinente-stabil/2291384,https://www.spektrum.de/news/extreme-hitze-macht-kontinente-stabil/2291384,0,www.spektrum.de,Geologie: Extreme Hitze macht Kontinente stabil,"Warum sind die Kontinente hart? Die Antwort auf diese ungewöhnliche Frage löst nicht nur ein Rätsel der Erdgeschichte, sondern gibt auch Hinweise auf neue Rohstoffquellen.",https://static.spektrum.de/fm/912/f1920x1080/GettyImages-2203534288.jpg,2025-10-14T14:10:06Z,,"Die irdischen Kontinente können Gebirge tragen, die bis zu zehn Kilometer hoch sind und das, ohne unter dem enormen Gewicht zusammenzusacken. Warum das so ist, gibt der Forschung allerdings Rätsel au… [+2107 chars]",,de,'Hitze'
