index,published,keyword,domain,language,valid,title,description,url,image,archive,content,quote
d5e844ef44d84d4499af7eade6c7392f,2025-10-16T21:00:21Z,'heat wave',www.abc.net.au,en,0,"Bat boxes can become deadly roosts when the weather heats up, study finds","Artificial roosts, or “bat boxes”, have become a popular home conservation tool. But a new study raises concerns about the danger these boxes pose during heatwaves.",https://www.abc.net.au/news/science/2025-10-17/bat-boxes-can-become-fatally-warm-during-heatwaves/105898564,https://live-production.wcms.abc-cdn.net.au/09cd812d445f4d0f00696b778c503d3d?impolicy=wcms_watermark_news&cropH=1152&cropW=2048&xPos=0&yPos=76&width=862&height=485&imformat=generic,,"Artificial roosts for bats or bat boxes are a popular way to conserve native species when their natural habitat has been depleted.
They are often used in urban areas to provide shelter where large t… [+6796 chars]",
4d3ac8c6a30309ef0805e31b152592b3,2025-10-24T12:13:48Z,'heat climate change',abcnews.go.com,en,0,"In a California farming region, researchers are mapping rural heat to protect farmworkers","In some of the most agriculturally rich regions in the U.S., researchers from San Diego State University are working to understand how climate change is impacting heat in rural areas and the farmworkers who toil in them",https://abcnews.go.com/Technology/wireStory/california-farming-region-researchers-mapping-rural-heat-protect-126827868,https://i.abcnewsfe.com/a/335f04de-24f6-4cce-bded-0814f26b9d3e/wirestory_7dbd91789dfe19322a7a928d4d560908_16x9.jpg?w=1600,,"In the summers, the sky is jet black when Raul Cruz arrives at this Imperial Valley sugarcane field to start his day. He chops, cleans and bundles the crop, taking heed as the sun rises. It's hard wo… [+5971 chars]",
264a84d8d45ef0ce4e5e1f81121cbe7f,2025-10-31T21:31:54Z,'heat climate change',grist.org,en,0,‘A devastating global audit’ shows how climate change is undermining the health of millions,"Extreme heat now kills one person every minute, according to a sweeping new report by the British medical journal The Lancet.",https://grist.org/health/lancet-2025-countdown-health-climate-change-report/,https://grist.org/wp-content/uploads/2025/10/GettyImages-2228681461-1.jpg?quality=75&strip=all,,"This story is part of the Grist series Vital Signs, exploring the ways climate change affects your health. This reporting initiative is made possible thanks to support from the Wellcome Trust.
As wo… [+4655 chars]",
