index,url,valid,domain,title,description,image,published,archive,content,quote,language,keyword
https://www.zeit.de/news/2025-07/01/schlaflos-und-erschoepft-hitze-setzt-kindern-zu,https://www.zeit.de/news/2025-07/01/schlaflos-und-erschoepft-hitze-setzt-kindern-zu,0,www.zeit.de,Kinder und Hitze: Schlaflos und erschöpft – Hitze setzt Kindern zu,Hier finden Sie Informationen zu dem Thema „Kinder und Hitze“. Lesen Sie jetzt „Schlaflos und erschöpft – Hitze setzt Kindern zu“.,https://img.zeit.de/news/2025-07/01/schlaflos-und-erschoepft-hitze-setzt-kindern-zu-image-group/wide__1300x731,2025-07-01T02:00:49Z,,"Bei Hitzewellen wie in diesen Tagen leiden drei von vier Kindern und Jugendlichen in Baden-Württemberg deutlich, sie schlafen schlecht, haben Kopfschmerzen und sind müde. Nach dem neuen DAK Kinder- u… [+1564 chars]",,de,'Hitze'
https://www.zeit.de/news/2025-07/01/statistiker-hitze-fordert-jaehrlich-rund-22-tote,https://www.zeit.de/news/2025-07/01/statistiker-hitze-fordert-jaehrlich-rund-22-tote,0,www.zeit.de,Gesundheit bei Hitze: Statistiker: Hitze fordert jährlich rund 22 Tote,Hier finden Sie Informationen zu dem Thema „Gesundheit bei Hitze“. Lesen Sie jetzt „Statistiker: Hitze fordert jährlich rund 22 Tote“.,https://img.zeit.de/news/2025-07/01/statistiker-hitze-fordert-jaehrlich-rund-22-tote-image-group/wide__1300x731,2025-07-01T07:37:52Z,,Rund 1.400 Mal pro Jahr sind in den vergangenen Jahren Menschen wegen gesundheitlicher Schäden durch Sonnenlicht oder Hitze in Krankenhäusern behandelt worden. Bei den Behandlungszahlen handelt es si… [+1800 chars],,de,'Hitze'
https://www.zeit.de/news/2025-07/01/arbeitsschutz-bei-hitze-ministerium-gibt-tipps,https://www.zeit.de/news/2025-07/01/arbeitsschutz-bei-hitze-ministerium-gibt-tipps,0,www.zeit.de,Arbeitsschutz: Arbeitsschutz bei Hitze - Ministerium gibt Tipps,Hier finden Sie Informationen zu dem Thema „Arbeitsschutz“. Lesen Sie jetzt „Arbeitsschutz bei Hitze - Ministerium gibt Tipps“.,https://img.zeit.de/news/2025-07/01/arbeitsschutz-bei-hitze-ministerium-gibt-tipps-image-group/wide__1300x731,2025-07-01T08:28:59Z,,"Die anhaltenden Hitze hat auch einen gefährlichen Einfluss auf Arbeiten, die im Freien erledigt werden. Ist es zu heiß, lassen Konzentration und Leistungsfähigkeit nach, Kopfschmerzen und Übelkeit kö… [+1485 chars]",,de,'Hitze'
https://www.zeit.de/news/2025-07/01/wetterdienst-verlaengert-landesweite-hitze-warnung,https://www.zeit.de/news/2025-07/01/wetterdienst-verlaengert-landesweite-hitze-warnung,0,www.zeit.de,Wetter: Wetterdienst verlängert landesweite Hitze-Warnung,Hier finden Sie Informationen zu dem Thema „Wetter“. Lesen Sie jetzt „Wetterdienst verlängert landesweite Hitze-Warnung“.,https://img.zeit.de/news/2025-07/01/wetterdienst-verlaengert-landesweite-hitze-warnung-image-group/wide__1300x731,2025-07-01T08:54:00Z,,Wegen der weiter steigenden Temperaturen und der mangelnden Abkühlung in Baden-Württemberg verlängert der Deutsche Wetterdienst (DWD) seine landesweite Warnung vor «extremer Hitze». Bis zum Mittwocha… [+758 chars],,de,'Hitze'
https://www.zeit.de/news/2025-07/01/dwd-warnt-auch-fuer-den-norden-vor-extremer-hitze,https://www.zeit.de/news/2025-07/01/dwd-warnt-auch-fuer-den-norden-vor-extremer-hitze,0,www.zeit.de,Hitze bis 37 Grad Celsius: DWD warnt auch für den Norden vor extremer Hitze,Hier finden Sie Informationen zu dem Thema „Hitze bis 37 Grad Celsius“. Lesen Sie jetzt „DWD warnt auch für den Norden vor extremer Hitze“.,https://img.zeit.de/news/2025-07/01/dwd-warnt-auch-fuer-den-norden-vor-extremer-hitze-image-group/wide__1300x731,2025-07-01T10:33:40Z,,"Der Deutsche Wetterdienst hat für Hamburg und den Süden Schleswig-Holsteins eine amtliche Warnung vor extremer Hitze herausgeben. Am Mittwoch, zwischen 11.00 und 19.00 Uhr, werde eine extreme Hitzebe… [+1022 chars]",,de,'Hitze'
https://www.zeit.de/news/2025-07/01/hitze-sorgt-bei-bahnreisenden-fuer-probleme,https://www.zeit.de/news/2025-07/01/hitze-sorgt-bei-bahnreisenden-fuer-probleme,0,www.zeit.de,Wetter: Hitze sorgt bei Bahnreisenden für Probleme,Hier finden Sie Informationen zu dem Thema „Wetter“. Lesen Sie jetzt „Hitze sorgt bei Bahnreisenden für Probleme“.,https://img.zeit.de/news/2025-07/01/hitze-sorgt-bei-bahnreisenden-fuer-probleme-image-group/wide__1300x731,2025-07-01T17:14:57Z,,"Im Regionalverkehr müssen sich Reisende auch am kommenden heißen Tag auf Zugausfälle und Verspätungen einstellen. Aufgrund hoher Temperaturen gebe es auf zahlreichen Linien Beeinträchtigungen, teilte… [+424 chars]",,de,'Hitze'
https://www.zeit.de/news/2025-07/02/oekologischer-notstand-bayerns-tiere-und-pflanzen-in-gefahr,https://www.zeit.de/news/2025-07/02/oekologischer-notstand-bayerns-tiere-und-pflanzen-in-gefahr,0,www.zeit.de,Hitze und Dürre in Bayern: Ökologischer Notstand - Bayerns Tiere und Pflanzen in Gefahr,Hier finden Sie Informationen zu dem Thema „Hitze und Dürre in Bayern“. Lesen Sie jetzt „Ökologischer Notstand - Bayerns Tiere und Pflanzen in Gefahr“.,https://img.zeit.de/news/2025-07/02/oekologischer-notstand-bayerns-tiere-und-pflanzen-in-gefahr-image-group/wide__1300x731,2025-07-02T02:04:35Z,,Die anhaltende Hitze und Dürre gefährden nach Ansicht von Umweltschützern zunehmend die bayerische Tier- und Pflanzenwelt. Ohne politische und gesellschaftliche Gegenmaßnahmen drohten langfristige Sc… [+2490 chars],,de,'Natur'
https://www.zeit.de/news/2025-07/02/berliner-kirchen-oeffnen-tueren-wegen-hitze,https://www.zeit.de/news/2025-07/02/berliner-kirchen-oeffnen-tueren-wegen-hitze,0,www.zeit.de,Gefahr durch Hitze: Berliner Kirchen öffnen Türen wegen Hitze,Hier finden Sie Informationen zu dem Thema „Gefahr durch Hitze“. Lesen Sie jetzt „Berliner Kirchen öffnen Türen wegen Hitze“.,https://img.zeit.de/news/2025-07/02/berliner-kirchen-oeffnen-tueren-wegen-hitze-image-group/wide__1300x731,2025-07-02T05:18:10Z,,"Mehrere Berliner Kirchen öffnen in diesen Tagen ihre Türen, um in der Hitze einen kühlen Schutzraum zu bieten. Das Angebot richte sich insbesondere an wohnungslose und an andere bedürftige Menschen, … [+861 chars]",,de,'Hitze'
https://www.zeit.de/wissen/2025-07/hitze-europa-hoechsttemperaturen-vergleich-daten,https://www.zeit.de/wissen/2025-07/hitze-europa-hoechsttemperaturen-vergleich-daten,0,www.zeit.de,Hitze in Europa: Hier ist die Hitze am extremsten,"Selten war es in ganz Europa so früh so heiß. Für Millionen Menschen wird das zu einer wiederkehrenden Gefahr. Daten zeigen, welche Regionen besonders betroffen sind.",https://img.zeit.de/wissen/2025-07/hitze-europa-hoechsttemperaturen-vergleich-daten-teaserbild/wide__1300x731,2025-07-02T06:15:24Z,,"Die Hitze erreicht Europa: In Spanien und Portugal herrschen Höchsttemperaturen. In Frankreich und der Türkei brennen Wälder, auch in Deutschland wird es gefährlich heiß.
Im portugiesischen Mora sti… [+448 chars]",,de,'Hitze'
https://www.zeit.de/news/2025-07/02/wen-die-hitze-in-die-notaufnahme-bringt,https://www.zeit.de/news/2025-07/02/wen-die-hitze-in-die-notaufnahme-bringt,0,www.zeit.de,Hitze: Wen die Hitze in die Notaufnahme bringt,Hier finden Sie Informationen zu dem Thema „Hitze“. Lesen Sie jetzt „Wen die Hitze in die Notaufnahme bringt“.,https://img.zeit.de/news/2025-07/02/wen-die-hitze-in-die-notaufnahme-bringt-image-group/wide__1300x731,2025-07-02T09:42:45Z,,"Temperaturen an die 40 Grad sind ein gesundheitliches Risiko - und zwar nicht nur für ältere Menschen, die nicht genügend trinken. In der Zentralen Notaufnahme des Frankfurter Universitätsklinikums g… [+1123 chars]",,de,'Hitze'
https://www.zeit.de/news/2025-07/02/wie-wirkt-sich-die-hitze-auf-wildtiere-aus,https://www.zeit.de/news/2025-07/02/wie-wirkt-sich-die-hitze-auf-wildtiere-aus,0,www.zeit.de,Hitzewelle: Wie wirkt sich die Hitze auf Wildtiere aus?,Hier finden Sie Informationen zu dem Thema „Hitzewelle“. Lesen Sie jetzt „Wie wirkt sich die Hitze auf Wildtiere aus?“.,https://img.zeit.de/news/2025-07/02/wie-wirkt-sich-die-hitze-auf-wildtiere-aus-image-group/wide__1300x731,2025-07-02T10:15:03Z,,"Die Menschen in Deutschland ächzen unter der aktuellen Hitzewelle. Doch auch für Natur und Wildtiere stellen die hohen Temperaturen eine enorme Belastung dar. «Besonders betroffen sind Tiere, die für… [+1784 chars]",,de,'Hitze'
https://www.zeit.de/kultur/2025-07/buecher-klimakrise-empfehlungen-erfahrungen,https://www.zeit.de/kultur/2025-07/buecher-klimakrise-empfehlungen-erfahrungen,0,www.zeit.de,Literaturempfehlungen zur Hitze: Der heiße Scheiß,"39 Grad, tropische Nächte: Fünf ZEIT-Autorinnen und -Autoren über die Bücher, die uns erzählen, wie wir in Deutschland mit der Hitze leben können.",https://img.zeit.de/kultur/2025-07/buecher-klimakrise-empfehlungen-erfahrungen-2/wide__1300x731,2025-07-02T11:05:10Z,,"In Italien schmelzen längst die Straßen, und selbst in Deutschland, dem Land des Stoßlüftens, sprechen plötzlich alle über Klimaanlagen. Das Leben ändert sich. Hier sind fünf gute Geschichten über So… [+965 chars]",,de,'Hitze'
https://www.faz.net/aktuell/gesellschaft/ungluecke/das-mittelmeer-heizt-sich-auf-die-folgen-treffen-nicht-nur-meeresbewohner-110570987.html,https://www.faz.net/aktuell/gesellschaft/ungluecke/das-mittelmeer-heizt-sich-auf-die-folgen-treffen-nicht-nur-meeresbewohner-110570987.html,0,www.faz.net,Hitzedome: Das Mittelmeer heizt sich auf – mit Folgen für die Landbewohner,"Zwar kocht das Mittelmeer nicht – auch wenn vom „mare bollente“ zu lesen ist. Doch die Oberflächentemperatur des Wassers ist gestiegen. Das hat nicht nur Folgen für die Natur unter Wasser, sondern auch für Mensch und Tier an Land.",https://media0.faz.net/ppmedia/aktuell/gesellschaft/3140479437/1.10571026/facebook_teaser/die-balearische-see-ist.jpg,2025-07-02T15:04:22Z,,"Nein, das Mittelmeer kocht nicht, auch wenn in manchen italienischen Medien routinemäßig vom mare bollente die Rede ist. Wahr ist, dass nach Messdaten des satellitengestützten EU-Erdbeobachtungsprogr… [+2862 chars]",,de,'Hitze'
https://www.zeit.de/news/2025-07/02/wasserverbrauch-in-berlin-auf-rekordniveau,https://www.zeit.de/news/2025-07/02/wasserverbrauch-in-berlin-auf-rekordniveau,0,www.zeit.de,Hitzefolgen: Wasserverbrauch in Berlin auf Rekordniveau,Hier finden Sie Informationen zu dem Thema „Hitzefolgen“. Lesen Sie jetzt „Wasserverbrauch in Berlin auf Rekordniveau“.,https://img.zeit.de/news/2025-07/02/wasserverbrauch-in-berlin-auf-rekordniveau-image-group/wide__1300x731,2025-07-02T15:09:47Z,,Der Wasserverbrauch in Berlin ist aufgrund der heißen Tage auf Rekordniveau geklettert. Bereits am Dienstag stieg die Fördermenge der Berliner Wasserwerke den Angaben zufolge auf rund 822.900 Kubikme… [+1492 chars],,de,'Hitze'
https://www.stern.de/gesellschaft/regional/berlin-brandenburg/hitzefolgen--wasserverbrauch-in-berlin-auf-rekordniveau-35861112.html,https://www.stern.de/gesellschaft/regional/berlin-brandenburg/hitzefolgen--wasserverbrauch-in-berlin-auf-rekordniveau-35861112.html,0,www.stern.de,Hitzefolgen: Wasserverbrauch in Berlin auf Rekordniveau,An richtig heißen Tagen schnellt auch der Wasserverbrauch nach oben. Die Daten der Berliner Wasserwerke zeigen das deutlich. Die Werte sind so hoch wie lange nicht mehr.,https://image.stern.de/35861114/t/bG/v1/w1440/r1.7778/-/02--dhx3lnhqqcv4axs2048jpeg---52cd02ce6c642a17.jpg,2025-07-02T15:09:47Z,,"Kopiere den aktuellen Link
Zur Merkliste hinzufügen
An richtig heißen Tagen schnellt auch der Wasserverbrauch nach oben. Die Daten der Berliner Wasserwerke zeigen das deutlich. Die Werte sind so ho… [+1678 chars]",,de,'Hitze'
https://www.tagesspiegel.de/berlin/hitzefolgen-wasserverbrauch-in-berlin-auf-rekordniveau-13957922.html,https://www.tagesspiegel.de/berlin/hitzefolgen-wasserverbrauch-in-berlin-auf-rekordniveau-13957922.html,0,www.tagesspiegel.de,Hitzefolgen: Wasserverbrauch in Berlin auf Rekordniveau,An richtig heißen Tagen schnellt auch der Wasserverbrauch nach oben. Die Daten der Berliner Wasserwerke zeigen das deutlich. Die Werte sind so hoch wie lange nicht mehr.,https://www.tagesspiegel.de/images/13957919/alternates/BASE_16_9_W1400/1751469055000/trinkwasser.jpeg,2025-07-02T15:10:55Z,,Der Wasserverbrauch in Berlin ist aufgrund der heißen Tage auf Rekordniveau geklettert. Bereits am Dienstag stieg die Fördermenge der Berliner Wasserwerke den Angaben zufolge auf rund 822.900 Kubikme… [+2212 chars],,de,'Hitze'
https://www.focus.de/politik/deutschland/fokus-einseitig-auf-klimaschutz-bauexpertin-zerpflueckt-anti-hitze-strategie_656a45d1-f697-4a1e-af5d-68cef74e1b82.html,https://www.focus.de/politik/deutschland/fokus-einseitig-auf-klimaschutz-bauexpertin-zerpflueckt-anti-hitze-strategie_656a45d1-f697-4a1e-af5d-68cef74e1b82.html,0,www.focus.de,"""Fokus einseitig auf Klimaschutz"": Bauexpertin zerpflückt Anti-Hitze-Strategie",Lamia Messari-Becker ist Bauingenieurin. Sie sagt über unseren Umgang mit der Hitze: Vor lauter Klimaschutz haben wir die Klimaanpassung vergessen.,https://quadro.burda-forward.de/ctf/eef588a4-5d34-4f56-99c8-f2d1f3f512f2.c4d0efbb-d083-4498-a36a-103d560c53ef.jpeg?im=RegionOfInterestCrop%3D%281200%2C630%29%2CregionOfInterest%3D%28400%2C300%29&hash=63c269c7c72918351a7af14ac95843055c5bbe32cbe100630f8aa1da6faf9e62,2025-07-02T15:23:56Z,,"Deutschland stöhnt unter der Hitzewelle, was kann in den Städten, wo der Asphalt kocht, getan werden, damit die Menschen sich dort bewegen können?
Lamia Messari-Becker:Die Hitzewelle ist ein Stresst… [+5632 chars]",,de,'Hitze'
https://steiermark.orf.at/stories/3311973/,https://steiermark.orf.at/stories/3311973/,0,steiermark.orf.at,Erstmals kühle Räume für Obdachlose in Graz,In Graz werden angesichts der Hitzewelle erstmals offiziell gekühlte Räume für Obdachlose geöffnet. Die Bahnhofsmission bietet tagsüber Schutz vor der Hitze. Auch Vinzi-Werke reagieren auf die steigenden Temperaturen und passen ihre Öffnungszeiten an.,https://ibs.orf.at/stm?image=https%3A%2F%2Foekastatic.orf.at%2Fmims%2F2025%2F27%2F49%2Fcrops%2Fw%3D1200%2Ch%3D627%2Cq%3D75%2F2683720_master_1032649_31436e2e-c4c8-4c6b-aa7c-6dfa07e64d25.jpg%3Fs%3D69b4cbadacb5bbf7152854869ccb5d499ccafa19,2025-07-02T15:27:00Z,,"Die Hitze in Graz trifft besonders jene, die kein Zuhause haben, um sich tagsüber zurückzuziehen. Erstmals werden offiziell gekühlte Räume für Obdachlose geöffnet, um ihnen Schutz vor der Hitze zu bi… [+1322 chars]",,de,'Temperaturen'
https://www.bild.de/news/inland/hitzewelle-krankschreibungen-wegen-hitze-nehmen-deutlich-zu-6863aa4654352c1fc4b32cbe,https://www.bild.de/news/inland/hitzewelle-krankschreibungen-wegen-hitze-nehmen-deutlich-zu-6863aa4654352c1fc4b32cbe,0,www.bild.de,"Hitzschlag, Sonnenstich, Herz-Kreislauf - Krankschreibungen wegen Hitze nehmen deutlich zu",Neue Zahlen vom Bundesarbeitsministerium zeigen einen deutlichen Anstieg.,"https://images.bild.de/6863aa4654352c1fc4b32cbe/00c99e8d6de20c802856bd1a5fd8e908,12d534ed?w=1280",2025-07-02T15:29:02Z,,"Berlin Die Hitze macht Menschen in Deutschland immer öfter krank. Das belegen neue Zahlen vom Bundesministerium für Arbeit und Soziales. Demnach ist die Zahl der Krankheitstage wegen Hitzschlag, Sonn… [+1983 chars]",,de,'Sonne'
https://www.bild.de/sport/fussball/hannover-96-tropen-hitze-96-trainiert-mit-salzstangen-und-sonnencreme-686547b7aa0dfb270f803ac4,https://www.bild.de/sport/fussball/hannover-96-tropen-hitze-96-trainiert-mit-salzstangen-und-sonnencreme-686547b7aa0dfb270f803ac4,0,www.bild.de,Tropen-Hitze! - 96 trainiert mit Salzstangen und Sonnencreme,"Hitze-Training Mittwoch bei Hannover 96 – mit Eis-Handtuch, Salzstangen und Sonnencreme.","https://images.bild.de/686547b7aa0dfb270f803ac4/c0b78fc66a654afb5466c1412fab16ad,e8de5ecf?w=1280",2025-07-02T15:29:15Z,,"Deutschland ächzt unter der Tropen-Hitze und die Profis von Hannover 96 trainierten zweieinhalb Stunden.
Morgens um kurz vor halb zehn waren es Mittwoch schon 31 Grad an der 96-Arena, beim Start der… [+1278 chars]",,de,'Sonne'
https://www.faz.net/aktuell/rhein-main/kultur/patti-smith-beginnt-in-mainz-ihre-deutschlandtournee-110571526.html,https://www.faz.net/aktuell/rhein-main/kultur/patti-smith-beginnt-in-mainz-ihre-deutschlandtournee-110571526.html,0,www.faz.net,Patti Smith beginnt in Mainz ihre Deutschlandtournee,Mit Geburtstagsgrüßen für den Dalai Lama und Tipps gegen die Hitze: Auf der Zitadelle in Mainz beginnt Patti Smith ihre Deutschlandtournee.,https://media1.faz.net/ppmedia/aktuell/2479901733/1.10571525/facebook_teaser/wenn-die-mutter-mit-dem-sohne.jpg,2025-07-02T15:30:00Z,,"Den Dalai Lama, den Dichter William Blake und Johannes Gutenberg, den Erfinder des modernen Buchdrucks, dürften gemeinsam nicht allzu viele Musiker ganz oben auf der Liste ihrer persönlichen Helden s… [+3369 chars]",,de,'Hitze'
https://www.morgenpost.de/bezirke/lichtenberg/article409412325/70-jahre-tierpark-berlin-hitze-und-ueberraschung-zum-geburtstag.html,https://www.morgenpost.de/bezirke/lichtenberg/article409412325/70-jahre-tierpark-berlin-hitze-und-ueberraschung-zum-geburtstag.html,0,www.morgenpost.de,70 Jahre Tierpark Berlin: Hitze und Überraschung zum Geburtstag,Am heißesten Tag des Jahres feiert der Tierpark Jubiläum. Dabei gab es Abkühlung für die Tiere und eine Überraschung für die Besucher.,https://img.sparknews.funkemedien.de/409414492/409414492_1751470301_v16_9_1600.jpeg,2025-07-02T15:31:42Z,,Berlin. Am heißesten Tag des Jahres feiert der Tierpark Jubiläum. Dabei gab es Abkühlung für die Tiere und eine Überraschung für die Besucher.,,de,'Hitze'
https://www.morgenpost.de/berlin/article409414171/feuerwehrchef-bittet-die-berliner-sich-vor-hitze-zu-schuetzen.html,https://www.morgenpost.de/berlin/article409414171/feuerwehrchef-bittet-die-berliner-sich-vor-hitze-zu-schuetzen.html,0,www.morgenpost.de,"Feuerwehrchef bittet die Berliner, sich vor Hitze zu schützen","Wenn Temperaturen an die 40 Grad zu Gesundheitsproblemen führen, bekommt auch die Berliner Feuerwehr mehr zu tun. So hoch ist die Belastung.",https://img.sparknews.funkemedien.de/409414234/409414234_1751470333_v16_9_1600.jpeg,2025-07-02T15:32:13Z,,"Berlin. Wenn Temperaturen an die 40 Grad zu Gesundheitsproblemen führen, bekommt auch die Berliner Feuerwehr mehr zu tun. So hoch ist die Belastung.
Bis zu 37 Grad Celsius: Die Hitze hat Berlin fest… [+2171 chars]",,de,'Hitze'
https://www.tagesspiegel.de/gesellschaft/panorama/mussten-nach-notruf-befreit-werden-48-reisende-sitzen-stundenlang-bei-hitze-in-bahn-fest-13958303.html,https://www.tagesspiegel.de/gesellschaft/panorama/mussten-nach-notruf-befreit-werden-48-reisende-sitzen-stundenlang-bei-hitze-in-bahn-fest-13958303.html,0,www.tagesspiegel.de,Mussten nach Notruf befreit werden: 48 Reisende sitzen stundenlang bei Hitze in Bahn fest,Wegen eines technischen Defekts muss eine Nordwestbahn bei Elsfleth in Niedersachsen halten. Dutzende Reisende sitzen bei Hitze im Zug fest - bis Passagiere selbst den Notruf wählen.,https://www.tagesspiegel.de/images/13958309/alternates/BASE_16_9_W1400/1751471439000/zug-der-nordwestbahn-im-sonnenaufgang.jpeg,2025-07-02T15:53:20Z,,48 Bahnreisende der Nordwestbahn mussten am Dienstag zweieinhalb Stunden bei hohen Temperaturen in einem Zug mit kaputter Klimaanlage in Niedersachsen ausharren. Die Regionalbahn war aufgrund eines t… [+2548 chars],,de,'Hitze'
https://www.tagesspiegel.de/politik/sommer-in-deutschland-was-die-politik-gegen-hitze-in-den-stadten-unternehmen-will-13957514.html,https://www.tagesspiegel.de/politik/sommer-in-deutschland-was-die-politik-gegen-hitze-in-den-stadten-unternehmen-will-13957514.html,0,www.tagesspiegel.de,Sommer in Deutschland: Was die Politik gegen Hitze in den Städten unternehmen will,"Die Grünen zeigen am heißesten Tag des Jahres auf, wie sehr sich unsere Städte ohne Grün aufheizen. Sie fordern mehr Anpassung an den Klimawandel. Das Bauministerium stellt dafür mehr Fördermittel bereit.",https://www.tagesspiegel.de/images/13957148/alternates/BASE_16_9_W1400/1751468519000/hitze-in-deutschland-berlin.jpeg,2025-07-02T15:54:51Z,,Für den bisher wärmsten Tag des Jahres hat sich Julia Schneider eine Wärmebildkamera besorgt. Deren Display leuchtet jetzt in gelb-orange: 64 Grad ist der Sand auf dem Spielplatz im Köllnischen Park … [+5399 chars],,de,'Hitze'
https://www.freitag.de/autoren/tobias-mueller/groenlinks-pvda-was-steckt-hinter-der-neuen-linkspartei-in-den-niederlanden,https://www.freitag.de/autoren/tobias-mueller/groenlinks-pvda-was-steckt-hinter-der-neuen-linkspartei-in-den-niederlanden,0,www.freitag.de,Niederlande | Roter Frühling oder grüner Flop? Was hinter der neuen Linkspartei der Niederlande steckt,"GroenLinks und PvdA fusionieren zur neuen Linkspartei – und träumen vom politischen Frühling. Doch alte Grabenkämpfe, neue Konflikte und der Streit um Israel belasten das Projekt. Wird die Einheit zur Chance oder zur Selbstzerstörung? Frühlingsgefühle im Somm…",https://www.freitag.de/autoren/tobias-mueller/groenlinks-pvda-was-steckt-hinter-der-neuen-linkspartei-in-den-niederlanden/@@images/image/great,2025-07-04T02:00:00Z,,"Frühlingsgefühle im Sommer – so ließ sich die Stimmung beschreiben, als die Mitglieder der niederländischen Partij van de Arbeid (PvdA) und jene von GroenLinks Mitte Juni ihre Fusion beschlossen. 88 … [+516 chars]",,de,'Frühlingsgefühle'
https://taz.de/Protesttag-in-Kenia/!6098624/,https://taz.de/Protesttag-in-Kenia/!6098624/,0,taz.de,Protesttag in Kenia: Nairobi zwischen Regen und Tränengas,Kenias Protestbewegung „Generation Z“ hat erneut zu Massenprotesten aufgerufen. Der 7. Juli hat für das Land seit 1990 eine historische Bedeutung.,https://taz.de/picture/7797799/1200/38785731-1.jpeg,2025-07-07T11:24:00Z,,Kenias Protestbewegung „Generation Z“ hat erneut zu Massenprotesten aufgerufen. Der 7. Juli hat für das Land seit 1990 eine historische Bedeutung. mehr...,,de,'Regen'
https://www.sueddeutsche.de/muenchen/oper-fuer-alle-marstallplatz-muenchen-bayerische-staatsoper-open-air-li.3275874,https://www.sueddeutsche.de/muenchen/oper-fuer-alle-marstallplatz-muenchen-bayerische-staatsoper-open-air-li.3275874,0,www.sueddeutsche.de,Open Air auf dem Marstallplatz: 7000 Zuschauer trotzen dem Regen bei Oper für alle,Sich zuprosten und das Leben feiern: Ganz im Sinne von Mozarts „Don Giovanni“ machen Tausende den Marstallplatz zu Münchens größten Opernsaal. Drinnen im Nationaltheater sitzen die Promis.,https://www.sueddeutsche.de/2025/07/07/67366084-ecdc-4768-93a5-8118fbc4c949.jpeg?q=60&fm=webp&width=1200&rect=347%2C405%2C3306%2C1860,2025-07-07T12:19:33Z,,"Denn klar ist, dass Oper für alle längst nicht nur eine Möglichkeit ist, einmal gratis zum Publikum der Staatsoper zu gehören. Das Event beginnt lange, bevor Vladimir Jurowski den Taktstock zu Mozart… [+5113 chars]",,de,'Regen'
https://www.transfermarkt.de/ten-hag-startet-mit-bayer-in-die-vorbereitung-wir-werden-den-kader-neu-aufbauen-quot-/view/news/456653,https://www.transfermarkt.de/ten-hag-startet-mit-bayer-in-die-vorbereitung-wir-werden-den-kader-neu-aufbauen-quot-/view/news/456653,0,www.transfermarkt.de,Ten Hags Start bei Bayer Leverkusen: Wollen Kader neu aufbauen,Erik ten Hag hat am Montag seine erste Trainingseinheit bei Bayer 04 Leverkusen geleitet. Vor etwa 100 Zuschauern bei sehr wechselhaftem Wetter zwischen Sonne und Regen fehlten noch die...,https://tmssl.akamaized.net/images/foto/big/erik-ten-hag-bayer-leverkusen-2025-1751904746-171859.jpg?lm=1751904756,2025-07-07T16:55:32Z,,Erik ten Hag hat am Montag seine erste Trainingseinheit bei Bayer 04 Leverkusen geleitet. Vor etwa 100 Zuschauern bei sehr wechselhaftem Wetter zwischen Sonne und Regen fehlten noch die urlaubenden N… [+2420 chars],,de,'Regen'
https://www.ibiza-heute.de/regen-und-gewitter-morgens-frueh/,https://www.ibiza-heute.de/regen-und-gewitter-morgens-frueh/,0,www.ibiza-heute.de,Regen und Gewitter morgens früh,Von 4 Uhr nachts bis 10 Uhr morgens drohen auf Ibiza und Formentera Regen und Gewitter. Der spanische Wetterdienst Aemet gibt Warnung Gelb heraus. In einer Stunde könnten sich 30 mm Niederschläge ansammeln. Die Wahrscheinlichkeit beträgt 40 bis 70 Prozent. De…,https://www.ibiza-heute.de/wp-content/uploads/2022/09/RegenRE-1.jpg,2025-07-07T17:00:20Z,,"Von 4 Uhr nachts bis 10 Uhr morgens drohen auf Ibiza und Formentera Regen und Gewitter. Der spanische Wetterdienst Aemet gibt Warnung Gelb heraus.
In einer Stunde könnten sich 30 mm Niederschläge an… [+153 chars]",,de,'Regen'
https://www.jungewelt.de/artikel/503536.ki-kontra-urheberrecht-uns-urheber-lässt-man-im-regen-stehen.html,https://www.jungewelt.de/artikel/503536.ki-kontra-urheberrecht-uns-urheber-lässt-man-im-regen-stehen.html,0,www.jungewelt.de,KI kontra Urheberrecht: »Uns Urheber lässt man im Regen stehen«,"Darmstadt: Am 27. Juni verhandelte das PEN-Zentrum Deutschland über Urheberrechtsverstöße durch KI. Ein Gespräch mit Tobias Kiwitt, Rechtsanwalt und Autor sowie Präsidiumsmitglied im PEN-Zentrum Deutschland.",https://www.jungewelt.de/img/1100/210734.jpg,2025-07-07T17:39:18Z,,"Techkonzerne nutzen längst alle möglichen im Netz auffindbaren Inhalte ohne Einwilligung der Urheber, um ihre künstliche Intelligenz, KI, damit zu trainieren. Was wurde bei der Mitgliederversammlung … [+3801 chars]",,de,'Regen'
