index,url,valid,domain,title,description,image,published,archive,content,quote,language,keyword
https://www.welt.de/sport/formel1/article68df936b2e775723b4b3cad4/formel-1-hitze-ernstfall-neue-regel-greift-erstmals-beim-extremrennen-in-singapur.html,https://www.welt.de/sport/formel1/article68df936b2e775723b4b3cad4/formel-1-hitze-ernstfall-neue-regel-greift-erstmals-beim-extremrennen-in-singapur.html,0,www.welt.de,Hitze-Ernstfall – neue Regel greift erstmals beim Extremrennen in Singapur,Das Rennen der Formel 1 am Sonntag in Singapur gilt als wohl härteste Prüfung für die Piloten. Physisch geraten sie wegen der Hitze und Luftfeuchtigkeit an ihre Grenzen. Deswegen müssen die Teams plötzlich Kühlwesten auspacken. Nicht jedem Fahrer gefällt das.,https://images.welt.de/68df936b2e775723b4b3cad4/876b318460e7883334f87b22e06dad59-master/ci16x9-w1200/f1-grand-prix-of-singapore,2025-10-03T10:45:55Z,,Das Rennen der Formel 1 am Sonntag in Singapur gilt als wohl härteste Prüfung für die Piloten. Physisch geraten sie wegen der Hitze und Luftfeuchtigkeit an ihre Grenzen. Deswegen müssen die Teams plö… [+4277 chars],,de,'Hitze'
https://www.bild.de/regional/baden-wuerttemberg/haerteste-frau-der-welt-tanja-rennt-durch-10-wuesten-in-10-laendern-68bec438bcda9d4ab9560cf5,https://www.bild.de/regional/baden-wuerttemberg/haerteste-frau-der-welt-tanja-rennt-durch-10-wuesten-in-10-laendern-68bec438bcda9d4ab9560cf5,0,www.bild.de,Härteste Frau der Welt - Tanja rennt durch 10 Wüsten in 10 Ländern,"Täglich 70 km durch Sand, Dünen und Hitze – wie die Wüste für Tanja Braun zum Wohnzimmer wurde, und warum die Extremsportlerin nicht zu stoppen ist.","https://images.bild.de/68bec438bcda9d4ab9560cf5/23f74ea15ae4e6065b816313d7642fb1,333e9eb5?w=1280",2025-10-03T12:41:58Z,,"Heidelberg (Baden-Württemberg) 42,195 Kilometer, ein Marathon? Ein Klacks. Wo sich andere Läufer japsend ins Ziel werfen, beginnt für Tanja Braun erst der Spaß. Und das nicht auf asphaltierten Straße… [+5499 chars]",,de,'Hitze'
https://fm4.orf.at/stories/3050003/,https://fm4.orf.at/stories/3050003/,0,fm4.orf.at,In „Star Birds“ helfen wir Vögeln im All beim Rohstoffabbau,"Buntes Federvieh bricht in den Weltraum auf, benötigt dafür aber immer delikatere Materialien, Elemente und Werkstoffe. Wir helfen ihnen dabei, viele Förderstationen und Raffinierien auf Asteroiden zu bauen. Auf diese Weise geht es noch tiefer hinein ins All.",https://tubestatic.orf.at/static/images/site/tube/20251040/star1.6034064.jpg,2025-10-03T13:00:00Z,,"Buntes Federvieh bricht in den Weltraum auf, benötigt dafür aber immer delikatere Materialien, Elemente und Werkstoffe. Wir helfen ihnen dabei, viele Förderstationen und Raffinierien auf Asteroiden z… [+3166 chars]",,de,'Vögel'
https://www.bild.de/sport/mehr-sport/formel-1-hitze-alarm-bei-singapur-gp-weltverband-fia-greift-durch-68dfa8dd2e775723b4b3cc5d,https://www.bild.de/sport/mehr-sport/formel-1-hitze-alarm-bei-singapur-gp-weltverband-fia-greift-durch-68dfa8dd2e775723b4b3cc5d,0,www.bild.de,Weltverband ergreift Maßnahmen - Hitze-Alarm in der Formel 1,"Beim Singapur-Rennen wird es in den Cockpits bis zu 60 Grad heiß. Um die Fahrer zu schützen, hat die Fia jetzt verpflichtende Vorkehrungen getroffen.","https://images.bild.de/68dfa8dd2e775723b4b3cc5d/a17d724034ded341995325e90e3d777f,fc38bd4b?w=1280",2025-10-03T13:20:18Z,,"Novum in der Formel 1!
Noch bevor ein Kilometer beim Großen Preis von Singapur (Sonntag, 14 Uhr, Sky) gefahren wurde, steht bereits fest: Das Rennen im Insel- und Stadtstaat wird für die 20 Piloten … [+2052 chars]",,de,'Hitze'
https://www.stern.de/panorama/wetter/extremwetter-in-deutschland--kurze-geschichte-in-grafiken-36067056.html,https://www.stern.de/panorama/wetter/extremwetter-in-deutschland--kurze-geschichte-in-grafiken-36067056.html,0,www.stern.de,"Hitze, Dürren, Starkregen: Eine kurze Geschichte des Extremwetters in Deutschland",Deutschland erhitzt sich doppelt so schnell wie der Rest der Welt. Woran liegt das? Und was bedeutet das für uns? Ein Blick auf über 100 Jahre deutsche Wettergeschichte.,https://image.stern.de/36079846/t/QD/v7/w1440/r1.7778/-/extremwetter-6.jpg,2025-10-03T17:39:00Z,,"Kopiere den aktuellen Link
Zur Merkliste hinzufügen
Deutschland erhitzt sich doppelt so schnell wie der Rest der Welt. Woran liegt das? Und was bedeutet das für uns? Ein Blick auf über 100 Jahre de… [+12786 chars]",,de,'Hitze'
https://www.tagesspiegel.de/gesellschaft/panorama/boen-von-bis-zu-100-kilometern-pro-stunde-sturmtief-fegte-uber-deutschland--regen-und-schnee-folgen-14466269.html,https://www.tagesspiegel.de/gesellschaft/panorama/boen-von-bis-zu-100-kilometern-pro-stunde-sturmtief-fegte-uber-deutschland--regen-und-schnee-folgen-14466269.html,0,www.tagesspiegel.de,Böen von bis zu 100 Kilometern pro Stunde: Sturmtief fegte über Deutschland – Regen und Schnee folgen,Nach dem stürmischen Wetter am Wochenende bleibt es in der neuen Woche zunächst ungemütlich in Deutschland. Neben Regen erwartet der Wetterdienst in den Alpen auch Neuschnee.,https://www.tagesspiegel.de/images/14477975/alternates/BASE_16_9_W1400/1759724659000/norderney.jpeg,2025-10-04T07:22:56Z,,"Das Sturmtief über Deutschland zieht allmählich ab vielerorts aber wird es zum Wochenstart regnerisch und stark bewölkt bleiben. An der Ostsee könne es heute Vormittag sogar noch stürmen, im Laufe de… [+5308 chars]",,de,'Schnee'
https://www.zeit.de/news/2025-10/04/trainingsbester-verstappen-schimpft-ueber-hitze-regel,https://www.zeit.de/news/2025-10/04/trainingsbester-verstappen-schimpft-ueber-hitze-regel,0,www.zeit.de,Formel 1: Trainingsbester Verstappen schimpft über Hitze-Regel,Hier finden Sie Informationen zu dem Thema „Formel 1“. Lesen Sie jetzt „Trainingsbester Verstappen schimpft über Hitze-Regel“.,https://img.zeit.de/news/2025-10/04/trainingsbester-verstappen-schimpft-ueber-hitze-regel-image-group/wide__1300x731,2025-10-04T10:43:23Z,,Titelverteidiger Max Verstappen ist nach seinem jüngsten Siegeszug auch vor dem Formel-1-Nachtrennen in Singapur in Bestform. Der Red-Bull-Pilot holte sich im Abschlusstraining für den Grand Prix am … [+2142 chars],,de,'Hitze'
https://www.stern.de/gesellschaft/regional/hessen/wenn-im-herbst-das-laub-faellt--hessens-staedte-setzen-zunehmend-auf-leisere-akku-laubblaeser-36105548.html,https://www.stern.de/gesellschaft/regional/hessen/wenn-im-herbst-das-laub-faellt--hessens-staedte-setzen-zunehmend-auf-leisere-akku-laubblaeser-36105548.html,0,www.stern.de,Wenn im Herbst das Laub fällt: Hessens Städte setzen zunehmend auf leisere Akku-Laubbläser,"Laubbläser oder Besen? Zwischen sauberen Gehwegen, Tierschutz und Lärmminderung gehen die Städte neue Wege. Was dabei auf der Strecke bleibt, erklärt der Nabu.",https://image.stern.de/36105550/t/nX/v1/w1440/r1.7778/-/05--oedewxtznpv9axs2048jpeg---b9043e9f7767937d.jpg,2025-10-05T02:00:14Z,,"Kopiere den aktuellen Link
Zur Merkliste hinzufügen
Laubbläser oder Besen? Zwischen sauberen Gehwegen, Tierschutz und Lärmminderung gehen die Städte neue Wege. Was dabei auf der Strecke bleibt, erk… [+6522 chars]",,de,'Igel'
https://www.stern.de/gesellschaft/regional/bayern/wetterausblick--stuermische-nacht-in-bayern---herbstliches-wetter-36105736.html,https://www.stern.de/gesellschaft/regional/bayern/wetterausblick--stuermische-nacht-in-bayern---herbstliches-wetter-36105736.html,0,www.stern.de,Wetterausblick: Stürmische Nacht in Bayern – herbstliches Wetter,"Nach einer windigen Nacht in Bayern bleibt das Wetter herbstlich. Der Wetterdienst erwartet stürmische Böen, Regen und erste Schneeflocken. Wie das Wetter zum Wochenstart wird.",https://image.stern.de/36105738/t/by/v1/w1440/r1.7778/-/05--5pqd3pu2arv7axs2048jpeg---41f9bc69efee2acf.jpg,2025-10-05T06:27:25Z,,"Kopiere den aktuellen Link
Zur Merkliste hinzufügen
Nach einer windigen Nacht in Bayern bleibt das Wetter herbstlich. Der Wetterdienst erwartet stürmische Böen, Regen und erste Schneeflocken. Wie d… [+1787 chars]",,de,'Schnee'
https://www.zeit.de/news/2025-10/05/sturmtief-laesst-zum-wochenbeginn-nach-schnee-in-den-alpen,https://www.zeit.de/news/2025-10/05/sturmtief-laesst-zum-wochenbeginn-nach-schnee-in-den-alpen,0,www.zeit.de,Wetter: Sturmtief lässt zum Wochenbeginn nach – Schnee in den Alpen,Hier finden Sie Informationen zu dem Thema „Wetter“. Lesen Sie jetzt „Sturmtief lässt zum Wochenbeginn nach – Schnee in den Alpen“.,https://img.zeit.de/news/2025-10/05/sturmtief-laesst-zum-wochenbeginn-nach-schnee-in-den-alpen-image-group/wide__1300x731,2025-10-05T09:59:26Z,,Nach einem stürmischen Wochenende startet auch die neue Woche mit nasskaltem und stürmischem Herbstwetter. Am Sonntag zieht das Sturmtief Detlef laut dem Deutschen Wetterdienst (DWD) über Dänemark hi… [+1902 chars],,de,'Schnee'
https://www.stern.de/panorama/wetter--sturmtief-laesst-zum-wochenbeginn-nach---schnee-in-den-alpen-36106102.html,https://www.stern.de/panorama/wetter--sturmtief-laesst-zum-wochenbeginn-nach---schnee-in-den-alpen-36106102.html,0,www.stern.de,Wetter: Sturmtief lässt zum Wochenbeginn nach – Schnee in den Alpen,"Sturmtief ""Detlef"" lässt nach, doch Regen und Wind bleiben. Im Alpenraum fällt Schnee, während im Westen und Südwesten die Wolken langsam auflockern.",https://image.stern.de/36106104/t/K2/v1/w1440/r1.7778/-/05--u5tnrb2xtiv5axs2048jpeg---0b74fe23a53c5da2.jpg,2025-10-05T09:59:26Z,,"Kopiere den aktuellen Link
Zur Merkliste hinzufügen
Sturmtief ""Detlef"" lässt nach, doch Regen und Wind bleiben. Im Alpenraum fällt Schnee, während im Westen und Südwesten die Wolken langsam auflock… [+2067 chars]",,de,'Schnee'
https://www.tagesspiegel.de/gesellschaft/panorama/wetter-sturmtief-lasst-zum-wochenbeginn-nach--schnee-in-den-alpen-14473085.html,https://www.tagesspiegel.de/gesellschaft/panorama/wetter-sturmtief-lasst-zum-wochenbeginn-nach--schnee-in-den-alpen-14473085.html,0,www.tagesspiegel.de,Wetter: Sturmtief lässt zum Wochenbeginn nach – Schnee in den Alpen,"Sturmtief „Detlef“ lässt nach, doch Regen und Wind bleiben. Im Alpenraum fällt Schnee, während im Westen und Südwesten die Wolken langsam auflockern.",https://www.tagesspiegel.de/images/14473082/alternates/BASE_16_9_W1400/1759658438000/wetter-in-hamburg.jpeg,2025-10-05T10:00:38Z,,Nach einem stürmischen Wochenende startet auch die neue Woche mit nasskaltem und stürmischem Herbstwetter. Am Sonntag zieht das Sturmtief Detlef laut dem Deutschen Wetterdienst (DWD) über Dänemark hi… [+1954 chars],,de,'Regen'
https://www.stern.de/gesellschaft/regional/bayern/wetterausblick--herbstwetter-mit-wolken-und-regen---schnee-in-hochlagen-36105736.html,https://www.stern.de/gesellschaft/regional/bayern/wetterausblick--herbstwetter-mit-wolken-und-regen---schnee-in-hochlagen-36105736.html,0,www.stern.de,Wetterausblick: Herbstwetter mit Wolken und Regen – Schnee in Hochlagen,"Wind, Regen, erste Schneeflocken: Wer in Bayern draußen unterwegs ist, sollte wetterfest sein – und auf den Straßen aufpassen. Was der Wetterdienst zur neuen Woche sagt.",https://image.stern.de/36106172/t/29/v1/w1440/r1.7778/-/05--xztfunycsnv4axs2048jpeg---10e67c437acf5712.jpg,2025-10-05T10:36:56Z,,"Kopiere den aktuellen Link
Zur Merkliste hinzufügen
Wind, Regen, erste Schneeflocken: Wer in Bayern draußen unterwegs ist, sollte wetterfest sein und auf den Straßen aufpassen. Was der Wetterdienst… [+2182 chars]",,de,'Schnee'
https://www.sueddeutsche.de/bayern/bayern-herbstwetter-regen-erster-schnee-li.3321799,https://www.sueddeutsche.de/bayern/bayern-herbstwetter-regen-erster-schnee-li.3321799,0,www.sueddeutsche.de,Erster Schnee in den Alpen erwartet: Herbstwetter bringt Wolken und Regen,"Wind, Regen, erste Schneeflocken: Wer in Bayern draußen unterwegs ist, sollte wetterfest sein – und auf den Straßen aufpassen.",https://www.sueddeutsche.de/2025/10/05/c3a4fe8e-4017-471c-a723-63cf33b31565.jpg?q=60&fm=webp&width=1200&rect=0%2C209%2C4000%2C2250,2025-10-05T11:02:01Z,,Am Montag liegen die Höchsttemperaturen bei 9 Grad am Oberpfälzer und Bayerischen Wald sowie Alpenrand und 15 Grad an der Donau. Bis Montag treten laut DWD in den Kammlagen der Mittelgebirge und auf … [+1519 chars],,de,'Regen'
https://www.bild.de/news/orkantief-detlef-fegt-ueber-deutschland-sturmflut-und-schneeflocken-68e2106c89973cba61e81cd9,https://www.bild.de/news/orkantief-detlef-fegt-ueber-deutschland-sturmflut-und-schneeflocken-68e2106c89973cba61e81cd9,0,www.bild.de,"Sturmflut, Nebel, Verletzte - Orkantief Detlef fegt über Deutschland!","Orkantief „Detlef“ bringt stürmisches Wetter, Regen und Nebel. Harz und Nordseeinseln betroffen. In Bayern fällt der erste Schnee","https://images.bild.de/68e2106c89973cba61e81cd9/ff997bf102d5778e98b01861689ab8ba,30660f0e?w=1280",2025-10-05T11:28:39Z,,"Windiger Herbst statt goldener Oktober! Orkantief Detlef hat am Wochenende große Teile des Landes fest im Griff mit Regen, Nebel und Sturmböen. Vom Brocken bis zum Schwarzwald fegt der Wind mit volle… [+4356 chars]",,de,'Schnee'
https://www.stern.de/panorama/weltgeschehen/mount-everest--schneesturm-schliesst-fast-1000-bergsteiger-ein-36106414.html,https://www.stern.de/panorama/weltgeschehen/mount-everest--schneesturm-schliesst-fast-1000-bergsteiger-ein-36106414.html,0,www.stern.de,Medienberichte: Schneesturm schließt fast 1000 Bergsteiger am Mount Everest ein,Seit Freitag fällt am Mount Everest Schnee. Das sorgt laut chinesischen Staatsmedien bei hunderten Bergsteigern in über 4900 Metern Höhe für ein großes Problem.,https://image.stern.de/36106426/t/te/v2/w1440/r1.7778/-/mount-everest.jpg,2025-10-05T13:22:00Z,,"Kopiere den aktuellen Link
Zur Merkliste hinzufügen
Seit Freitag fällt am Mount Everest Schnee. Das sorgt laut chinesischen Staatsmedien bei hunderten Bergsteigern in über 4900 Metern Höhe für ein … [+981 chars]",,de,'Schnee'
https://www.stern.de/wetter--sturm-laesst-nach--dann-kommen-regen-und-schnee-36106536.html,https://www.stern.de/wetter--sturm-laesst-nach--dann-kommen-regen-und-schnee-36106536.html,0,www.stern.de,Wetter in Deutschland: Nach dem Sturm kommen Regen und erster Schnee,Der Sturm über Norddeutschland verliert am Montag an Kraft. Danach erwarten Teile von Deutschland nasses Wetter – und in den Alpen sogar bis zu 20 Zentimeter Schnee.,https://image.stern.de/36106556/t/LB/v1/w1440/r1.7778/-/wetter-deutschland-sturm-nordsee.jpg,2025-10-05T14:09:00Z,,"Kopiere den aktuellen Link
Zur Merkliste hinzufügen
Der Sturm über Norddeutschland verliert am Montag an Kraft. Danach erwarten Teile von Deutschland nasses Wetter und in den Alpen sogar bis zu 20 … [+2036 chars]",,de,'Schnee'
https://www.tagesspiegel.de/gesellschaft/panorama/schneesturm-hunderte-wanderer-am-mount-everest-aus-schneesturm-gerettet-14477714.html,https://www.tagesspiegel.de/gesellschaft/panorama/schneesturm-hunderte-wanderer-am-mount-everest-aus-schneesturm-gerettet-14477714.html,0,www.tagesspiegel.de,Schneesturm: Hunderte Wanderer am Mount Everest aus Schneesturm gerettet,Sie wollten in den Ferien die Berge genießen - doch dann kam der Schnee: Ein heftiger Sturm hat auf der tibetischen Seite des Mount Everest Hunderte Wanderer eingeschlossen.,https://www.tagesspiegel.de/images/14480405/alternates/BASE_16_9_W1400/1759738748000/himalaya-gebirge.jpeg,2025-10-06T00:51:20Z,,"Was als Wanderurlaub begann, endete im Schneechaos: Nach einem plötzlichen Schneesturm auf der tibetischen Seite des Mount Everest sind mindestens 350 Touristen von Rettungskräften in Sicherheit gebr… [+3289 chars]",,de,'Schnee'
https://www.welt.de/vermischtes/article68e3421289973cba61e829f0/hochwasser-sturmtief-zieht-ab-jetzt-folgen-dauerregen-und-schnee.html,https://www.welt.de/vermischtes/article68e3421289973cba61e829f0/hochwasser-sturmtief-zieht-ab-jetzt-folgen-dauerregen-und-schnee.html,0,www.welt.de,Sturmtief zieht ab – Jetzt folgen Dauerregen und Schnee,"Stürmisches Wetter hat am Wochenende für Verkehrsbehinderungen und Fährausfälle gesorgt. Es gab Verletzte, in Hamburg wurde der Fischmarkt überflutet. Für die neue Woche prognostiziert der Wetterdienst neben Dauerregen in den Alpen auch Neuschnee.",https://images.welt.de/68e3421289973cba61e829f0/be41d097bd9354f5d3f430295a910f26-master/ci16x9-w1200/sturm-an-der-ostsee,2025-10-06T04:28:02Z,,"Stürmisches Wetter hat am Wochenende für Verkehrsbehinderungen und Fährausfälle gesorgt. Es gab Verletzte, in Hamburg wurde der Fischmarkt überflutet. Für die neue Woche prognostiziert der Wetterdien… [+4311 chars]",,de,'Schnee'
https://www.zeit.de/gesellschaft/2025-10/bergsteigen-mount-everest-schneesturm-rettung,https://www.zeit.de/gesellschaft/2025-10/bergsteigen-mount-everest-schneesturm-rettung,0,www.zeit.de,Bergsteigen: Bergungstrupps retten Hunderte Touristen vom Mount Everest,Am Mount Everest sind am Wochenende fast 1.000 Bergsteiger in einen Blizzard geraten. Etwa 350 Menschen wurden bislang aus dem Schneesturm gerettet.,https://img.zeit.de/gesellschaft/2025-10/mindestens-350-touristen-von-mount-everest-gerettet-bild/wide__1300x731,2025-10-06T05:14:55Z,,Nach einem Schneesturm auf der tibetischen Seite des Mount Everest sind mindestens 350 Menschen von Bergungstrupps gerettet worden. Die Menschen seien sicher in die nächstgelegene Ortschaft Qudang ge… [+1242 chars],,de,'Schnee'
https://www.dw.com/de/350-kletterer-am-mount-everest-gerettet/a-74247243,https://www.dw.com/de/350-kletterer-am-mount-everest-gerettet/a-74247243,0,www.dw.com,350 Kletterer am Mount Everest gerettet,"Ein Schneesturm hatte eine große Gruppe Berg-Touristen auf 4.900 Metern Höhe festgehalten. Möglicherweise befinden sich immer noch mehrere hundert Personen auf dem Berg. Auch Nachbarland Nepal ist betroffen. Mindestens 350 Touristen, die nach einem Schneestur…",https://static.dw.com/image/74247274_6.jpg,2025-10-06T07:49:00Z,,"Mindestens 350 Touristen, die nach einem Schneesturm auf der tibetischen Seite des Mount Everest festsaßen, sind von Bergungstrupps gerettet worden. Die Menschen wurden sicher in die nächstgelegene O… [+1751 chars]",,de,'Schnee'
https://www.stern.de/panorama/weltgeschehen/mount-everest--eingeschlossene-bergsteiger-filmen-heftigen-schneesturm-36107570.html,https://www.stern.de/panorama/weltgeschehen/mount-everest--eingeschlossene-bergsteiger-filmen-heftigen-schneesturm-36107570.html,0,www.stern.de,Dramatische Rettung: Eingeschlossene Bergsteiger filmen Schneesturm auf Mount Everest,Heftiger Regen und Schnee treffen die Everest-Region. Fast 1000 Menschen sitzen auf 4900 Metern fest. Videos zeigen das extreme Wetter am höchsten Berg der Welt.,https://image.stern.de/36107978/t/ye/v2/w1440/r1.7778/-/bergsteiger.jpg,2025-10-06T11:20:00Z,,"Zugang zu stern+statt 11,96 
 nur 1  
<ul><li>Alles von stern+ mit erstklassigen Inhalten von GEO und Capital</li><li>4 Wochen testen, dann 2,99  je Woche</li><li>jederzeit kündbar</li></ul>",,de,'Regen'
https://www.tagesspiegel.de/berlin/bergrettung-wanderer-nach-nacht-im-gebirge-gerettet-14484908.html,https://www.tagesspiegel.de/berlin/bergrettung-wanderer-nach-nacht-im-gebirge-gerettet-14484908.html,0,www.tagesspiegel.de,Bergrettung: Wanderer nach Nacht im Gebirge gerettet,Ein Wanderer verirrt sich im Gebirge und muss bei Schnee und Kälte die Nacht draußen verbringen. Wie die Bergwacht ihn trotz schwieriger Bedingungen rettete.,https://www.tagesspiegel.de/images/14484905/alternates/BASE_16_9_W1400/1759754729000/bergwacht-ubt-rettung-mit-hubschrauber.jpeg,2025-10-06T12:45:30Z,,"Die Bergwacht hat einen Wanderer aus Berlin gerettet, der sich verirrt hatte und die Nacht in den Bergen verbringen musste. Der 40-Jährige kam nach der Rettung am Reinersberg in den Berchtesgadener A… [+858 chars]",,de,'Schnee'
https://www.nzz.ch/panorama/berichte-ueber-ersten-todesfall-nach-einem-schneesturm-warten-hunderte-wanderer-am-mount-everest-auf-rettung-ld.1905721,https://www.nzz.ch/panorama/berichte-ueber-ersten-todesfall-nach-einem-schneesturm-warten-hunderte-wanderer-am-mount-everest-auf-rettung-ld.1905721,0,www.nzz.ch,Berichte über ersten Todesfall: Nach einem Schneesturm warten Hunderte Wanderer am Mount Everest auf Rettung,Am vergangenen Freitag kam es am Himalaja-Gebirge zu einem fatalen Wetterumschwung.,"https://img.nzz.ch/2025/10/06/b2e7b041-1cfd-4a37-8aae-8fb7097622c1.jpg?width=1200&height=675&fit=bounds&quality=75&auto=webp&crop=3406,1916,x0,y0&wmark=nzz",2025-10-06T13:20:29Z,,"Am vergangenen Freitag kam es am Himalaja-Gebirge zu einem fatalen Wetterumschwung.
Renato Schatz06.10.2025, 15.20 Uhr
Wanderer kämpfen sich am 5. Oktober durch den Schnee.
Geshuang Chen via Reute… [+4486 chars]",,de,'Schnee'
https://www.morgenpost.de/panorama/article410165564/verirrt-in-den-alpen-berliner-ueberlebt-bitterkalte-nacht.html,https://www.morgenpost.de/panorama/article410165564/verirrt-in-den-alpen-berliner-ueberlebt-bitterkalte-nacht.html,0,www.morgenpost.de,Verirrt in den Alpen – Berliner überlebt bitterkalte Nacht,Ein verirrter Wanderer aus Berlin musste bei Schnee und Kälte die Nacht im Freien verbringen. Die Rettung gestaltete sich schwierig.,https://img.sparknews.funkemedien.de/410165558/410165558_1759755818_v16_9_1600.jpeg,2025-10-06T13:39:35Z,,"Dieser abenteuerliche Ausflug hat zum Glück noch ein gutes Ende genommen: Die Bergwacht hat einen Wanderer aus Berlin gerettet, der sich verirrt hatte und die Nacht in den Bergen verbringen musste. D… [+1031 chars]",,de,'Schnee'
https://www.faz.net/aktuell/rhein-main/frankfurt/frankfurter-stadionbad-koennte-eine-traglufthalle-bekommen-110719325.html,https://www.faz.net/aktuell/rhein-main/frankfurt/frankfurter-stadionbad-koennte-eine-traglufthalle-bekommen-110719325.html,0,www.faz.net,Frankfurter Bäder: Auch das Stadionbad könnte eine Traglufthalle bekommen,Frankfurt plant offenkundig eine weitere Traglufthalle für ein Freibad: Ein Hallenbadprovisorium für den Süden der Stadt wäre gemäß Studie für zwölf Millionen Euro möglich.,https://media0.faz.net/ppmedia/w1200/aktuell/596929704/1.10719324/facebook_teaser/besonderes-ambiente-so-wie.jpg.webp,2025-10-06T17:48:22Z,,In Nieder-Eschbach ist am vergangenen Wochenende das erste der derzeit drei Frankfurter Hallenbadprovisorien wieder eröffnet worden. Die Schwimmer in der Stadt wissen das zu schätzen: Schon am ersten… [+4051 chars],,de,'Freibad'
https://www.welt.de/vermischtes/weltgeschehen/article68e400c222e6e824fc75dd91/schneesturm-ueberrascht-hunderte-wanderer-am-mount-everest-ein-toter.html,https://www.welt.de/vermischtes/weltgeschehen/article68e400c222e6e824fc75dd91/schneesturm-ueberrascht-hunderte-wanderer-am-mount-everest-ein-toter.html,0,www.welt.de,"Schneesturm überrascht Wanderer am Mount Everest – ein Toter, Hunderte warten auf Rettung",Hunderte Wanderer sind auf der tibetischen Seite des Mount Everest von heftigem Schneefall überrascht und eingeschlossen worden. Rettungskräfte kämpfen in über 4900 Metern Höhe gegen Kälte und Schneemassen – während in einer anderen Region ein Wanderer stirbt.,https://images.welt.de/68e400c222e6e824fc75dd91/47d226957f46c5e0a49448585d1e52ba/ci16x9-w1200/kletterer-am-mount-everest-durch-schneefall-eingeschlossen,2025-10-06T19:16:31Z,,Hunderte Wanderer sind auf der tibetischen Seite des Mount Everest von heftigem Schneefall überrascht und eingeschlossen worden. Rettungskräfte kämpfen in über 4900 Metern Höhe gegen Kälte und Schnee… [+2637 chars],,de,'Schnee'
https://www.zeit.de/news/2025-10/07/regen-truebt-bilanz-einiger-freizeitparks,https://www.zeit.de/news/2025-10/07/regen-truebt-bilanz-einiger-freizeitparks,0,www.zeit.de,Regen in den Sommerferien: Regen trübt Bilanz einiger Freizeitparks,Hier finden Sie Informationen zu dem Thema „Regen in den Sommerferien“. Lesen Sie jetzt „Regen trübt Bilanz einiger Freizeitparks“.,https://img.zeit.de/news/2025-10/07/regen-truebt-bilanz-einiger-freizeitparks-image-group/wide__1300x731,2025-10-07T02:00:32Z,,"Die Freizeit- und Erlebnisparks in Sachsen-Anhalt haben eine gemischte Bilanz der Sommersaison gezogen. Während mancherorts kaum Veränderungen zu den Vorjahren zu verzeichnen waren, trübte der Regen … [+2982 chars]",,de,'Regen'
https://www.stern.de/gesellschaft/regional/bayern/vorhersage--herbstwetter-in-bayern---wolken--regen-und-ein-wenig-sonne-36110280.html,https://www.stern.de/gesellschaft/regional/bayern/vorhersage--herbstwetter-in-bayern---wolken--regen-und-ein-wenig-sonne-36110280.html,0,www.stern.de,"Vorhersage: Herbstwetter in Bayern - Wolken, Regen und ein wenig Sonne","Der Herbst bleibt vorerst grau: Im Hochgebirge fällt Schnee, im Südosten Regen. Wo es in den nächsten Tagen trocken bleibt und wann sich die Sonne zeigt.",https://image.stern.de/36110282/t/D1/v1/w1440/r1.7778/-/07--aqwvybyonuv4axs2048jpeg---a7cccd35ea1322a7.jpg,2025-10-07T04:26:05Z,,"Kopiere den aktuellen Link
Zur Merkliste hinzufügen
Der Herbst bleibt vorerst grau: Im Hochgebirge fällt Schnee, im Südosten Regen. Wo es in den nächsten Tagen trocken bleibt und wann sich die Sonn… [+1042 chars]",,de,'Regen'
https://vorarlberg.orf.at/stories/3324811/,https://vorarlberg.orf.at/stories/3324811/,0,vorarlberg.orf.at,„24 Stunden Igel-Klappe“ für schnelle Hilfe,Die Igelhilfe Leiblachtal hat nach langer Suche in Lochau ein neues Zuhause gefunden. In der neuen Igelstation wurde eine „24 Stunden Igel-Klappe“ gebaut. Dort können rund um die Uhr verletzte oder verwaiste Igel abgegeben werden.,https://ibs.orf.at/vbg?image=https%3A%2F%2Foekastatic.orf.at%2Fmims%2F2025%2F41%2F70%2Fcrops%2Fw%3D1200%2Ch%3D627%2Cq%3D75%2F2791233_master_1076670_igel2.jpg%3Fs%3D25d9224b04494558d3ae9d3196ca259622d22310,2025-10-07T10:36:01Z,,"Die Igelhilfe Leiblachtal war lange Zeit auf der Suche nach einer neuen Bleibe. Adele Domig, die federführend bei den Igelfreunden Leiblachtal ist, hat schon Anfang 2022 beim Salvatorkolleg in Hörbra… [+1235 chars]",,de,'Igel'
