index,url,valid,domain,title,description,image,published,archive,content,quote,language,keyword
https://www.zeit.de/news/2025-10/15/vater-laesst-baby-im-auto-in-praller-sonne-zurueck-prozess,https://www.zeit.de/news/2025-10/15/vater-laesst-baby-im-auto-in-praller-sonne-zurueck-prozess,0,www.zeit.de,Zurückgelassen: Vater lässt Baby im Auto in praller Sonne zurück - Prozess,Hier finden Sie Informationen zu dem Thema „Zurückgelassen“. Lesen Sie jetzt „Vater lässt Baby im Auto in praller Sonne zurück - Prozess“.,https://img.zeit.de/news/2025-10/15/vater-laesst-baby-im-auto-in-praller-sonne-zurueck-prozess-image-group/wide__1300x731,2025-10-15T01:30:08Z,,"Weil er sein Baby bei Sommerhitze in einem verschlossenen Auto zurückgelassen haben soll, steht ein Vater am Mittwoch vor dem Amtsgericht Würzburg (9.30 Uhr). Polizisten befreiten das schreiende und … [+1419 chars]",,de,'Hitze'
https://www.stern.de/familie/garten-winterfest-machen--so-schuetzen-sie-ihre-pflanzen-und-moebel-36132228.html,https://www.stern.de/familie/garten-winterfest-machen--so-schuetzen-sie-ihre-pflanzen-und-moebel-36132228.html,0,www.stern.de,"Kalte Jahreszeit: Den Garten winterfest machen: So überdauern Ihre Pflanzen Frost, Eis und Schnee","Nicht nur Pflanzen, sondern auch Gartenmöbel leiden im Winter. Wenn Sie im Frühjahr keine bösen Überraschungen erleben wollen, sollten Sie Ihren Garten zeitnah winterfest machen.",https://image.stern.de/9021216/t/I1/v6/w1440/r1.7778/-/garten-winterfest-machen-neu.jpg,2025-10-15T05:12:00Z,,"Kopiere den aktuellen Link
Zur Merkliste hinzufügen
Nicht nur Pflanzen, sondern auch Gartenmöbel leiden im Winter. Wenn Sie im Frühjahr keine bösen Überraschungen erleben wollen, sollten Sie Ihren … [+7831 chars]",,de,'Schnee'
https://www.stern.de/news/klimawandel--drastischer-co2-anstieg-in-der-atmosphaere---natur-im-stress-36133398.html,https://www.stern.de/news/klimawandel--drastischer-co2-anstieg-in-der-atmosphaere---natur-im-stress-36133398.html,0,www.stern.de,Klimawandel: Drastischer CO2-Anstieg in der Atmosphäre - Natur im Stress,Die WMO warnt: Die CO2-Konzentration in der Atmosphäre ist 2024 so stark gestiegen wie nie zuvor. Was das für unser Klima bedeutet – und warum laut WMO ein Teufelskreis droht.,https://image.stern.de/36134024/t/AV/v1/w1440/r1.7778/-/15--j4jn6jyx36v1axs2048jpeg---41db5fb52f6e65e2.jpg,2025-10-15T13:17:11Z,,"Kopiere den aktuellen Link
Zur Merkliste hinzufügen
Die WMO warnt: Die CO2-Konzentration in der Atmosphäre ist 2024 so stark gestiegen wie nie zuvor. Was das für unser Klima bedeutet und warum laut… [+4221 chars]",,de,'Natur'
https://www.golem.de/sonstiges/zustimmung/auswahl.html?from=https://www.golem.de/news/vorschau-albion-zeigt-das-raue-herz-von-anno-117-2510-201204.html&referer=https://t.co/b776082b6b,https://www.golem.de/sonstiges/zustimmung/auswahl.html?from=https://www.golem.de/news/vorschau-albion-zeigt-das-raue-herz-von-anno-117-2510-201204.html&referer=https://t.co/b776082b6b,0,www.golem.de,Vorschau: Albion zeigt das raue Herz von Anno 117,"Wir haben Anno 117 gespielt: Latinum glänzt im Wohlstand, Albion fordert mit Regen, Schlick und Widerstand - und zeigt, wie lebendig sich das neue Anno anfühlt. Ein Hands-on von Peter Steinlechner (Anno, Ubisoft)",,2025-10-16T16:00:01Z,,"Besuchen Sie Golem.de wie gewohnt mit Werbung und Tracking,
 indem Sie der Nutzung aller Cookies zustimmen.
 Details zum Tracking finden Sie im Privacy Center.
Skript wurde nicht geladen. Informat… [+607 chars]",,de,'Regen'
https://www.n-tv.de/ratgeber/So-werden-Laub-Aste-und-Co-richtig-entsorgt-article26093021.html,https://www.n-tv.de/ratgeber/So-werden-Laub-Aste-und-Co-richtig-entsorgt-article26093021.html,0,www.n-tv.de,"Gartenarbeit im Herbst: So werden Laub, Äste und Co. richtig entsorgt","Laub, Pflanzenreste, alte Blumentöpfe: Im Herbst fällt im Garten jede Menge Abfall an. Doch nicht alles darf in die gleiche Tonne. Eine Übersicht, wie Verpackungen, Blumenkästen und Gartenabfälle korrekt entsorgt werden.",https://www.n-tv.de/img/incoming/crop11389946/1891321522-cImg_16_9-w1200/Wer-den-ganzen-Gartenabfall-nicht-im-Auto-haben-mochte-leiht-sich-besser-einen-Anhanger.jpg,2025-10-18T17:00:42Z,,"Laub, Pflanzenreste, alte Blumentöpfe: Im Herbst fällt im Garten jede Menge Abfall an. Doch nicht alles darf in die gleiche Tonne. Eine Übersicht, wie Verpackungen, Blumenkästen und Gartenabfälle kor… [+3086 chars]",,de,'Laub'
https://www.bild.de/leben-wissen/die-haben-doch-einen-vogel-diesen-social-media-trend-checkt-keiner-68eea545d923a7ef7ba34666,https://www.bild.de/leben-wissen/die-haben-doch-einen-vogel-diesen-social-media-trend-checkt-keiner-68eea545d923a7ef7ba34666,0,www.bild.de,Die haben doch einen Vogel - Diesen Social-Media-Trend checkt keiner,"Sie schweben, wippen und zwitschern wie echte Vögel. Das Internet hat mal wieder einen neuen Trend!","https://images.bild.de/68eea545d923a7ef7ba34666/36ad2f9fb0c16f5fcd8cf31c75737179,d55379ce?w=1280",2025-10-18T20:13:23Z,,"Fame Fighting: Hier sehen Sie das Box-Event des Jahres jetzt live
Fame Fighting: Hier sehen Sie das Box-Event des Jahres jetzt live
Fame Fighting: Hier sehen Sie das Box-Event des Jahres jetzt live… [+468 chars]",,de,'Vögel'
https://www.zeit.de/news/2025-10/19/regen-und-wind-zum-wochenstart-in-nrw,https://www.zeit.de/news/2025-10/19/regen-und-wind-zum-wochenstart-in-nrw,0,www.zeit.de,Wettervorhersage: Regen und Wind zum Wochenstart in NRW,Hier finden Sie Informationen zu dem Thema „Wettervorhersage“. Lesen Sie jetzt „Regen und Wind zum Wochenstart in NRW“.,https://img.zeit.de/news/2025-10/19/regen-und-wind-zum-wochenstart-in-nrw-image-group/wide__1300x731,2025-10-19T06:13:38Z,,"Über Nordrhein-Westfalen nimmt die Bewölkung am Sonntag weiter zu. Nach Angaben des Deutschen Wetterdienstes (DWD) bleibt es tagsüber niederschlagsfrei, bei meist dichter Bewölkung. Die Temperaturen … [+1042 chars]",,de,'Regen'
https://www.appgefahren.de/rainviewer-bewaehrte-wetter-app-mit-komplett-ueberarbeiteten-live-aktivitaeten-388084.html,https://www.appgefahren.de/rainviewer-bewaehrte-wetter-app-mit-komplett-ueberarbeiteten-live-aktivitaeten-388084.html,0,www.appgefahren.de,RainViewer: Bewährte Wetter-App mit komplett überarbeiteten Live-Aktivitäten,"Die Wettervorhersage- und Regenradar-App RainViewer war bei uns im Blog schon mehrfach präsent. Die Anwendung konzentriert sich vornehmlich auf Niederschlagsinfos und -karten für die ganze Welt, bietet darüber hinaus aber auch stündliche und tägliche Wettervo…",https://www.appgefahren.de/wp-content/uploads/2021/07/rainviewer.jpg,2025-10-19T10:44:57Z,,"Die Wettervorhersage- und Regenradar-App RainViewer war bei uns im Blog schon mehrfach präsent. Die Anwendung konzentriert sich vornehmlich auf Niederschlagsinfos und -karten für die ganze Welt, biet… [+2658 chars]",,de,'Regen'
https://www.ibiza-heute.de/nach-dem-unwetter-die-prognose-fuer-die-kommende-woche/,https://www.ibiza-heute.de/nach-dem-unwetter-die-prognose-fuer-die-kommende-woche/,0,www.ibiza-heute.de,Nach dem Unwetter: Die Prognose für die kommende Woche,Die ausgetrockneten Böden und Grundwasserspeicher hatten ihre wahre Freude an den heftigen Regenfällen der zurückliegenden Wochen. Die Menschen auf der Insel lechzen hingegen wieder nach Sonne und blauen Himmel. Und beides sollen sie bekommen.  Nach zwei Woch…,https://www.ibiza-heute.de/wp-content/uploads/2025/10/Eivissa-Panorama-scaled.jpeg,2025-10-19T11:46:19Z,,Die ausgetrockneten Böden und Grundwasserspeicher hatten ihre wahre Freude an den heftigen Regenfällen der zurückliegenden Wochen. Die Menschen auf der Insel lechzen hingegen wieder nach Sonne und bl… [+420 chars],,de,'Sonne'
https://www.n-tv.de/panorama/Der-Herbst-dreht-auf-Ein-Orkantief-steht-an-article26106316.html,https://www.n-tv.de/panorama/Der-Herbst-dreht-auf-Ein-Orkantief-steht-an-article26106316.html,0,www.n-tv.de,Die Wetterwoche im Schnellcheck: Der Herbst dreht auf: Ein Orkantief steht an,"Wer frühmorgens raus muss, merkt es: Es ist kalt geworden – ohne Schal und Mütze geht man besser nicht aus dem Haus. Zum Wochenstart soll die Luft den Wetterexperten weiter abkühlen. Dann werden die Temperaturen etwas milder, doch es liegt was in der Luft.",https://www.n-tv.de/img/incoming/crop26106341/7641328544-cImg_16_9-w1200/550783487.jpg,2025-10-19T13:16:10Z,,"Wer frühmorgens raus muss, merkt es: Es ist kalt geworden  ohne Schal und Mütze geht man besser nicht aus dem Haus. Zum Wochenstart soll die Luft den Wetterexperten weiter abkühlen. Dann werden die T… [+2644 chars]",,de,'Temperaturen'
https://www.diepresse.com/20220576/auf-mildes-herbstwetter-folgt-ein-sturmtief-mit-regenschauern,https://www.diepresse.com/20220576/auf-mildes-herbstwetter-folgt-ein-sturmtief-mit-regenschauern,0,www.diepresse.com,Auf mildes Herbstwetter folgt ein Sturmtief mit Regenschauern,"Erst ist es teils föhnig und mild, es sind bis zu 20 Grad möglich. Ab der Wochenmitte muss man sich aber auf Regen und starken Wind einstellen.",https://img.diepresse.com/public/incoming/iyh32-kein-Titel/alternates/DPR_SOCIAL_NACHRICHTEN/kein%20Titel,2025-10-19T15:27:33Z,,"Erst ist es teils föhnig und mild, es sind bis zu 20 Grad möglich. Ab der Wochenmitte muss man sich aber auf Regen und starken Wind einstellen.
Die neue Woche beginnt in Österreich freundlich und mi… [+2445 chars]",,de,'Regen'
https://www.zeit.de/zeit-fuer-unternehmer/2025/03/betriebliche-klimaresilienz-unternehmensfuehrung-anpassung-foerderung,https://www.zeit.de/zeit-fuer-unternehmer/2025/03/betriebliche-klimaresilienz-unternehmensfuehrung-anpassung-foerderung,0,www.zeit.de,"Betriebliche Klimaresilienz: Ach, der zieht bestimmt vorbei","Hitzewellen und Stürme werden heftiger. Die Folgen des Klimawandels bedrohen Unternehmen. Es gibt Vorschläge, um Firmen zu helfen – doch kaum eine nimmt sie wahr.",https://img.zeit.de/zeit-fuer-unternehmer/2025/03/ach-der-zieht-bestimmt-vorbei-bild-2/wide__1300x731,2025-10-19T17:35:06Z,,"Den eigenen Betrieb, der schon einmal überschwemmt wurde, vor den Folgen des Klimawandels schützen? Klingt naheliegend, aber der Unternehmer aus dem Rheinland ist entrüstet: Allein die Frage sei schw… [+897 chars]",,de,'Regen'
https://www.zeit.de/news/2025-10/20/herbstwetter-in-hessen-zum-wochenstart-regen-und-gewitter,https://www.zeit.de/news/2025-10/20/herbstwetter-in-hessen-zum-wochenstart-regen-und-gewitter,0,www.zeit.de,Wetterprognose: Herbstwetter in Hessen: Zum Wochenstart Regen und Gewitter,Hier finden Sie Informationen zu dem Thema „Wetterprognose“. Lesen Sie jetzt „Herbstwetter in Hessen: Zum Wochenstart Regen und Gewitter“.,https://img.zeit.de/news/2025-10/20/herbstwetter-in-hessen-zum-wochenstart-regen-und-gewitter-image-group/wide__1300x731,2025-10-20T04:20:20Z,,"In Hessen startet die Woche wechselhaft und windig. Wie der Deutsche Wetterdienst (DWD) am Montag mitteilte, verdichtet sich die Bewölkung im Tagesverlauf, zeitweise kommt es zu Regen. Die Menschen i… [+877 chars]",,de,'Temperaturen'
https://www.stern.de/gesellschaft/regional/hessen/wetterprognose--herbstwetter-in-hessen--zum-wochenstart-regen-und-gewitter-36144624.html,https://www.stern.de/gesellschaft/regional/hessen/wetterprognose--herbstwetter-in-hessen--zum-wochenstart-regen-und-gewitter-36144624.html,0,www.stern.de,Wetterprognose: Herbstwetter in Hessen: Zum Wochenstart Regen und Gewitter,"Zum Start in die neue Woche zeigt sich das Wetter in Hessen unbeständig: Regen, Wind und einzelne Gewitter bestimmen zunächst das Geschehen. Erst zur Wochenmitte wird es etwas ruhiger.",https://image.stern.de/36144626/t/a9/v1/w1440/r1.7778/-/20--7xufjsgr4qv7axs2048jpeg---293b7a2ac93d7bdd.jpg,2025-10-20T04:20:20Z,,"Kopiere den aktuellen Link
Zur Merkliste hinzufügen
Zum Start in die neue Woche zeigt sich das Wetter in Hessen unbeständig: Regen, Wind und einzelne Gewitter bestimmen zunächst das Geschehen. Erst… [+1077 chars]",,de,'Temperaturen'
https://www.stern.de/gesellschaft/regional/bayern/wetter--viel-regen--wind-und-nur-kurze-sonnenpausen-in-bayern-36144634.html,https://www.stern.de/gesellschaft/regional/bayern/wetter--viel-regen--wind-und-nur-kurze-sonnenpausen-in-bayern-36144634.html,0,www.stern.de,"Wetter: Viel Regen, Wind und nur kurze Sonnenpausen in Bayern","Nur kurz blinzelt die Sonne hervor, sonst bestimmen Regen und Wind das herbstliche Wetter der nächsten Tage. Wo besonders viele Schauer erwartet werden und wo es zwischendurch trocken bleibt.",https://image.stern.de/36144636/t/c3/v1/w1440/r1.7778/-/20--3jgo5iiayxv6axs2048jpeg---1a32aa1c467d7eab.jpg,2025-10-20T04:27:48Z,,"Kopiere den aktuellen Link
Zur Merkliste hinzufügen
Nur kurz blinzelt die Sonne hervor, sonst bestimmen Regen und Wind das herbstliche Wetter der nächsten Tage. Wo besonders viele Schauer erwartet … [+1243 chars]",,de,'Regen'
https://www.zeit.de/news/2025-10/20/viel-regen-wind-und-nur-kurze-sonnenpausen-in-bayern,https://www.zeit.de/news/2025-10/20/viel-regen-wind-und-nur-kurze-sonnenpausen-in-bayern,0,www.zeit.de,"Wetter: Viel Regen, Wind und nur kurze Sonnenpausen in Bayern","Hier finden Sie Informationen zu dem Thema „Wetter“. Lesen Sie jetzt „Viel Regen, Wind und nur kurze Sonnenpausen in Bayern“.",https://img.zeit.de/news/2025-10/20/viel-regen-wind-und-nur-kurze-sonnenpausen-in-bayern-image-group/wide__1300x731,2025-10-20T04:27:48Z,,"Regen, Wind und nur kurze sonnige Abschnitte prägen das wechselhafte Wetter in Bayern. Ein Tief mit Zentrum bei den Britischen Inseln weitet seinen Einfluss laut dem Deutschen Wetterdienst (DWD) allm… [+1036 chars]",,de,'Regen'
https://www.stern.de/geo/wenn-voegel-geschenke-machen--faszinierendes-verhalten-in-der-tierwelt-36028322.html,https://www.stern.de/geo/wenn-voegel-geschenke-machen--faszinierendes-verhalten-in-der-tierwelt-36028322.html,0,www.stern.de,Schöne Bescherung: Wenn Vögel Geschenke machen: Faszinierendes Verhalten in der Tierwelt,"Auch Tiere machen Geschenke – allen voran Vogelmännchen. Zur Balz bezirzen sie Weibchen mit Gaben, von denen wir uns durchaus beflügeln lassen können.",https://image.stern.de/36041428/t/2u/v3/w1440/r1.7778/-/eisvoegel-2.jpg,2025-10-20T06:03:00Z,,Das Kindermagazin GEOlino gehört wie der stern zu RTL. Ausgewählte Inhalte können Sie auch auf stern.de und in der stern App sehen. Mehr von GEOlino finden Sie zum Beispiel unter stern.de/GEO,,de,'Vögel'
https://www.stern.de/gesellschaft/regional/berlin-brandenburg/tierseuche--taumelnde-wildgans-in-trebbin-weiterer-gefluegelpest-fall-36145416.html,https://www.stern.de/gesellschaft/regional/berlin-brandenburg/tierseuche--taumelnde-wildgans-in-trebbin-weiterer-gefluegelpest-fall-36145416.html,0,www.stern.de,Tierseuche: Taumelnde Wildgans in Trebbin weiterer Geflügelpest-Fall,Trebbin (bb) - Weiterer Fall der Geflügelpest in Brandenburg: Bei einer Wildgans im Trebbiner Ortsteil Glau (Kreis Teltow-Fläming) ist der für Vögel hoch,https://image.stern.de/36145418/t/qa/v1/w1440/r1.7778/-/20--67lyrmqo2gv14axs2048jpeg---ff65ef815c920ed6.jpg,2025-10-20T09:55:09Z,,"Kopiere den aktuellen Link
Zur Merkliste hinzufügen
Auch im Kreis Teltow-Fläming ist die Geflügelpest nachgewiesen worden - bei einer Wildgans. Das Veterinäramt rät zu besonderer Vorsicht.
Weitere… [+1591 chars]",,de,'Vögel'
https://www.zeit.de/news/2025-10/22/herbststurm-bringt-sturmboeen-und-regen-nach-deutschland,https://www.zeit.de/news/2025-10/22/herbststurm-bringt-sturmboeen-und-regen-nach-deutschland,0,www.zeit.de,Wetteraussichten: Herbststurm bringt Sturmböen und Regen nach Deutschland,Hier finden Sie Informationen zu dem Thema „Wetteraussichten“. Lesen Sie jetzt „Herbststurm bringt Sturmböen und Regen nach Deutschland“.,https://img.zeit.de/news/2025-10/22/herbststurm-bringt-sturmboeen-und-regen-nach-deutschland-image-group/wide__1300x731,2025-10-22T10:31:50Z,,Der erste stärkere Herbststurm zieht ab Donnerstag über Deutschland und wirbelt voraussichtlich bis zum Wochenende über weite Teile des Landes. «Dabei gibt es jede Menge Regen und sinkende Temperatur… [+2207 chars],,de,'Regen'
https://www.zeit.de/news/2025-10/22/vogelgrippe-was-verbraucher-und-naturfreunde-wissen-muessen,https://www.zeit.de/news/2025-10/22/vogelgrippe-was-verbraucher-und-naturfreunde-wissen-muessen,0,www.zeit.de,Vogelgrippe in Brandenburg: Vogelgrippe: Was Verbraucher und Naturfreunde wissen müssen,Hier finden Sie Informationen zu dem Thema „Vogelgrippe in Brandenburg“. Lesen Sie jetzt „Vogelgrippe: Was Verbraucher und Naturfreunde wissen müssen“.,https://img.zeit.de/news/2025-10/22/vogelgrippe-was-verbraucher-und-naturfreunde-wissen-muessen-image-group/wide__1300x731,2025-10-22T12:10:05Z,,"Wildvögel können das Vogelgrippe-Virus verbreiten. Die Bevölkerung wird gebeten, Fundorte toter Vögel den Veterinärbehörden zu melden, die Tiere aber nicht selbst anzufassen. Auch Haustiere sollen fe… [+2326 chars]",,de,'Natur'
https://www.stern.de/gesellschaft/regional/berlin-brandenburg/vogelgrippe-in-brandenburg--vogelgrippe--was-verbraucher-und-naturfreunde-wissen-muessen-36152898.html,https://www.stern.de/gesellschaft/regional/berlin-brandenburg/vogelgrippe-in-brandenburg--vogelgrippe--was-verbraucher-und-naturfreunde-wissen-muessen-36152898.html,0,www.stern.de,Vogelgrippe in Brandenburg: Vogelgrippe: Was Verbraucher und Naturfreunde wissen müssen,Wildvögel können die Vogelgrippe verbreiten. Der Verbraucher kann sich den Gänsebraten weiter schmecken lassen. Was gilt es für Naturfreunde zu beachten?,https://image.stern.de/36152900/t/9B/v1/w1440/r1.7778/-/22--nz7z72eftnv9axs2048jpeg---1801507c3320e07f.jpg,2025-10-22T12:10:05Z,,"Kopiere den aktuellen Link
Zur Merkliste hinzufügen
Wildvögel können die Vogelgrippe verbreiten. Der Verbraucher kann sich den Gänsebraten weiter schmecken lassen. Was gilt es für Naturfreunde zu b… [+2756 chars]",,de,'Temperaturen'
https://www.tagesspiegel.de/potsdam/brandenburg/vogelgrippe-in-brandenburg-vogelgrippe-was-verbraucher-und-naturfreunde-wissen-mussen-14631560.html,https://www.tagesspiegel.de/potsdam/brandenburg/vogelgrippe-in-brandenburg-vogelgrippe-was-verbraucher-und-naturfreunde-wissen-mussen-14631560.html,0,www.tagesspiegel.de,Vogelgrippe in Brandenburg: Vogelgrippe: Was Verbraucher und Naturfreunde wissen müssen,Wildvögel können die Vogelgrippe verbreiten. Der Verbraucher kann sich den Gänsebraten weiter schmecken lassen. Was Verbraucher und Naturfreunde wissen müssen.,https://www.tagesspiegel.de/images/14631557/alternates/BASE_16_9_W1400/1761135076000/weitere-entwicklung-bei-der-geflugelpest.jpeg,2025-10-22T12:11:17Z,,"Wildvögel können das Vogelgrippe-Virus verbreiten. Die Bevölkerung wird gebeten, Fundorte toter Vögel den Veterinärbehörden zu melden, die Tiere aber nicht selbst anzufassen. Auch Haustiere sollen fe… [+2848 chars]",,de,'Temperaturen'
https://www.stern.de/gesellschaft/regional/hessen/gefluegelpest--warnungen-vor-gefahr-der-vogelgrippe-in-hessen-36152920.html,https://www.stern.de/gesellschaft/regional/hessen/gefluegelpest--warnungen-vor-gefahr-der-vogelgrippe-in-hessen-36152920.html,0,www.stern.de,Geflügelpest: Warnungen vor Gefahr der Vogelgrippe in Hessen,Wetzlar (lhe) - Der Naturschutzbund Nabu in Hessen hat angesichts des Ausbruchs der Vogelgrippe unter Wildvögeln und Geflügel in Deutschland davor,https://image.stern.de/36152922/t/DN/v1/w1440/r1.7778/-/22--3lg6r4ixudv8axs2048jpeg---28e4fcd411490c3e.jpg,2025-10-22T12:14:53Z,,"Kopiere den aktuellen Link
Zur Merkliste hinzufügen
In anderen Bundesländern wurden bereits infizierte Wildvögel entdeckt. Auch Geflügelbetriebe sind betroffen. Wie hoch ist die Gefahr in Hessen?
… [+1958 chars]",,de,'Temperaturen'
https://www.tagesschau.de/inland/wetter-sturm-deutschland-100.html,https://www.tagesschau.de/inland/wetter-sturm-deutschland-100.html,0,www.tagesschau.de,Herbststurm fegt über Deutschland - Regen und Sturmböen erwartet,"Sturmböen, Regen und sinkende Temperaturen: Ein kräftiger Herbststurm fegt ab Donnerstag übers Land und sorgt für ungemütliches Wetter. Auch am Wochenende dürfte es kühl und nass werden - adé, goldener Herbst.",https://images.tagesschau.de/image/74471367-a591-4715-b975-0b8efc785620/AAABmgvUlTA/AAABmgWmh8Q/16x9-big/passanten-regenschirme-100.jpg?width=1280,2025-10-22T12:43:54Z,,"Stand: 22.10.2025 14:43 Uhr
Sturmböen, Regen und sinkende Temperaturen: Ein kräftiger Herbststurm fegt ab Donnerstag übers Land und sorgt für ungemütliches Wetter. Auch am Wochenende dürfte es kühl … [+1518 chars]",,de,'Temperaturen'
https://www.urlaubspiraten.de/pauschalreisen/malaga-citytrip,https://www.urlaubspiraten.de/pauschalreisen/malaga-citytrip,0,www.urlaubspiraten.de,Ab ins Warme: Citytrip nach Malaga ☀️,"In der Kürze liegt die Würze – deshalb ohne großes Geschwafel... Der Herbst ist grau und nass? Nicht in Andalusien!  Pack die Sonnenbrille ein und gönn dir eine kleine Auszeit in Málaga – der perfekten Mischung aus Stadt, Strand und spanischem Flair.Im …",https://image.urlaubspiraten.de/720/image/upload/v1720960615/mediavault_images/shutterstock_2277468265_duvfut.jpg,2025-10-22T13:33:00Z,,"Ab folgenden Flughäfen könnt ihr Malaga direkt erreichen
Ab/bis Münster: montags &amp; donnerstags
Ab/bis Frankfurt Hahn: montags, dienstags, mittwochs, donnerstags &amp; sonntags
Ab/bis Frankfurt… [+616 chars]",,de,'Sonne'
https://sport.orf.at/stories/3146996/,https://sport.orf.at/stories/3146996/,0,sport.orf.at,Rapid-Misere hält gegen Fiorentina an,Rapid rutscht immer weiter in die Krise. Nach der jüngsten Meisterschaftspleite gegen den LASK gab es für die Wiener auch am Donnerstag am zweiten Spieltag der Ligaphase der Conference League gegen die AC Fiorentina nichts zu holen. Bei strömendem Regen und S…,https://ibs.orf.at/sport?image=https%3A%2F%2Fassets.orf.at%2Fmims%2F2025%2F43%2F92%2Fcrops%2Fw%3D1200%2Ch%3D630%2Cq%3D75%2F2810397_master_1084592_fus_conference_league_rapid_fiorentina_match_g.jpg%3Fs%3Dac1c16ade37913228feb1de6ae1be22ed25f7ef8,2025-10-23T18:38:20Z,,Vor 24.641 Fans im Weststadion sorgte Cher Ndour unter Mithilfe von Rapid-Goalie Niklas Hedl für einen Traumstart aus Sicht der Italiener (9. Minute). Altstar Edin Dzeko brachte Fiorentina kurz nach … [+3360 chars],,de,'Regen'
https://www.bild.de/sport/fussball/conference-league-wetter-chaos-stoppt-sparta-prags-fussball-krimi-68fa8f96c008edcf0c851d7b,https://www.bild.de/sport/fussball/conference-league-wetter-chaos-stoppt-sparta-prags-fussball-krimi-68fa8f96c008edcf0c851d7b,0,www.bild.de,Ball blieb vor der Torlinie liegen - Europa-Spiel nach Wetter-Chaos abgebrochen!,Regen und Sturm führen zum Spielabbruch in Rijeka. Ein kurioses Fußballspiel endet nach zwei Stunden beim Stand von null zu null.,"https://images.bild.de/68fa8f96c008edcf0c851d7b/521bbf72a29fdda3f1cde1e73787985d,46ddaab9?w=1280",2025-10-23T21:04:35Z,,"Hier konnte kein Fußball gespielt werden!
Das Duell zwischen dem kroatischen Vertreter Rijeka und Sparta Prag in der Conference League musste am Donnerstag nach der 1. Halbzeit abgebrochen werden. … [+1516 chars]",,de,'Regen'
https://www.tagesspiegel.de/gesellschaft/panorama/sturm-joshua-fegt-uber-deutschland-uberschwemmungen-an-der-nordseekuste--schnee-im-erzgebirge-14646515.html,https://www.tagesspiegel.de/gesellschaft/panorama/sturm-joshua-fegt-uber-deutschland-uberschwemmungen-an-der-nordseekuste--schnee-im-erzgebirge-14646515.html,0,www.tagesspiegel.de,Sturm „Joshua“ fegt über Deutschland: Überschwemmungen an der Nordseeküste – Schnee im Erzgebirge,"Vom Norden bis in den Süden kämpfen Einsatzkräfte gegen die Folgen des Sturms. Ein 30-Jähriger wird verletzt, als ein Baum auf sein Auto kracht. Auch am Wochenende bleibt es stürmisch.",https://www.tagesspiegel.de/images/14656505/alternates/BASE_16_9_W1400/1761326984000/sturmtief-joshua-schleswig-holstein.jpeg,2025-10-24T01:50:14Z,,"Das Herbstturmtief Joshua hält die Feuerwehren in Deutschland auf Trab. Besonders aus Nordrhein-Westfalen wurden zahlreiche Einsätze wegen herabgefallener Äste oder umgestürzter Bäume gemeldet, aber … [+4410 chars]",,de,'Regen'
https://www.zeit.de/2025-10/sturm-nordseekueste-joshua-orkanboeen-wetterwarnung,https://www.zeit.de/2025-10/sturm-nordseekueste-joshua-orkanboeen-wetterwarnung,0,www.zeit.de,Sturm: Wetterdienst warnt vor Orkanböen an der Nordseeküste,Für den Morgen erwarten Meteorologen an der Nordseeküste viel Regen und Windgeschwindigkeiten von bis zu 120 Kilometern pro Stunde. Auch an der Ostsee wird es stürmisch.,https://img.zeit.de/2025-10/554385311-bild/wide__1300x731,2025-10-24T02:30:21Z,,Mit Windgeschwindigkeiten von bis zu 120 Kilometern pro Stunde und starkem Regen müssen die Menschen an der Nordseeküste am Morgen rechnen. In Böen soll das Sturmtief Joshua sogar Orkanstärke erreich… [+816 chars],,de,'Regen'
https://www.focus.de/panorama/welt/hier-scheint-im-winter-die-sonne-europas-top-destinationen-fuer-waermefans_e9a0d18d-671d-4ff7-8359-8acc51adc24f.html,https://www.focus.de/panorama/welt/hier-scheint-im-winter-die-sonne-europas-top-destinationen-fuer-waermefans_e9a0d18d-671d-4ff7-8359-8acc51adc24f.html,0,www.focus.de,Hier scheint im Winter die Sonne: Europas Top-Destinationen für Wärmefans,"Wer dem herbstlichen Wetter entfliehen möchte, muss dabei einen gar nicht so weiten Weg in Kauf nehmen, wie gedacht. Was sich innerhalb Europas anbietet.",https://quadro.burda-forward.de/ctf/18e4138c-4e92-4197-b383-e2fef2f12762.e64fd5ef-7154-4ce5-946c-2df14481c874.png?im=RegionOfInterestCrop%3D%281200%2C630%29%2CregionOfInterest%3D%281231%2C737%29&hash=ee32c62fc304a92f874df3bd5ba8bdd1258f23a1c92da6cc4bbd86ea9bcfaf93,2025-10-24T06:26:20Z,,"Während hierzulande die Blätter von den Bäumen rieseln, die Temperaturen fallen und Herbststürme aufkommen können gibt es in Europa Destinationen, die auch im Herbst und Winter milde Temperaturen ver… [+1784 chars]",,de,'Sonne'
