index,url,valid,domain,title,description,image,published,archive,content,quote,language,keyword
https://www.tagesspiegel.de/sport/bundesliga-kovac-betont-positiv-nach-regen-kommt-sonne-13252099.html,https://www.tagesspiegel.de/sport/bundesliga-kovac-betont-positiv-nach-regen-kommt-sonne-13252099.html,0,www.tagesspiegel.de,Bundesliga: Kovac betont positiv: „Nach Regen kommt Sonne“,Borussia Dortmund steckt in der Krise. Vor dem Spiel gegen Union Berlin spricht Trainer Kovac über die Wichtigkeit der Partie - und denkt dabei nicht in erster Linie an die Tabelle.,https://www.tagesspiegel.de/images/13252096/alternates/BASE_16_9_W1400/1740200603000/niko-kovac.jpeg,2025-02-22T05:03:24Z,,"Dortmunds Trainer Niko Kovac lässt sich seinen Optimismus nicht nehmen. Ich glaube immer daran: nach Regen kommt Sonne, sagte der 53-Jährige. Von den vergangenen sieben Bundesligaspielen hat der BVB … [+1356 chars]",,de,'Regen'
https://www.ibiza-heute.de/ab-mittag-startet-der-regen/,https://www.ibiza-heute.de/ab-mittag-startet-der-regen/,0,www.ibiza-heute.de,Ab Mittag startet der Regen…,"Natürlich benötigen Ibiza und Formentera jeden Tropfen Regen – aber muss das gerade am Wochenende sein? Ab heute Mittag, Samstag, […]
Der Beitrag Ab Mittag startet der Regen… erschien zuerst auf Ibiza Heute.",https://www.ibiza-heute.de/wp-content/uploads/2024/11/regen-siesta1-dunja-noack.jpg,2025-02-22T08:00:55Z,,"Dichte Wolken und Regen über dem Meer. Foto: Dunja Noack Natürlich benötigen Ibiza und Formentera jeden Tropfen Regen aber muss das gerade am Wochenende sein? Ab heute Mittag, Samstag, soll sich die … [+1000 chars]",,de,'Regen'
https://www.diepresse.com/19377716/sonnenskilauf-trifft-musikgenuss,https://www.diepresse.com/19377716/sonnenskilauf-trifft-musikgenuss,0,www.diepresse.com,Sonnenskilauf trifft Musikgenuss,Swing into Spring: Das Tanzcafé Arlberg Music Festival 2025 ist eine perfekte Mischung aus Sonnenskilauf und exklusiven Klängen.,https://img.diepresse.com/public/incoming/1g4lam-TanzcafeArlbergSimonRainer-29.jpg/alternates/DPR_SOCIAL_SPONSORED/TanzcafeArlbergSimonRainer%2029.jpg,2025-02-22T09:00:00Z,,"Swing into Spring: Das Tanzcafé Arlberg Music Festival 2025 ist eine perfekte Mischung aus Sonnenskilauf und exklusiven Klängen.
Erleben Sie den Arlberg in seiner schönsten Form mit Sonne, Schnee, S… [+1945 chars]",,de,'Sonne'
https://www.stern.de/gesellschaft/regional/nordrhein-westfalen/wetter--fruehlingshafter-wahl-sonntag-in-nrw---bis-zu-16-grad-35488704.html,https://www.stern.de/gesellschaft/regional/nordrhein-westfalen/wetter--fruehlingshafter-wahl-sonntag-in-nrw---bis-zu-16-grad-35488704.html,0,www.stern.de,Wetter: Frühlingshafter Wahl-Sonntag in NRW - bis zu 16 Grad,Essen (lnw) - Der Wahl-Sonntag wird in Nordrhein-Westfalen heiter und trocken mit frühlingshaften Temperaturen von bis zu 16 Grad. Dazu herrscht laut,https://image.stern.de/35488706/t/KF/v1/w1440/r1.7778/-/22--vaewup3uuiv28axs2048jpeg---6a19888804969d75.jpg,2025-02-22T09:14:15Z,https://web.archive.org/web/20250222094028/https://www.stern.de/gesellschaft/regional/nordrhein-westfalen/wetter--fruehlingshafter-wahl-sonntag-in-nrw---bis-zu-16-grad-35488704.html,"Kopiere den aktuellen Link
Zur Merkliste hinzufügen
Heiteres und trockenes Wetter erwartet die Wählerinnen und Wähler in NRW am Sonntag zum Gang an die Urne. Die Temperaturen sind frühlingshaft.
D… [+579 chars]",,de,'Sonne'
https://www.stern.de/gesellschaft/regional/bayern/wetter--leichter-regen-in-bayern-zum-wahlsonntag-35488966.html,https://www.stern.de/gesellschaft/regional/bayern/wetter--leichter-regen-in-bayern-zum-wahlsonntag-35488966.html,0,www.stern.de,Wetter: Leichter Regen in Bayern zum Wahlsonntag,"Nicht nur in der Kabine fällt die Wahl, schon vorher gibt es eine beim Kleiderschrank zu treffen. Nach der Wetterprognose des Deutschen Wetterdienstes lohnt sich ein Regenschirm im Gepäck.",https://image.stern.de/35488968/t/Zr/v1/w1440/r1.7778/-/22--6askdfzdyqv4axs2048jpeg---c195b93407633e43.jpg,2025-02-22T12:12:54Z,,"Kopiere den aktuellen Link
Zur Merkliste hinzufügen
Nicht nur in der Kabine fällt die Wahl, schon vorher gibt es eine beim Kleiderschrank zu treffen. Nach der Wetterprognose des Deutschen Wetterdie… [+722 chars]",,de,'Regen'
https://www.computerbase.de/news/in-eigener-sache/gemeinsam-geht-mehr-ein-appell-an-die-community-aus-aktuellem-anlass.91519/,https://www.computerbase.de/news/in-eigener-sache/gemeinsam-geht-mehr-ein-appell-an-die-community-aus-aktuellem-anlass.91519/,0,www.computerbase.de,Gemeinsam geht mehr: Ein Appell an die Community aus aktuellem Anlass,"Zum Jahreswechsel hatten Community-Admin Zensai und Jan in CB-Funk #98 am Mikrofon Platz genommen, ausführlicher über die Community gesprochen und den Fokus dabei auf das gemeinsame Miteinander gelegt. Zum Wahlwochenende wollen wir diese Episode noch einmal i…",https://pics.computerbase.de/1/1/6/2/2/1-41f0d4e5aa1b0e1e/article-1280x720.d53d5c0e.jpg,2025-02-22T12:37:00Z,https://web.archive.org/web/20250222142727/https://www.computerbase.de/news/in-eigener-sache/gemeinsam-geht-mehr-ein-appell-an-die-community-aus-aktuellem-anlass.91519/,"Zum Jahreswechsel hatten Community-Admin Zensai und Jan in CB-Funk #98 am Mikrofon Platz genommen, ausführlicher über die Community gesprochen und den Fokus dabei auf das gemeinsame Miteinander geleg… [+3012 chars]",,de,'Jahreswechsel'
https://www.urlaubspiraten.de/pauschalreisen/individuelle-kombi-reise-kappadokien-and-tuerkische-riviera,https://www.urlaubspiraten.de/pauschalreisen/individuelle-kombi-reise-kappadokien-and-tuerkische-riviera,0,www.urlaubspiraten.de,Kappadokien-Abenteuer meets Strandurlaub in Side ☀️,"Dein Sommerurlaub darf gern dem Motto ""Sonne, Strand & All Inclusive"" folgen, soll aber auch eine gewisse Portion Abenteuer mit sich bringen? Wie wäre es mit dieser einzigartigen Kombi aus Kappadokien & der Türkischen Riviera?✈️ Bei diesem Paket ist alles d…",https://image.urlaubspiraten.de/720/image/upload/v1740063539/Impressions%20and%20Other%20Assets/Design_ohne_Titel_ew134a.png,2025-02-22T13:30:00Z,https://web.archive.org/web/20250224213449/https://www.urlaubspiraten.de/pauschalreisen/individuelle-kombi-reise-kappadokien-and-tuerkische-riviera,"Wir nutzen Cookies, um deine Nutzererfahrung zu verbessern, dir persönlich auf dich zugeschnittene Inhalte liefern zu können und die Nutzung unserer App zu analysieren. Wenn du auf ""alle akzeptieren""… [+463 chars]",,de,'Sonne'
https://t3n.de/news/sonnensegler-satelliten-so-schuetzen-sie-uns-vor-geomagnetischen-stuermen-1673572/,https://t3n.de/news/sonnensegler-satelliten-so-schuetzen-sie-uns-vor-geomagnetischen-stuermen-1673572/,0,t3n.de,Sonnensegler-Satelliten: So schützen sie uns vor geomagnetischen Stürmen,"Forschende wollen ein System entwickeln, das die Erde möglichst früh vor geomagnetischen Stürmen warnt. Helfen sollen ihnen dabei Satelliten, die mit Segeln auf Sonnenstrahlen gleiten.
weiterlesen auf t3n.de",https://t3n.de/news/wp-content/uploads/2025/02/shutterstock_752393260.jpg,2025-02-22T14:05:00Z,,"Sonnenstürme können auf der Erde viele wichtige Technologien stören und so unter Umständen zu massiven Problemen führen. Deshalb arbeiten Wissenschaftler:innen stetig daran, Frühwarnsysteme für Weltr… [+2575 chars]",,de,'Sonne'
https://www.zeit.de/news/2025-02/23/regen-und-wolken-zu-beginn-der-neuen-woche,https://www.zeit.de/news/2025-02/23/regen-und-wolken-zu-beginn-der-neuen-woche,0,www.zeit.de,Wetter in NRW: Regen und Wolken zu Beginn der neuen Woche,Hier finden Sie Informationen zu dem Thema „Wetter in NRW“. Lesen Sie jetzt „Regen und Wolken zu Beginn der neuen Woche“.,https://img.zeit.de/news/2025-02/23/regen-und-wolken-zu-beginn-der-neuen-woche-image-group/wide__1300x731,2025-02-23T09:54:08Z,,"In Nordrhein-Westfalen müssen sich die Menschen zum Beginn der neuen Woche auf Regen einstellen. Am Montag sei es stark bewölkt oder bedeckt und nass, gab der Deutsche Wetterdienst (DWD) bekannt. Der… [+1144 chars]",,de,'Regen'
https://www.stern.de/panorama/schlittenfahren--unfall-mit-alkohol-beim-rodeln---deutscher-stirbt-35490558.html,https://www.stern.de/panorama/schlittenfahren--unfall-mit-alkohol-beim-rodeln---deutscher-stirbt-35490558.html,0,www.stern.de,Schlittenfahren: Unfall mit Alkohol beim Rodeln - Deutscher stirbt,Rohrmoos - Ein Urlaubsgast aus Deutschland ist in Österreich bei einem Rodelunfall schwer verunglückt und nun zwei Wochen später gestorben. Der,https://image.stern.de/35490560/t/Oe/v1/w1440/r1.7778/-/23--oavodezcvev16axs2048jpeg---f0f8a9369b750d71.jpg,2025-02-23T10:45:26Z,https://web.archive.org/web/20250223105907/https://www.stern.de/panorama/schlittenfahren--unfall-mit-alkohol-beim-rodeln---deutscher-stirbt-35490558.html,"Kopiere den aktuellen Link
Zur Merkliste hinzufügen
Es war ein feuchtfröhlicher Ausflug unter Freunden auf eine Skihütte. Für einen Mann aus Baden-Württemberg endete er tödlich.
Ein Urlaubsgast au… [+1027 chars]",,de,'Schlitten'
https://www.zeit.de/news/2025-02/23/unfall-mit-alkohol-beim-rodeln-deutscher-stirbt,https://www.zeit.de/news/2025-02/23/unfall-mit-alkohol-beim-rodeln-deutscher-stirbt,0,www.zeit.de,Schlittenfahren: Unfall mit Alkohol beim Rodeln - Deutscher stirbt,Hier finden Sie Informationen zu dem Thema „Schlittenfahren“. Lesen Sie jetzt „Unfall mit Alkohol beim Rodeln - Deutscher stirbt“.,https://img.zeit.de/news/2025-02/23/unfall-mit-alkohol-beim-rodeln-deutscher-stirbt-image-group/wide__1300x731,2025-02-23T10:45:26Z,,Ein Urlaubsgast aus Deutschland ist in Österreich bei einem Rodelunfall schwer verunglückt und nun zwei Wochen später gestorben. Der 41-Jährige aus Baden-Württemberg war mit Freunden für ein paar Tag… [+886 chars],,de,'Schlitten'
https://www.tagesspiegel.de/gesellschaft/panorama/schlittenfahren-unfall-mit-alkohol-beim-rodeln-deutscher-stirbt-13256227.html,https://www.tagesspiegel.de/gesellschaft/panorama/schlittenfahren-unfall-mit-alkohol-beim-rodeln-deutscher-stirbt-13256227.html,0,www.tagesspiegel.de,Schlittenfahren: Unfall mit Alkohol beim Rodeln - Deutscher stirbt,Es war ein feuchtfröhlicher Ausflug unter Freunden auf eine Skihütte. Für einen Mann aus Baden-Württemberg endete er tödlich.,https://www.tagesspiegel.de/images/13256224/alternates/BASE_16_9_W1400/1740307599000/rodeln.jpeg,2025-02-23T10:46:40Z,,Ein Urlaubsgast aus Deutschland ist in Österreich bei einem Rodelunfall schwer verunglückt und nun zwei Wochen später gestorben. Der 41-Jährige aus Baden-Württemberg war mit Freunden für ein paar Tag… [+1607 chars],,de,'Schlitten'
https://www.stern.de/panorama/oesterreich--deutscher-stirbt-nach-rodelunfall-in-schladming-35490578.html,https://www.stern.de/panorama/oesterreich--deutscher-stirbt-nach-rodelunfall-in-schladming-35490578.html,0,www.stern.de,Österreich: Alkoholisiert und schwer verletzt: Deutscher stirbt nach Rodelunfall,"Der Urlaub eines deutschen Touristen im österreichischen Schladming endete tödlich: Er starb, nachdem er sich betrunken auf einen Schlitten gesetzt und schwere Verletzungen zugezogen hatte.",https://image.stern.de/35490592/t/0R/v1/w1440/r1.7778/-/schlitten-oesterreich-unfall.jpg,2025-02-23T11:42:00Z,https://web.archive.org/web/20250223114707/https://www.stern.de/panorama/oesterreich--deutscher-stirbt-nach-rodelunfall-in-schladming-35490578.html,"Kopiere den aktuellen Link
Zur Merkliste hinzufügen
Der Urlaub eines deutschen Touristen im österreichischen Schladming endete tödlich: Er starb, nachdem er sich betrunken auf einen Schlitten geset… [+1091 chars]",,de,'Schlitten'
https://www.welt.de/vermischtes/article255513490/Schladming-Deutscher-stirbt-bei-Rodel-Unfall-in-Oesterreich.html,https://www.welt.de/vermischtes/article255513490/Schladming-Deutscher-stirbt-bei-Rodel-Unfall-in-Oesterreich.html,0,www.welt.de,Deutscher stirbt bei Rodel-Unfall in Österreich,"Ein feuchtfröhlicher Abend unter Freunden endete in einer Katastrophe: Eine Gruppe Männer jagte einem weggerutschten Schlitten nach, einer der Betrunkenen stürzte dabei schwer. Zwei Wochen nach dem Unglück herrscht nun traurige Gewissheit.",https://img.welt.de/img/vermischtes/mobile255513528/4227932607-ci16x9-w1200/Sicherheit-beim-Rodeln.jpg,2025-02-23T13:01:22Z,https://web.archive.org/web/20250223131035/https://www.welt.de/vermischtes/article255513490/Schladming-Deutscher-stirbt-bei-Rodel-Unfall-in-Oesterreich.html,Ein Urlaubsgast aus Deutschland ist in Österreich bei einem Rodelunfall schwer verunglückt und nun zwei Wochen später gestorben. Der 41-Jährige aus Baden-Württemberg war mit Freunden für ein paar Tag… [+845 chars],,de,'Schlitten'
https://www.n-tv.de/panorama/Deutscher-Urlauber-stirbt-nach-Rodelunfall-in-Osterreich-article25582913.html,https://www.n-tv.de/panorama/Deutscher-Urlauber-stirbt-nach-Rodelunfall-in-Osterreich-article25582913.html,0,www.n-tv.de,"""Einiges an Alkohol konsumiert"": Deutscher Urlauber stirbt nach Rodelunfall in Österreich","Ein 41-jähriger Deutscher macht mit Freunden Urlaub im österreichischen Schladming. Nach einem Trinkgelage auf einer Skihütte löst sich ein Schlitten der Gruppe und rutscht den Berg hinab. Der Versuch, das Gerät einzuholen, endet für den 41-Jährigen tragisch.",https://www.n-tv.de/img/incoming/crop25582922/2871327546-cImg_16_9-w1200/505819511.jpg,2025-02-23T14:56:48Z,https://web.archive.org/web/20250223150712/https://www.n-tv.de/panorama/Deutscher-Urlauber-stirbt-nach-Rodelunfall-in-Osterreich-article25582913.html,Ein 41-jähriger Deutscher macht mit Freunden Urlaub im österreichischen Schladming. Nach einem Trinkgelage auf einer Skihütte löst sich ein Schlitten der Gruppe und rutscht den Berg hinab. Der Versuc… [+1123 chars],,de,'Schlitten'
https://www.horizont.net/marketing/nachrichten/payback-rewe-war-ein-wichtiger-und-guter-partner-226044,https://www.horizont.net/marketing/nachrichten/payback-rewe-war-ein-wichtiger-und-guter-partner-226044,0,www.horizont.net,"Payback-Manager Dominik Dommick: ""Es gibt keinen Grund, schlecht über Rewe zu reden""","Zum Jahreswechsel hat Rewe die Zusammenarbeit mit Payback eingestellt - zugunsten des hauseigenen Treueprogramms Rewe Bonus. Im Interview erklärt Geschäftsführer Dominik Dommick, warum Payback trotz Konjunktur der Händler-Apps keine Zukunftsangst hat.",https://www.horizont.net/news/media/47/Rewe-war-ein-wichtiger-und-guter-Partner-463042.jpeg,2025-02-24T06:00:00Z,http://archive.md/20250224133907/https://www.horizont.net/marketing/nachrichten/payback-rewe-war-ein-wichtiger-und-guter-partner-226044,"Zum Jahreswechsel hat Rewe die Zusammenarbeit mit Payback eingestellt - zugunsten des hauseigenen Treueprogramms Rewe Bonus. Im Interview erklärt Geschäftsführer Dominik Dommick, warum Payback trotz … [+349 chars]",,de,'Jahreswechsel'
https://www.zeit.de/news/2025-02/24/wolken-und-regen-in-der-neuen-woche,https://www.zeit.de/news/2025-02/24/wolken-und-regen-in-der-neuen-woche,0,www.zeit.de,Regenwetter: Wolken und Regen in der neuen Woche,Hier finden Sie Informationen zu dem Thema „Regenwetter“. Lesen Sie jetzt „Wolken und Regen in der neuen Woche“.,https://img.zeit.de/administratives/sharing/fallback-image/wide__1300x731,2025-02-24T07:01:32Z,,"In der neuen Woche müssen sich die Menschen in Rheinland-Pfalz und im Saarland auf Regen und Wolken einstellen. Wie der Deutsche Wetterdienst (DWD) mitteilte, gibt es ab dem Mittag leichten Regen. Am… [+585 chars]",,de,'Regen'
https://www.faz.net/aktuell/gesellschaft/japan-extremer-winter-sorgt-fuer-viel-schnee-im-norden-110316712.html,https://www.faz.net/aktuell/gesellschaft/japan-extremer-winter-sorgt-fuer-viel-schnee-im-norden-110316712.html,0,www.faz.net,Der Norden Japans versinkt im Schnee,In einigen Städten liegt der Schnee mehr als drei Meter hoch. Der Wetterdienst warnt vor weiteren Schneefällen. Medienberichten zufolge sind in diesem Monat mehr als 20 Menschen aufgrund des Wetters gestorben.,https://media0.faz.net/ppmedia/aktuell/gesellschaft/2179985485/1.10316718/facebook_teaser/eine-frau-laeuft-ueber-eine.jpg,2025-02-24T07:44:26Z,https://web.archive.org/web/20250224074740/https://www.faz.net/aktuell/gesellschaft/japan-extremer-winter-sorgt-fuer-viel-schnee-im-norden-110316712.html,"Zwei Wochen nach einem heftigen Wintereinbruch wird in Japan vor neuen Schneefällen gewarnt. Der japanische Wetterdienst erklärte am Montag, in den zentraljapanischen Präfekturen Niigata, Ishikawa un… [+1479 chars]",,de,'Schnee'
https://www.stern.de/gesellschaft/regional/nordrhein-westfalen/regenwetter--regen-und-wolken-in-nrw-35493476.html,https://www.stern.de/gesellschaft/regional/nordrhein-westfalen/regenwetter--regen-und-wolken-in-nrw-35493476.html,0,www.stern.de,Regenwetter: Regen und Wolken in NRW,"Die Woche startet bewölkt, die nächsten Tage werden regnerisch. Auch am Karnevalsdonnerstag soll es nicht trocken bleiben.",https://image.stern.de/35493478/t/Gy/v1/w1440/r1.7778/-/24--bdrxbajimqv3axs2048jpeg---aada0f65fc688987.jpg,2025-02-24T08:52:44Z,https://web.archive.org/web/20250224091503/https://www.stern.de/gesellschaft/regional/nordrhein-westfalen/regenwetter--regen-und-wolken-in-nrw-35493476.html,"Kopiere den aktuellen Link
Zur Merkliste hinzufügen
Die Woche startet bewölkt, die nächsten Tage werden regnerisch. Auch am Karnevalsdonnerstag soll es nicht trocken bleiben.
In der neuen Woche mü… [+872 chars]",,de,'Regen'
https://www.zeit.de/news/2025-02/24/regen-und-wolken-in-nrw,https://www.zeit.de/news/2025-02/24/regen-und-wolken-in-nrw,0,www.zeit.de,Regenwetter: Regen und Wolken in NRW,Hier finden Sie Informationen zu dem Thema „Regenwetter“. Lesen Sie jetzt „Regen und Wolken in NRW“.,https://img.zeit.de/news/2025-02/24/regen-und-wolken-in-nrw-image-group/wide__1300x731,2025-02-24T08:52:44Z,,"In der neuen Woche müssen sich die Menschen in Nordrhein-Westfalen auf Regen und Wolken einstellen - auch am Karnevalsdonnerstag. 
Wie der Deutsche Wetterdienst (DWD) mitteilte, ist es zunächst star… [+734 chars]",,de,'Regen'
https://www.bild.de/sport/fussball/werder-bremens-werner-knallhart-wer-keinen-druck-abkann-soll-ins-freibad-67bc5c0e5cbd13341d0e4b97,https://www.bild.de/sport/fussball/werder-bremens-werner-knallhart-wer-keinen-druck-abkann-soll-ins-freibad-67bc5c0e5cbd13341d0e4b97,0,www.bild.de,"Werder-Werner knallhart! - Wer keinen Druck abkann, soll ins Freibad!",Werder Bremens Trainer Ole Werner hat nach drei Liga-Niederlagen klare Forderungen ans Team.,"https://images.bild.de/67bc5c0e5cbd13341d0e4b97/13a2c1ac358fe12dd4b759a6d9ff5d05,7282e55f?w=1280",2025-02-24T12:46:09Z,,"Die Klartext-Tage bei Werder-Trainer Ole Werner gehen weiter. Nachdem er nach dem 0:5-Debakel in Freiburg öffentlich seine Spieler anzählte, findet der Coach vor dem Pokal-Viertelfinale gegen Bielefe… [+120 chars]",,de,'Freibad'
https://www.transfermarkt.de/zu-hoher-druck-auf-werder-profis-werner-dann-spiel-im-freibad-mit-deinen-kumpels-quot-/view/news/450629,https://www.transfermarkt.de/zu-hoher-druck-auf-werder-profis-werner-dann-spiel-im-freibad-mit-deinen-kumpels-quot-/view/news/450629,0,www.transfermarkt.de,Zu hoher Druck auf Werder Bremen? Ole Werner: „Dann spiel im Freibad“,Der SV Werder Bremen kann im DFB-Pokal-Viertelfinale bei Arminia Bielefeld nahezu in Bestbesetzung auflaufen. Lediglich Abwehrchef und Kapitän Marco Friedl (26) fällt für die Partie...,https://tmssl.akamaized.net/images/foto/big/ole-werner-werder-bremen-2024-25-1733156304-155608.jpg?lm=1733156321,2025-02-24T14:15:25Z,,Der SV Werder Bremen kann im DFB-Pokal-Viertelfinale bei Arminia Bielefeld nahezu in Bestbesetzung auflaufen. Lediglich Abwehrchef und Kapitän Marco Friedl (26) fällt für die Partie beim Drittligiste… [+2065 chars],,de,'Freibad'
https://www.autobild.de/artikel/camping-die-besten-ziele-im-bayerischen-wald-27856427.html,https://www.autobild.de/artikel/camping-die-besten-ziele-im-bayerischen-wald-27856427.html,0,www.autobild.de,Was Sie im Bayerischen Wald gesehen haben müssen!,Wintertraum in Blau und Weiß: eine sonnige Reise durch Bayerns größte und schönste Natur- und Bergwaldregion.,https://i.auto-bild.de/ir_img/3/8/9/5/1/0/3/Eisstockschiessen-2869-5236x2945-27ae48fea64658fb.jpg?impolicy=og_images,2025-02-25T05:00:00Z,https://web.archive.org/web/20250225051629/https://www.autobild.de/artikel/camping-die-besten-ziele-im-bayerischen-wald-27856427.html,"Alpinski am großen Arber,Langlauf am Bretterschachten, Rodeln im Lamer Winkel: Der Bayerische Wald zählt zu Deutschlands Top-Wintersport-Destinationen. Kenner des Mittelgebirges wissen, dass es absei… [+31714 chars]",,de,'Natur'
https://www.zeit.de/news/2025-02/25/leichter-regen-und-schauer-in-bayern-aber-auch-sonne,https://www.zeit.de/news/2025-02/25/leichter-regen-und-schauer-in-bayern-aber-auch-sonne,0,www.zeit.de,Wettervorhersage: Leichter Regen und Schauer in Bayern - aber auch Sonne,Hier finden Sie Informationen zu dem Thema „Wettervorhersage“. Lesen Sie jetzt „Leichter Regen und Schauer in Bayern - aber auch Sonne“.,https://img.zeit.de/news/2025-02/25/leichter-regen-und-schauer-in-bayern-aber-auch-sonne-image-group/wide__1300x731,2025-02-25T05:38:36Z,,Auf dem Weg nach draußen können die Bayern ihren Regenschirm wieder mitnehmen - nasses Wetter ist in Sicht. Bereits für den Dienstagabend erwartet der Deutsche Wetterdienst (DWD) in Franken verbreite… [+923 chars],,de,'Regen'
https://www.zeit.de/news/2025-02/25/regen-nebel-und-schnee-wetter-in-hessen-bleibt-unbestaendig,https://www.zeit.de/news/2025-02/25/regen-nebel-und-schnee-wetter-in-hessen-bleibt-unbestaendig,0,www.zeit.de,"Wetter: Regen, Nebel und Schnee: Wetter in Hessen bleibt unbeständig","Hier finden Sie Informationen zu dem Thema „Wetter“. Lesen Sie jetzt „Regen, Nebel und Schnee: Wetter in Hessen bleibt unbeständig“.",https://img.zeit.de/news/2025-02/25/regen-nebel-und-schnee-wetter-in-hessen-bleibt-unbestaendig-image-group/wide__1300x731,2025-02-25T06:38:55Z,https://web.archive.org/web/20250226153506/https://www.zeit.de/news/2025-02/25/regen-nebel-und-schnee-wetter-in-hessen-bleibt-unbestaendig,"Die Menschen in Hessen erwartet in den kommenden Tagen wechselhaftes Wetter mit Wolken, Regen und Nebel. In höheren Lagen kündigt der Deutsche Wetterdienst (DWD) Schnee an und warnt vor Glätte.
Am D… [+1070 chars]",,de,'Regen'
https://www.zeit.de/news/2025-02/25/schnee-und-regen-im-land-trockeneres-wetter-in-sicht,https://www.zeit.de/news/2025-02/25/schnee-und-regen-im-land-trockeneres-wetter-in-sicht,0,www.zeit.de,Wettervorhersage: Schnee und Regen im Land - trockeneres Wetter in Sicht,Hier finden Sie Informationen zu dem Thema „Wettervorhersage“. Lesen Sie jetzt „Schnee und Regen im Land - trockeneres Wetter in Sicht“.,https://img.zeit.de/news/2025-02/25/schnee-und-regen-im-land-trockeneres-wetter-in-sicht-image-group/wide__1300x731,2025-02-25T06:58:44Z,,"Schneemänner bauen könnte in Baden-Württemberg bald möglich sein - jedoch nur in den höheren Lagen. Der Dienstag zeigt sich zunächst mal mit Regen und kurzen Gewittern, wie der Deutsche Wetterdienst … [+1001 chars]",,de,'Schnee'
https://www.focus.de/regional/wetter/wetter-nach-schneeregen-und-bibber-temperaturen-kommt-der-super-fruehling-in-den-sueden_7f4a1f6e-994b-497c-82e2-6e82c07166ca.html,https://www.focus.de/regional/wetter/wetter-nach-schneeregen-und-bibber-temperaturen-kommt-der-super-fruehling-in-den-sueden_7f4a1f6e-994b-497c-82e2-6e82c07166ca.html,0,www.focus.de,Wetter - Nach Schneeregen und Bibber-Temperaturen kommt der Super-Frühling in den Süden,In München sieht es für diesen Frühling nach sehr viel Sonnenschein aus. Auch die Temperaturen werden wohl mitspielen. Einzig der Ausblick für den späten Mai und den Juni könnten die Frühlingsfreuden noch trüben.Von FOCUS-online-Experte Jan Schenk,https://quadro.burda-forward.de/ctf/471337eb-3643-4edd-a2c3-370cc5b4a57a.83512b2e-81d1-495d-9c69-65bec54b5fee.jpg?im=RegionOfInterestCrop%3D%281200%2C630%29%2CregionOfInterest%3D%281052%2C650%29&hash=429ca34b0a9d124d3bd5bf450850b9eff2fa95d97ac24c5506cb916568e64036,2025-02-25T12:42:00Z,https://web.archive.org/web/20250225192144/https://www.focus.de/regional/wetter/wetter-nach-schneeregen-und-bibber-temperaturen-kommt-der-super-fruehling-in-den-sueden_7f4a1f6e-994b-497c-82e2-6e82c07166ca.html,Die Vorhersage für den Frühling ist eigentlich relativ einfach: Es wird warm und trocken im Süden Deutschlands - und damit auch in München. Besonders für März und April sind hohe Temperaturen vorherg… [+1691 chars],,de,'Regen'
https://www.zeit.de/news/2025-02/25/weichmacher-in-sonnencreme-behoerden-wollen-druck-erhoehen,https://www.zeit.de/news/2025-02/25/weichmacher-in-sonnencreme-behoerden-wollen-druck-erhoehen,0,www.zeit.de,Gesundheit: Weichmacher in Sonnencreme - Behörden wollen Druck erhöhen,Hier finden Sie Informationen zu dem Thema „Gesundheit“. Lesen Sie jetzt „Weichmacher in Sonnencreme - Behörden wollen Druck erhöhen“.,https://img.zeit.de/news/2025-02/25/weichmacher-in-sonnencreme-behoerden-wollen-druck-erhoehen-image-group/wide__1300x731,2025-02-25T16:47:58Z,,"Nach dem Fund von gesundheitsgefährdenden Weichmachern in Sonnencremes wollen die Behörden den Druck auf die Industrie erhöhen. Hersteller sollen zunächst auf freiwilliger Basis dafür sorgen, dass di… [+3407 chars]",,de,'Sonne'
https://www.zeit.de/news/2025-02/26/grauer-himmel-und-regen,https://www.zeit.de/news/2025-02/26/grauer-himmel-und-regen,0,www.zeit.de,Wetter: Grauer Himmel und Regen,Hier finden Sie Informationen zu dem Thema „Wetter“. Lesen Sie jetzt „Grauer Himmel und Regen“.,https://img.zeit.de/news/2025-02/26/grauer-himmel-und-regen-image-group/wide__1300x731,2025-02-26T04:52:06Z,,Die Menschen in Berlin und Brandenburg müssen sich auf regnerisches Wetter und einen grauen Himmel einstellen. Bei einer Höchsttemperatur von zehn Grad ist tagsüber an einigen Orten mit Regen oder Sp… [+728 chars],,de,'Regen'
